,parent,file,context
0,s1,0048_0048," Heineinen, Christer Simson Silfwoin, Hein- rich Mustapää och Henrich Rannin af hwilka han En Biörn huudh hand- lat, och En R:Dr i betahlningh budit, dhen dhe eij mothtaga wellat, ty effter han En aff dese"
1,s1,0053_0053,funnit sampt huden litet afrifwit warit medh på Rona och Wänstra sidan sade dhe fattat dhen meningh att hon af männe
2,s1,0393_0393,an Johan Mutha an- gående 1 Tulla Tobackz bårtstiählande af des dreng- Påicke Jumpain H:r Christian Huudz Rådmans i Nyen fordring af Erich Tuckin Tuckia Item H:r Huuss fordring af G.ders Neufwoises Erfwin
3,s1,0421_0421,"he inga witnen uti denna dheras handel hafft, att han då wedh kiöpet tillsagdt henne 3 D:r för hwar hudh, och at hon där till gifwit honom 7 D:r 10 ö: K:r mt i Peningar, helst hon icke wetat sielfwa, hemm"
4,s1,0421_0421,"åsom Ryssen Offanatioff emoot deße 40 D:r han hade att fordra af Climpo för Jufft, bekommit 13 st:n hudar à 3 D:r är 39. Dr och Peningar 7 D:r 16 ö: K:mt:, som giör ihoop 46 D:rs 16 /: och såledz fått 6 "
