,parent,file,context
0,Kexholm,0133_0135," när dhe hit till Kexholms hampn komma skulle; hwarföre prætenderer b:r Rådman dher uppå, att honom mått hans Salt restitueras, och all hinder och skada som som dher aftagit hafwer måtte honom refunderas "
1,Kexholm,0147_0149,"h begierke att Johan Person skulle dant bewijsa, att hon hafwer honom smöret medh orätt nicht ifrån mått, Rådet begierte att Smöret måtte uppwägas på Rådstugun thi samma bytta och kappa, som det wart Rådm"
2,Kexholm,0172_0174,"C uthföra, begierandes att H:r Berens rätta nu bewijsa, hwad han Wällb:ne H:r landh= höfdingen till mått hafwer, nembl. att Wähll H:r Landzhöfdingen skulle låta inhämpta Aren- datoren Andres Grabbe, som s"
3,Kexholm,0202_0204,"tt hur antwort, des sig ders bäuren Johan Johanson Orawa, inneren helb 14 taga contentinen will, wo mått och biet- sig sigh ifr huus hu wärdaren leßen undt mit Jacob Grelson hat sin accordiet auff en mona"
4,Kexholm,0239_0241,"rmått hästen att hänger behålla i dy hafwr han och längre hon tyle för undt, bewierandes att bonden måt till sin rött förhielpas. Bonden Staphan Theri säger; att hans Son hafr såtsom hans wetskap och för"
5,Kexholm,0263_0265,"andt som i nu säger? werste icke iag sielf då till Narfwen, och war der så många dagar, Jag hade ju mått kunna sidt eder? elliest och hade i intet hafft behoff att reesa färan myhl uthi från Narfen 262"
6,Kexholm,0295_0297,"ntet hafwa gifwit: då hafwer Påwel be- at bruka innan, och sagt betala mig mitt Omet tiagh hafr opp mått till salt? hwar på Staphan hade swarat: att emädan duäst båtz nan, så bör du och hafwa omak för sak"
7,Kexholm,0347_0349,"uls tes, och war intet uthur boden, kom och dijt Co Warg, med Hinrich Kierhoin, sädan dee 4 Dr hade mått; Men Clas Werg gick bartsädan hoos hade talat med sin Son; gå om hon hade sagt sin sammerat Johan H"
8,Kexholm,0384_0386," intet wädhe deraf eller hafwer befalt Torawigz Ryttare om sådant at fråga. Dito begierte Huuken at mått annoteras det Roslindt inkom medh twenne drängiar, hwilcke begge hafwa hafft wärier oppå sigh; Och "
9,Kexholm,0534_0536,"omsijdor legat med henne i lönskelägor i twå åhr, in intet aflat med henne något barn, beder at han måt tillhållas att fullborda sin Låfwan, effter han intet an- weth med henne än ära och gådt. Swaranden"
10,Kexholm,0592_0594,"tta blef alt påbudit widh 40 mk:r wijte. Wijdare blef Borgerskapet förmanat att bruka den richt och mått som wanligit warit, der någon öfwer¬ trädes att bruka medh Bessman Tunna eller känna måhl något det"
11,Kexholm,0592_0594,"nna eller stap, den skall sökia der om Rådman Hindrich Michel sson, hwilken förordnat ähr wicht och mått här i Staden att justera och rätta. Alt enödigt inhyses folck förmantes Borgerskapet ifrån sigh ska"
12,Kexholm,0594_0596,"lighandell, så att der nog pröfwes kunna för samma  19 Arrende wara responsabel der Pirhoin i någon måt- ko skulle komma till kårta, altså blef detta effter begäran Pirhoin till et bewijs medhdeelt och E"
13,Kexholm,0607_0609," mz Nilsmanß... 19 Nils Dominer emot Cosma...... 39 p  Påbidh om Karkosten om brandwacht, Wicht och Mått, löst folk: 14: 1 Ransakninge om Johan Chiers försåldskompt till  20 Henrich Michelss och Anders Pi"
14,Kexholm,0670_0673,"a, huilket som han dhet ey præstera kan helst alt bem:te Redskap hörde helfften Auken till och i så mått opå sin egendomb ey kan beskyllas att hafwa begått någon tiufnadh deß föruthan haar Johan Re der fu"
15,Kexholm,0786_0789,"ll i lagen åsatte böter frij doch till föllie af Kongl: Maij:tz Uthgången förordningh och Placat om mått och Wicht 6. Wicht, af den 10. Martij 1665. fälles han till arbitralte Straff att erläggia till Kex"
16,Kexholm,0934_0937,"16: ⁒ Smt. 10: Den 10: dito. Uplästes Hans Exell:ttz Generalens Breef, det: d: 2: Octob:r, angående mått och wichtz Justerande och rättande effter Swenskt mått och wicht. 10: Petter Mattzon och Hindrich T"
17,Kexholm,0934_0937,"neralens Breef, det: d: 2: Octob:r, angående mått och wichtz Justerande och rättande effter Swenskt mått och wicht. 10: Petter Mattzon och Hindrich Thomasson förlijktes för Rätta angående een koo, som Pet"
18,Kexholm,0936_0939,"Hindrich Ojalainen proberat och inhämptadt dih- ferencen, emellan een af Mätare nylagen och löös af mått tunna, att Rågen effter löösmåhl swarar emoth een inslagen struken tunna, welandes H:r Ränttemest:n"
19,Sordavala/s1,0007_0007,"app:r hemma medh sigh mät i Säcken, men här man 18 bekommit, slutandhes således Taskins Nelick el:r mått aff 4 Capp:r hwar medh han måtte, stoor warit, klagandhes han Tillikain an för oredt mått, hälst ef"
20,Sordavala/s1,0007_0007,"lick el:r mått aff 4 Capp:r hwar medh han måtte, stoor warit, klagandhes han Tillikain an för oredt mått, hälst effter intet Stadzens Märke oppå Nälikan warit, Taskin swaradhe alldrigh honom bewijsas skal"
21,Sordavala/s1,0008_0008,"a i Säcken mätt och medh hwadh kärill, då förrehöltz Taskin att han orätt giordt i dhet han omärckt mått brukar och att dätta wore straff wärdigit, swaradhe han sigh först dhen Nälick giöra låtit, och med"
22,Sordavala/s1,0008_0008," sigh först dhen Nälick giöra låtit, och medh högt bedyrandhe sadhe sigh aldrigh någen hwarken medh måt el:r wicht tänkt bedraga el:r skada, mindre att han skulle sådant giordt häller föröfwat. Sent: Eme"
23,Sordavala/s1,0189_0190,". till höst, kommit ifrån Ingermanlandh hit till Godzet och Staden begiärandes att henne tillfråges mått hwar ifrån hoon kommer, sampt 2. hwadh för bewijs hoon hafwa kan, ifrån henne, kånan swarar och ber"
24,Sordavala/s1,0211_0212,"- ken Mutka först klagat, begierte att han Mutka för dess obewijsli- ge beskyllningh och angifwande mått afstraffadh blifwa? Mut- ka R:de, att emedan som han lefwer i träta medh honom, som Uthi een slagzm"
25,Sordavala/s1,0213_0214,"ar gardh, hwar öf:r Råd- mannen Martinus Canuti skal, som för  detta, opsickt hafwa och det i lihka måt- to, så frampt dem kiärt ähr, att Undwij- ka dett straff som för dheras mootwil- ligheet kan påföll"
26,Sordavala/s1,0244_0245,"gr Uthgifwit och Underskrif- wit af d 23 Juli förwekne, begiärandes  kyrkioherden Thoranius att det måt- te ransakat blifwa huru hoon den då när dhe bem:te Citaon dijt burit swarat? Då R:de så wähl Skole"
27,Sordavala/s1,0356,"lförende, att hennes Mans 123 D:r K:r M:t som   han Sterbhwset, för dheras sammankombst, försträckt måt-  te blif:a af dhe Penningar som sidsta handeln af sigh kåstat   och uthi Seqvesto satte ähro, beta"
28,Sordavala/s1,0360-83,"i Landet får sigh wittnesbörder skaffa och bewijsa det  aldrigh för om hans beswikande i Wicht el:r Mått wa- rit klagat mindre påbeskyllat, hwilket honom icke för- wägras kunde, hälst och eftter desse åkl"
29,Sordavala/s1,0360-83,an Walllius och Isack Mackoin förordnades  af Rätten at noga efttersee här i Stadhen Borgerskapetz  Mått och Wicht och jembföra dhem medh Sordawala hofz  på det allmogen el:r någon annan icke finge orsak 
30,Sordavala/s1,0394_0394,es Borgare Eedz afläggiande Johan Jöran Mårthensons bewijs om des förehållande här Stadhen gerskapz mått och Wicht Jacob Johan Fol: 4: 5: 7: 21. 26: 28. 32: - - re 41: 42. 43: Johansson komans bewijs om d
31,Sordavala/s1,0421_0421,"un icke aldeles wetat uthaf, helst sielfwa Sum- man af handeln flytande, har han nembl:n Climpo för mått aff fordom Rådman Sahl. Martino Canuthi, uti då Borgmestarens fråmwahro Arrest hoos sig på dhe lius"
32,Sordavala/s1,0423_0423," dy H:r Slåtzfougden låtit fängzla honom, till des han skulle förnöija Brun, hwilcket han icke för- måt giöra, oansedt han under denne wachten månge uthwägar där till söökt, sedan han dy effter med följa"
33,Sordavala/s1,0485_0485,"äst förmantes samptl:e Stadzens Borgerskap, att  dhe låtha forderligast probera och justera dheras  Mått och Wicht hoos Rådman Mårthen Taskin, som  det att giöra anbefalter är af Rätten; Och den som  betr"
34,Sordavala/s1,0485_0485,"  det att giöra anbefalter är af Rätten; Och den som  beträdes här effter att haf:r orätt wicht och Mått,  sedan dhe nu således blifwit tillsagde måge icke  förebära någon owetenheet här uthaf, men hafwe "
35,Sordavala/s3,0017_0018,"ioffs Attester [1]691 in Julio daterade, hwilcka förmäla  att dhe ingen orichtigheet medh wicht och Mått i någon handel  eller elliest af Immoin förspoort då dhe utj många Åh:r medh  honom handlat och dhe"
36,Sordavala/s3,0018_0019,"ch berättelser, att dhe all den tijden honom medh dhem handel hafft, intet Sweek eller Bedyägerij i Mått och Wicht med honom förspoordt, och 8:o Aflade Imoin, deße skiähl föruthan till öfwer- flödh att be"
37,Nyen/RO_1684-1687,0016_0016,"sällja öhl på otillbörligit ställe, och medh ett orättmä-  tigt mått: Reus Exciperade detta wara skedt uthaf hans hustru uthi hans frånwahro, berättandhes der jämpte si"
38,Nyen/RO_1684-1687,0016_0016,"nstop Sententz Effter som borgaren Erich Närman har låtit sällja öhl på olofligit ställe medh olaga mått, och der till intet kan neka, altså dömes han denne gång, allenast till halfparten af ordinarie Str"
39,Nyen/RO_1684-1687,0018_0018,"Contra S:r Diedrich Blom Swarandhe; Die 21 Aprill, Actor klagar at swaranden bruukat Träästoop till mått uthi sin krogh, emot dhen förordning som Borgmästare och Rådh hafwer låtit som åfftast publicera at"
40,Nyen/RO_1684-1687,0019_0019,"underslef som medh trästoop kan föregå emoth rätt Swänskt mått; Rius exiperar sig hafwa et Tenstop i huuset, men intet wist der af, at dhet änteligen skulle behöf"
41,Nyen/RO_1684-1687,0019_0019,"t på Predikstohlen publicera dhet i Krogerne till at förekomma alt undersleef, skall hållas Swänskt måt och tenstop; altså kan Swaranden S:r Die- derich Blom med dess enskyllan, sig intet hafwa wist af s"
42,Nyen/RO_1684-1687,0023_0023,"ndhe C: Pavo Ropponen Swarandhe, Die 18 Junij Actor: klagar at Swarandhen har bruukat Trästop- till mått uthi hans krog, emoth borgmästare och Rådz förordning; Reus: han har intet ännu kunnat få Tenstoop "
43,Nyen/RO_1684-1687,0023_0023,"ll Kiöpz; Sententz. Alldenstundh Swaranden Pavo Ropponen sielf till- tår, sig hafwa bruukat olofl:t mått uthi hans Krogh altså dömes han denne gången allenast till 20 mkr: Silfwer myndt, såsom halfparten "
44,Nyen/RO_1684-1687,0153_0153,"åter igen fram och förmantes at giöra gudh den ähra och be- tänkia sin Sahlighet, uthsäijandes i så måt- to fulla Sanningen, men hon framher- dade alt stadigt wedh sit förra taal och nekande, swärjandes "
45,Nyen/RO_1684-1687,0208_0209,"ethafft samma prætension at bortförähra har dhet och aldrig giordt: klagandhe begärte, at S: Stewen måt- te här öfwer edeligen afhöras, hwilcken förmente at han inthet kundhe constringeras at beswäria si"
46,Nyen/RO_1684-1687,0214_0215,"s förhör Extraderat; och dem tillsagdt, at om dhe förmena des föruthan hafwa några Wittne, dhe dhem mått med det första fram, skaffa dhet Saken uthan uppehåld må komma till Sedskap vid p: 40-"
47,Nyen/RO_1684-1687,0261_0262,"rs Arfwingars wägnar Beswärade sig åther öfwer Rådman H:r Blaӕ kenhagens uth blifwande, och at i så mått, Saken kommer numehra och mehra uti wij Ryfftigheet; vid: p: 145. Stadz Fiscalen Matthias Atmenius "
48,Nyen/RO_1684-1687,0263_0264,"eropandes sig för det öfrige Referent på Lieutnant Åckerfeltz dreng Carl som hade jämwäl fått orätt mått på Toback med som ma besmar, iämwäl på Rådztienaren Johan Sergeioff som hadhe hördt af een Ryss säi"
49,Nyen/RO_1684-1687,0298_0299,"t ey heller der af weeta; dess lijkes be- tygade konan Karin Johans dotter, sigh aldrigh hafft i så mått till giöra medh Hinrich Larson; S: Jost Steren Gifwer förmedelst een Suppliqve tillkenna; huru såso"
50,Nyen/RO_1684-1687,0312_0313," nästkommande Michaelis på helfften, och andra helfften till Juel, säijandes Cumming, at Debbin; så mått, förledt. Walkat medh sitt osanne föregifwande emedhan han intet ärnar sig at resa tillhollandh; St"
51,Nyen/RO_1684-1687,0385_0386,ch tillstår sig wara af dem i alla måtto dull- komligen förnögdt och richtigt betalt; hwilcket i så mått opå slijtels och Erlands begäran; Stads Protocollet blef för tecknadt Rådsman Jürgen Wälffert avera
52,Nyen/RO_1684-1687,0423_0424,"dagmorgon sändt sitt folk, uth till Possola bodar- ne, som der underwarande gudztienst, Saltet uth- måt och lefwererat, och effter witnens uthsago icke kommit för än under Predikan tilbaka i Sta¬ den; Me"
53,Nyen/RO_1684-1687,0479_0480,"för- re poike Herman Stummer utj denne Rätten ingif- wit hafwer, och beder att Actor och dhe sinige måt- te blifwa straffade för det dhe emot honom för- öfwat, och Leus berättar med 6 giltige witne hafwa"
54,Nyen/RO_1684-1687,0487_0488,"örstådt dess meningh rin måhlande, begiärandes Valentin för det öfrige, att Buscherts skrifft honom mått ex- traderus att swara der på nästkommande Rådstugudag, hwilket blef honom bewil- Liat. vd: fol: 29"
55,Nyen/RO_1684-1687,0505_0506,"ngen re- ste igenom denne Staden, hafwa hördt att een Rådman härsammastädes wore, som brukat falskt mått. Rådstienaren Erich blef om detta tilspordt som swarade sig blifwit een och annan gångsend af geric"
56,Nyen/RO_1684-1687,0522_0523," af honom hördt hafwa; Ty Räntemestaren berät- tor sigh intet tahlt om orätt wicht uthan om o- rätt mått, påminnandes sig Reus, att Sahl. H. Öfwerste Morath af honom fådt een Mäthtun- fa, som han förmeent"
57,Nyen/RO_1684-1687,0533_0534," härsamma, städes Hinrich Frisius, till hwilken bem:te Salt war sändt; hålla sig för dhe 15 T:r min Mått på hela Skutlasten wid klaganden, lijka som han dem hade förkommit, der lijkwäl ähr befunnen att de"
58,Nyen/RO_1684-1687,0534_0535,286 mindre mått än han emottagit. Klus beropar sig på witne sådant annorledes att bewijsa. Den 3 Dito vid: seq: Ski
59,Nyen/RO_1684-1687,0548_0549,"a. Samma Supplique blef Sahl. Timmermans Enkia tilsändt. Wijdare anhölt bem:te Blix, att deß syster måt- te een Rekning gifwas om hennes Sahl. Mans löhn, blef swarat att Stadz Cassa Räkningar skall effte"
60,Nyen/RO_1684-1687,0560_0561,"erföre blifwit saakfält, och nu be- 338 befinnes att samma trästoop ähr mindre än ordinarie swenskt mått. Rea swarar sig samma Stoop förleden Måndagz hafwa fådt af sin huusbonde handelsmannen Nicolaus Wal"
61,Nyen/RO_1684-1687,0560_0561,"ren M:r Christopher Loreptz hu- stru beswärade sig att hafwa fådt af Swa- randen Öhl med ett mindre mått, om andra Stadzkrögare bruka. Swaranden nekar intet der till, uthan säger att emedan hennes huusbon"
62,Nyen/RO_1684-1687,0566_0567,g kiöper Peter Wanhains gård.. 199. Bent Paulson emot Hinrich Frisius angående Skips Fracht och min mått....... _ _ _ hent Copga låter een dess quitantz verificera 300 Christina Andersdotter anklagas för 
63,Nyen/RO_1684-1687,0570_0571,åhl 154 165. Peter Ryter Kiöper Sahl. Lars Anderssons gård  222. Passen Anna anklages för olofligit mått i krogen 337. Paul Paulson anklagas för lönskeläger –. 68. Pawo Koppon anklagas för Landkiöp R. Rob
64,Nyen/RO_1692,0009_0009,"if- låfwat, derföre råder han Borgmest:n icke; begä¬ randes bem:te Borgmest:n wijdare, att Fiscalen måt- te giöra sitt Embete i detta måhl emot Bröker. Bööker begärte, emedan Borgmestaren wil stryda til "
65,Nyen/RO_1692,0010_0010,"ch emedan han än intet uthfådt den här till håldne Ransakning i detta måhl, ty begärte han, att den mått honom extra"
66,Nyen/RO_1692,0018_0018,"an- gående injurier, Anders Åkerlundh Michel Siwonen angde Slagmåhl mitt igenom, bekiandes att Reus mått; derföre ihu- 27 kommas effter Lag, och betala honom des swada och wärk, sampt upfylla des förorsak"
67,Nyen/RO_1692,0023_0023,"son badh att samma gårdzböra, jempte och des andre gårde- kifr med Johan Gilliesson nu andra gången måt- te upbiudas. Dottin beswärade sig, att i fäll samma M:r Regeborg gårdh honom skulle undgå, hade ha"
68,Nyen/RO_1697,0035_0036,"h med någon fremmande den tyden bedrifwit otucht, uthan hade hoon Barnet med sin man aflat. I lijka måt- to nekade och lyssbetas Moder sig således tahlt, som Anders berättadt, uthan som så wähl Anders, s"
69,Nyen/RO_1697,0087_0088,"it effter wågordningen, än 46 L℔. 18 mkr, uthan twert emoot Kongl. Mayttz Förordning de A:o 665, om Mått och wicht to m uthsåldt med syndare, och således Stadzens Inkombster försnillat, skolandes desse Ju"
70,Nyen/RO_1697,0102_0103,"dt, och honom således till heder och Embete angripit, Fördenskull anhåller Fiscalen att han derföre måt- te effter Lag corrigeras, sampt Tobaket confisceras, som sielfwa Skrifften ad acta det wijdlyfftig"
71,Nyen/RO_1697,0103_0104,"örsuttit, och icke betalt honom effter Ciembnär Rättens doom, som han af Johan Nyman inlöst, han nu måt te imponeras att affträda gården; Men så pröfwade Rätten skiäligit, att Pappinen till öfwerflödh ef"
72,Nyen/RO_1697,0120_0121," denne förskrifning till hans Barns säkerheet kunde Proto- collo insereras, förbehållandes sig i så måt- to på det krafftigaste all den Rätt och för- måhn, som slijke fordringar effter Lag fram för andra"
73,Nyen/RO_1697,0124_0125,"prompt Execution på sin hoos Botmgardt lofwande fordring, så an- håller Bergen, att ingen Execution måt¬ te bewillias eller för sig gå, innan han fådt sitt fult uthafelst denne fordringen som Friel Öker "
74,Nyen/RO_1697,0130_0131,till hans säkerheet kunde inprotocolleras effter som och Rådmannen honom alla bene ficia Juris i så mått på det krafftigaste wille hafwa förbehåldne; hwilket Rät ten in quantum Juris lät förtekna. Ao: 169
75,Nyen/RO_1697,0131_0132,"wist det han icke wetat Capit: wara een fremmande, med begiäran att Fiscalen för ohemult angifwande måt te ihogkommas och han för dess tilltahl, befrijas. Rätten pröfwade skiäligit att det ta ährende böö"
76,Nyen/RO_1697,0149_0150,290. och att alle dess Creditorer till den ändan måt- te emoot en wiss tijd hijt instämbde blifwa; Fördenskull och som denne dess begäran pröf- wes wara
77,Nyen/RO_1697,0165_0166,"uthan skiäl och temere appellerat, och samhåller fördenskull att nu effter åth intet mehra af honom måt- te emoottagas, uthan Ciembnär Rättens doom, så wijda den tienar för honom /: Bomgardt :/ confirmer"
78,Nyen/RO_1697,0181_0182,"m dhe tillijka med een nu förrymbd Tiufpoike, hoos dess Maat- moder skola begådt, bediandes att dhe måt- te beläggias med Laga straff. Kånorne tillstodo att dhe af den förrymbde Tiuf- poiken, hwilken dhe"
79,Nyen/RO_1697,0224_0225,leuren Schening der e- moot något skall willia inwända; altså badh fullmechtigen det sådant nu skie måt- te. Controleuren Schening insände igenom för detta Munsterskrifwaren på Nöteborg Hinrich Narman ee
80,Nyen/RO_1697,0256_0257,"n till dess de fingo omhugsa sigh, huru wijda dhe kunna sökia wij dare. Fiscalen påminte att Walter måt- te stella för böterne någon säkerheet; hwilken sig tillbödh att willia gifwa"
81,Kajana/RO_1659_1699,0107_0107,"l underdånigheet igenom Bårgmestaren Wäl:t Hen- drich Corte Supplicando anhålla och bidia, att dher måt- te blifwa handhåldne wedh Stadzens privilegier och hans hög Grefl. N.s muntelige befalning, emedan"
82,Kajana/RO_1659_1699,0127_0127,tienaren igen bekommit hafwer; begärandes och Skoma- karn som sådant emoth tagit så wäll som tyfwen måt- te effter Lagh plichta: Knöpi tilfrågades; på hwadh ställe Han dem tagit? Han swaradhe at han förs
83,Kajana/RO_1659_1699,0205_0205,"rna, men Stadz Tiänare intz det ringaste uthan tiena pervices, och nästan hwart åhr om skifftas. 4. Mått och wicht observeras och noga effter, richtig Justeringh, hwilket och Commendantn besannade"
84,Kajana/RO_1659_1699,0209_0209,"1. Bårgerskapet blef tillfrågat om de haf.a något beswär öf.r mått och wicht, antingen mindre eller större, de swarade sigh nu intet hafwa uthan sådane äre Justerade "
85,Kajana/RO_1659_1699,0223_0223,"e måhl straf- fet således, att hon plichtar j Stadzens Kista Ett dygn. Tillfrågades Borgerskapet om Mått och Wicht uthi Staden. hwar till dhe swarade att sådant nu Nyligen inttet blif- vit besynat, dy til"
86,Kajana/RO_1659_1699,0230_0230,"tring, dher dhe lijkwähl widh befästningen betarf- was, begierandes samptl. Borgerskapet att här om måt- te i Ödmiukheet tillkenna gifwes, som och Lagen lijkmä- tigt LandzKiöpet blifwa förtagit, förmedee"
87,Kajana/RO_1659_1699,0281_0281," hwarest hafwer warit, hon sade wj woro med Wäyrynen och Maisa- ses Caisa till hoopa förledne Påska mått, då begärte Säyrynen ett stoop öhl i badstugun, det iag och honom hämptade, sedan inkom Näisänen oc"
88,Kajana/RO_1659_1699,0293_0293,"fwer Malin Ers dotter som skulle hon nu nyligen inbergat et Engh stycke wjd Wimbel åhn om ett halff mått höö; Malin swarade detta ej wara å wärckat på hans Engh, uthan upskurit nå- got höö emellan stubbar"
89,Kajana/RO_1659_1699,0296_0296,"ans från wahro och hustrons siukligheet honom afnembdt uhr huusen 1/2 T:a korn, 1 stycke sleda, ett mått höö, 2 lb:d bröd, 1 ljten häst klåcka, sampt ett st: ljtet biörnskin som"
