,parent,file,context
0,Kexholm,0070_0072,"bia Lasse, huru såsom han, af hennes Sohn, een häst för 36 D. K: M:t kiöfft hafwer, producerade een räkningh at borgaren bleef henne skyldige 27 D. 25½ öre K. M:tz, heremot bewijste Tobia Laße sin Contra räc"
1,Kexholm,0070_0072,"ingh at borgaren bleef henne skyldige 27 D. 25½ öre K. M:tz, heremot bewijste Tobia Laße sin Contra räckningh på 33 D. och 18 öhre, föruthan de Perzeler bondh hustrun icke will bestå sigh hafua bekommit, Nemb"
2,Kexholm,0070_0072,"ichsdotter præsen- terade sigh wilia gå Eedh at hon samma Pertzeler icke skyldigh war, eller effter Räckninghen undhfådh hafuer dij sadhe den loflige Rätten, det Tobbla Lasse, bondhe hustrun Margreten 15 D. K"
3,Kexholm,0113_0115,"iöra, Emedan för detta Stadz Secretarien Wäll:tt Erich Arfwidßon litzen, samme gård å sin lööns och rächningh bekommit hafr. Anbelangandes dhe 64 Dr kopp:r som præsenderes att Sal: Claß Christersons Enkia, sk"
4,Kexholm,0127_0129,"xholm lefwerera; Men emedan sådant icke effter kommet är, hafwer Rentmästaren begiert Arrest till afrächningh på sin prätension, dhe 100 Dr Kop:m:t som Perwoi Mitrioff honom, Unhagen, skylldigh är N:o 3. d 18"
5,Kexholm,0130_0132," igenom sin son Erich düster, öfwer lefwererat. Dito Inlade Rådmannens Son, på sin Anders wägnar En rächningh emellan sin fader och handelsmannen wäcktt Hans Mortomeer. Om desse parters prætensioner wart opph"
6,Kexholm,0137_0139,"lm och sädan ifrån Kurkijocki och till Kexholm ehrläggia böör. No. 25. Dito Inlade Simon Larsson en räckningh uppå nå gre Partzeler, som Henrich Jöranßon pijpa, skulle blifwit honom skylldigh, bestående i 43 "
7,Kexholm,0143_0145,"z prætension som han hade Till Borgaren Jacob Brusson, för åtskillige Part= zelen, som hans inlagde rächningh uthwijsar, bestående uthi pgr 88 Dr 28 öre Kop:r M:t. här om tillspordes aff Retten b:r Borgare Ja"
8,Kexholm,0148_0150,"chelßon, Lars Larßon p Lamskom Borgaren ifrån Sordewalla, Mäntt öran Meyer inläggiandes i Rätten nu rächningh wet Arendatoren Andres Grabbe, ahngående någre ortzeler, som b:te Grabbe honom afftagit hafr om up"
9,Kexholm,0148_0150,"; hwilket skedde när Meijer honom en Wexel frå på Evert Huch i Skantzen, hwar medh Grabben wo- på afrächningh Content, hwilket och Meijer effterkom exelen bestående af 1 200 Dr K:mt Men wart honom henne Wexel"
10,Kexholm,0148_0150," blifz hwijd sijne 100 ¾ Dr Km:tt hwilken grööra sigh af 24 ℔ smör, sampt någre andre Part- ler öfr rächningens uthwijsande, som Grabben honom är i Kexholm tillsade, och i Sordewalla tin att lefwe- ma, hwar p"
11,Kexholm,0167_0169,"ör. Medh denne saaken bleff upphutit till dess Casper Martin af Huken på inlefwererat godz -richtig rächning inlefwereras kan, och hwad ähnnu protesto finnes; så wäll som hu- ken om denne saken notificera. Di"
12,Kexholm,0172_0174,"ll nästkommande Juul betala och Contentera. N:o 43 Dito framlade Handelßmannen Hans Morto- meer, en rächning emot Josep Matzon, hwilken gield Sal: Johan Lyhapä wore skyldig till handelß- mannen i Skantzen wäl"
13,Kexholm,0179_0181,"Blankenhagen sade nöij, att han in- gen betallning bekommit hafr Då framlade freßen Blomkenhetrenne rächningar, hwar uthinnan befans, honom stun- dom högre och stundom lägre werderningarnij i godzet uppsatt /"
14,Kexholm,0179_0181,"m lägre werderningarnij i godzet uppsatt /: förstämdes detta, att han fört helerna i den förstgifne rächningen mindre wärderat hafwer, ähn han såsom ne Partzeler i dee seder mehra giordt månde :/ så wäll som "
15,Kexholm,0179_0181,"der mehra giordt månde :/ så wäll som dett, att han på sitt godz något uppburit hafr dett huus egen rächning uthwijsar. Dito begierte Parterne, att dee hwarannan Rächningar igenomser måtte om en fast den dher"
16,Kexholm,0179_0181,"dz något uppburit hafr dett huus egen rächning uthwijsar. Dito begierte Parterne, att dee hwarannan Rächningar igenomser måtte om en fast den dher twistade om, till nästkommande Råd stugu dag, hwilket dem och"
17,Kexholm,0179_0181,"n dher twistade om, till nästkommande Råd stugu dag, hwilket dem och effterlätz, och be- faltes dem rächningarne igen i Rätten inlefrerera. D 10 dito wed ord: Rådstugu dag när- warande på wällb:ne H:r Landzhö"
18,Kexholm,0179_0181,"rese ända skulle och gaf tillkenna, att han hafwer förlijktz med Postmästaren Jochim Freße om sijne rächningar, att dher nu intet dher om hafwa att säga mehr. Sentent."
19,Kexholm,0189_0191,"et underhålla skulle till b:te under han tribuera kunde, wille b:te Borgare honom effter en richtig rächning deedeligen Contentera för obligerandes sig en för alla, och alla för en ståå willia hwickan på åter"
20,Kexholm,0189_0191,"ig en för alla, och alla för en ståå willia hwickan på återtogh willia; Läggiandes inuthi Rätten en rächning af åthskillige Partzeler, belöpandes till 67 Dr m:tt begierandes till sitt förhulpen blifwa om deße"
21,Kexholm,0189_0191,"elöpandes till 67 Dr m:tt begierandes till sitt förhulpen blifwa om deße förb:te Partzeler som uthi Rächningen nu förde äro, bewinnar Elias hwans hustru /: som af af borgarne och sin egen man der till förord¬"
22,Kexholm,0189_0191," Krijdi emot sin gifne obligation f d 30 Jan: 667, sampt Postmästarens Jochim Fresses inlefwererade rächning, angående det för dhett, som Postmästaren till der inkomne Commissarier, på Borherskapetz wägnar gi"
23,Kexholm,0190_0192,"/: som Sal. Kyrkioheerden till bte Zitting skylldig wore contenterade blefwo, hwer uppå han och sin rächning anlade: Ty blefwo b:te Saaker M seqvestro, så länge arfwin- gare tillstädes kommo, och om samma ähr"
24,Kexholm,0204_0206," wägnar. så säger Postmästaren Jochim dem bestå, i der 50 Dr han sig befinner, effter hin- öfrgifne Rächning till huussen tillförende skylldig wara. Det och Presten bewijste. Med denne sant wardt oppehutit ti"
25,Kexholm,0215_0217,"n att han hade ingen tiänst giordt, derföre kunde in icke heller någon löön för wänta, Såsom contra rächningen, den i Sal. Borgmästarens ord giord är klarligen uthwijsar, elliest och swa- dee borgerskapet. At"
26,Kexholm,0217_0219," 8 mk: i förberörde B. No. 7. Sammaledes föredrogh Casper Mart; in huruledes Hans Mootomer, efr sin rächning lydelse de 27 Jan. 665, och Mortomars egen skriftelige bekennelse af d. 17 Februarij 668 till han W"
27,Kexholm,0221_0223,"eswärade sig öfr borgaren här samma ledes, Jacob Brusison oppå 124 D:r 4 ör Kmt: wed interesse, som Rächningen uthwijsar dat: 2 Martij 668 Kexholm Jacob Brusison neekar intet till gielden kenner att han A.o 1"
28,Kexholm,0224_0226,"o 22. Framsteegh för Rätten borgaren ifrån Nyen Mons:r Hinrich Blankenhagen och lade uthi Rätten en Rächning emot Oluf Johanßon Lijhapä oppå 254 Dr Km:tt och 18 ℔ Smör, besirandes till dett sinigit förhullpen"
29,Kexholm,0225_0227,"gen. N.o 24. Framtredde Jochim Gardelink, full- tiga Befallningman Nielss Olufßons  inläggiandes en Räkning emot borgaren Jö= ran Nielson haike der uthinnan hon Prӕten= derer 449 Dr 24 ör, Km:tt begiärandes "
30,Kexholm,0225_0227,"l dett hinigit förhullpen blifwa. Swaranden Swaranden Jöran Nielson Heike inlefrere- rade en Contra Rächning emot Befallningz- mannen Niels Olufson, men såsom han intet verificera kunde, hwadh han der uthinna"
31,Kexholm,0236_0238,"ffa kunde; ty slötz saken till effterfölljande Sentens. Såsom Matz Olkonen befinnes, efr en richtig Rächning, wara ähn nu skylldig till Simon Hinrichsson 36 Dr Km:tt dy dömmes han dem betala innan, Sootsättni"
32,Kexholm,0241_0243,"o 20. framtredde för Rätten Tobatz Compagnies fullmächtig Inspectoren Erich Hanßon, Inläggiandes en Rächning emot Tobatz Compagnies afnähmare Hinrich Wildman oppå 640 Dr 2 öre Km:tt begierandes Rättens adsist"
33,Kexholm,0241_0243,"rson, effter Wildeman lijkmä- sigt sin gewers icke hafr dem tydigt till känna ifwit, huruledes hans Rächningar med Compag. giet stodo och förewette. och annanemnde Com- pagnies fullmächtige här uthöfr en skri"
34,Kexholm,0245_0247,"eter Schluter kärandes till borgner Mikita Lewiska på 56 Dr 2 öre kmt. och deruthan inläggiandes en Rächning, underschrifwin af Wärendt Timmerman, begierandes der öfwer til handh rätt wore förhullpen blifwa. "
35,Kexholm,0251_0253,"vie, sampt Borgmäster och Rådh. No: 54. Framtredde besökiaren Eskill Thomason och inladhe om Contra rächning, emot Henrich Wild- en; hwar uthinnan befans, att Henrich Wildman ähnnu till Compagniet skylldig wa"
36,Kexholm,0258_0260," 11. 48. p. 38. 1. 53. pgr.n D. 46. 1. 57. Peter Scheder med Hinrich Wildman p. 41. 1. 55. Stadzens Rächningar. p. 6. n. 4. Simon Hinrichsson emot Matz olkonen p. 8 N. 7. Staphan Hari emot Peter Anderßon, p. "
37,Kexholm,0268_0270,"ng komma kunna. effter sakens noga igenom löpande, så wäll som dett att Mischas hustro emot Äntians rächning intet hade att inwända dij slötz saken till effterfölliande Sentens. Emädan såsom Mischa Cananoffz "
38,Kexholm,0268_0270,"r, emot dee 5 Dr 30 öre Kntt som Sal: Borgmästarens Änkia hust: Catha- ina wagner, henne af en klar rächning bewijsatt skyldigh wara; Altså dömes mehrb:te Missas hustro samme gield att 287"
39,Kexholm,0271_0273,"rwarande Borgmestar och Rådh No. 18. Samma gångh framkom Fischalen Mathias Alkemius inläggiandes en Rächning emot Borgaren Jeremias Michelson, oppå 1000 st: Tegel å som han hade köpt aff Commendante Granatenb"
40,Kexholm,0271_0273,öper 40 Dlr Km:tt och såsom b:te tegel skall wara Fiscalen till Balance fördt derföre uthi Cronones Räkninge Cammar att giöra besken hwarföre han nu 6: borgare om betallning ahnsöker; Säijandes och sig sielf
41,Kexholm,0277_0279,"Rådsmannen b:te arff låta henne hederligen 5 wäll mine till groifwa, hwar utlofr han en under ifrån rächning af främmande män utl. igen insinuerade, belöpandes till 100 Dr Kmtt eller begge Poster giöra tillsa"
42,Kexholm,0278_0280," Staden uthbudit; då besökiaren enom Wällbne Hr Landzhöfdingens så wäll som Borgmester och Rådz handräkning, hafr godset Arrestera låtit, begierandes att funna här förwinna och åthniuta, hwad Kongl. Resoluti"
43,Kexholm,0285_0287,"52 Ifrån Hampnen, hwilken rulle han och hafwr låtit uthi räkningen inföhra men dett att han d 2 andra och tiuguende rullan som Rysen klagar öfr, skall hafwa undan d"
44,Kexholm,0322_0324,"såldt hans wahror och strax effter handen honom betalt, hwad hon höö nom war skylldig, och så ingen rächning der öfr skriffteligen hållit; bewijsandes sig honom hafwa betalt af dett skeenet, att huario hafwer"
45,Kexholm,0322_0324," till Eedhz, effter hon ju sielf tillståår att hon har försåldt hinrutzwahror, som hinrich uthi sin räckning hafr oppfördt; och Samuel kan intet be- wijsa med rächning eller wittne, något mehr deropå hafwa be"
46,Kexholm,0322_0324,"åldt hinrutzwahror, som hinrich uthi sin räckning hafr oppfördt; och Samuel kan intet be- wijsa med rächning eller wittne, något mehr deropå hafwa betalt ähn hwad som uthi h.r vice rächning, hennes oppfördt, "
47,Kexholm,0322_0324,"ntet be- wijsa med rächning eller wittne, något mehr deropå hafwa betalt ähn hwad som uthi h.r vice rächning, hennes oppfördt, nämbl: frachten som hon Samuel begiärer, som är 20 Dr Km:tt Samuel swarade, så wi"
48,Kexholm,0329_0331,"e strax bejakat; och hafwer så effter handen tagit hwad han fr behöfdt; bekänner och, att han ingen räkning har nit med fierlomen, weet intet om hon hafr något mehr på att få eller intet. Hwadh kiortelen wed"
49,Kexholm,0332_0334,"d ord: Rådstugudag, närwarande Borgmester och Rådh. N: 42. Dit. Opplästes för Booherskapet Stadzens Rächning och dem till kunna gafz, om Stadzens intraders uth der- ande, och till hwad tarfwer der wore, ahnwä"
50,Kexholm,0343_0345,"kiötz till wijdare Hr Lagman rens förklarning. Samma inlede S procuratoren Chri- stian Segferson en Rächning af en Borgare ifrån Wiborg Hans Strahlmen 6,, hwar uthinnan han oppföhrer 48 DrKun: om Mikita Lefwo"
51,Kexholm,0344_0346,"r honō hylldigh, så kan jagh och icke annars säya. giörade att Blankenhagen skulle inläggia richtig räkning opå sin ahnfordran. Blankenhagen Inlade Meijers Obligation at: Sårdawalla d. 18 Jan: A:o 1669 å 291"
52,Kexholm,0344_0346,agen Inlade Meijers Obligation at: Sårdawalla d. 18 Jan: A:o 1669 å 291 1/3 Dr ölfrm:tt och der opå räkning med oppfördt inter- le och reesors omkostning. turgen Meijer begierde dilation till des han kunde s
53,Kexholm,0351_0353,"an hafr lofwat honom wara igården, till des - skulle sig huus förskaff sielf. dito Inlgde Thomas en Rächningh, hwar uthinnan oppförer sigh hafwa 3 m:r Johak bekommit af hen för 4 Dr 16 öre Km:tt men Hinrich n"
54,Kexholm,0354_0356,"ng emot Borgaren Henrich Pirhoin, hwar uthi nan han fordrar 29 Dr 29½ ör Km:tt, för uthlåna pgr öfr Rächningens innehåld. Inlade Hinrich Pirrsoin här emot en Contrad ning för fruchten à 91 Dr 15 öre kun- Stap"
55,Kexholm,0356_0358,"tt som Scheder för penninge nes interesse, så wee som reesor och andre aff ser, hon med sin ingifne rächning prætendera der blifwa för dennegången Oafdönde in till deß att Wildman kan der om med Sched lagl:n "
56,Kexholm,0362_0364,"huren kom, ebergub er och sehr, då sagete och du ihan, men ist hwit chlåften hu geben, undt sagete orächninge hen- Husoinen Reuter Janco, sehr ju das diu han nach huusse bringest, sagte der Reute idh kan ihm "
57,Kexholm,0371_0373," 31 Aug. 672, hwar uthinnan han Kalluncerar Wildman för eges Interesse, och andre expenser som uthi Rächningen Specificeras, till 12 Dr 12 öre Km:t hwilke efr der alle torr wijslige, begierer han här uthöfwr "
58,Kexholm,0372_0374,"af:r Wildmans egen Räkning, och till d. 14 Feb: 6 å 6 pro cento. giör 15 Dr Km:tt; Men sädan som sakt är blifwin agerat, är fö"
59,Kexholm,0398_0400, fordra. hwar på han sin rähnin inlefwererade dat: Nyen d 5 Decemb: 673 och ehuru wäll hon om denne räckningen med Erich kosma uthi åthskillige gånger hafr sitt att Carera; så hafr han ähn då föräge inlast ha
60,Kexholm,0399_0401,"ända; Men uthi Smörköpet som war 76 ℔, hoon på han fyra öhre, på hwart til fordrar om I Wåldingens präkning befinnes, sampt protestera emot dee 4 Dr som opå säcken öre oppförde; Ty hafwer Rätten slutit denne"
61,Kexholm,0399_0401,ne saken till ederfölljande. Sentens. Emädan såsom Erich Losma effter handelßman med Ziclas Walding rächning befinnes wara skylldig TDr 21 öre Km:t hwaropå han frij deputerar: Dr 16 öre Km:tt för den högre wä
62,Kexholm,0404_0406,"r att han hafwr uthfordrat en häst öfwer Winteren för H. Timmerman, för 10 Dr, hwilck- eij finnas i Rächningen. Ifr detta skall eij kosma skaffa sig wittne. för der öfrige 43 D 3 öre skall hon skull Caution e"
63,Kexholm,0405_0407," Tres. N:o 48 Framtredde för Rätten Hinrich orduskas broder, Fenrichen Johan Ortuska, och inlade en rächning ohngående Sal. Mathias Michelßon och broden Jeremias, uthi hwilken Rächning Ortäst fordrar at Jerem"
64,Kexholm,0405_0407," Ortuska, och inlade en rächning ohngående Sal. Mathias Michelßon och broden Jeremias, uthi hwilken Rächning Ortäst fordrar at Jeremias skulle wara skylldig till triuska 164 Dr 7 öre Km:tt här emot begierte t"
65,Kexholm,0405_0407," Dr 7 öre Km:tt här emot begierte teremias af Rätten Dilation till d 24ujusdem, att giöra en Contra rächning, huilket honom af Rätten effterlätz. d. 24 ejusdem wed Extraordz Rådfärudan, när warande Bergmäster"
66,Kexholm,0405_0407, Bergmäster och Rådz. N:o 49 Infan sig Borgaren Jeremias Michelßon 7 insinuerade den honom opålagde Rächningen och sig förklarade opå Hinrich ordeskas igenom Bry Johan Ortuska uthi Rätten ingifne beswär Och s
67,Kexholm,0405_0407,"g förklarade opå Hinrich ordeskas igenom Bry Johan Ortuska uthi Rätten ingifne beswär Och som samma Räkningar icke Öfrens konne femrichen ortuska och icke wiste förslara, hwad wijd samma Rächningar Concerner"
68,Kexholm,0405_0407,"ch som samma Räkningar icke Öfrens konne femrichen ortuska och icke wiste förslara, hwad wijd samma Rächningar Concernerade dy en- skyllade han sig ther ifrån och lätt den slager, ningen bewända opå sin M:r s"
69,Kexholm,0415_0417,"amon hade lefredt honom 3 ö:r rång begierte nu att få sin betallningh. Swaranden Paramon, Inlade en rächning emot Samuel Pålson uthi hwilken rächning han fordrar af swuel 6 Dr 24 öre Km:tt begierer att Samuel"
70,Kexholm,0415_0417,"te nu att få sin betallningh. Swaranden Paramon, Inlade en rächning emot Samuel Pålson uthi hwilken rächning han fordrar af swuel 6 Dr 24 öre Km:tt begierer att Samuel skall honom dem tala. Samuel hade sig in"
71,Kexholm,0415_0417,"wuel 6 Dr 24 öre Km:tt begierer att Samuel skall honom dem tala. Samuel hade sig intet willia giöra rächning i Paramon, uthan det inständigt nekade, beropade på effterkrefne wittne, som war Erich Hinderßon os"
72,Kexholm,0416_0418," försåldt see nones bly; och när han sådant beskeed oppwijsar skall Caramon blifwa affstraffat. med Rächningh ppskiutes till deß att Paramon kan få sine wit nen tillstedes, som hafwa lefwererat der Partzel om"
73,Kexholm,0416_0418,"pskiutes till deß att Paramon kan få sine wit nen tillstedes, som hafwa lefwererat der Partzel om i Rächningen befinnes wara oppförde Dito Pålades Paramon och han skulle skoffa beta ning af sin syster, eller "
74,Kexholm,0416_0418,"wß hafr till- fogat p Samuel Pålsson framkom andre gången med Paramon Cabanoff och framwijste sijne Rächningar nen såsom samma Rächningar wore mycket drichtig Ty remitteras dee till Martijske män, som des Räc"
75,Kexholm,0416_0418,"l Pålsson framkom andre gången med Paramon Cabanoff och framwijste sijne Rächningar nen såsom samma Rächningar wore mycket drichtig Ty remitteras dee till Martijske män, som des Rächning förstigenomsee och Cl"
76,Kexholm,0416_0418,"ingar nen såsom samma Rächningar wore mycket drichtig Ty remitteras dee till Martijske män, som des Rächning förstigenomsee och Clarera, och sådan hwad wiss der uthinnan finnes måge dee här för rätta föredrag"
77,Kexholm,0424_0426," Grelß Erichß sielf, så wäll som hans hustro, Men sade sig derföre bakan Samuel betalt, såsom deras Rächning skall uthwijsa. Samuel säger ingen kost wara uthi Rächningen in fördt, ey eller dett som han hade h"
78,Kexholm,0424_0426,"derföre bakan Samuel betalt, såsom deras Rächning skall uthwijsa. Samuel säger ingen kost wara uthi Rächningen in fördt, ey eller dett som han hade husen förbättrat hußens förbijttring tillstå i hustring i de"
79,Kexholm,0425_0427,2:do för dett Samuel hafwa låtit gården repurera både i ett och annat brilet tillförande uthi deras Rächningar intet är opp- fördt 3:ne bewijsas att Samuel med werdom och wärma sampt spijßning hafwa uthi den 
80,Kexholm,0425_0427,"och wärma sampt spijßning hafwa uthi den tijden Grelses hustro mycket fa- derat, hwilket uthi ingen Rächning är befunnit opp¬ fördt. hafwer och Grelss Erichsson sielf låtit sin hustru tillskrifen"
81,Kexholm,0430_0432,"r Tillstodh och Samuel sielf att han wille betala för sin Swärfader, när hans swärfader hade giordt rächning först honom underrättades att rödningen wore alleredo giord, och dom uthi saken. Rådmannen wid Simo"
82,Kexholm,0447_0449,"ie Rådstugu dag, När- warande Borgmästare och Rådh. Samma gång inlefwererade Staffan Sigher- ßon en Räckning emoot sin Moorbroder Hinrich Pirhoin, angående Skuthe fracht pro A.o 1675. be- räcknadt till 89 D 3"
83,Kexholm,0447_0449,"dh sin heemkomst kan bewijsa Staphan mehra opå Skuta frachten hafwa opburit, än som Staphan uti sin Rächning hafwer Specificerat? då skall Staphan sådant wara skyldigh att refundera och Hierich godt giöra, sa"
84,Kexholm,0453_0455,"3. att försällia, begiärandes til ofwanskrefne pennin- gar att komma kunna; jämwäll inläggiandes en Räckning på Expenserne, som han i samma. penningars anfordrande giordt hafwer, såwäl som oplupit Interesse; "
85,Kexholm,0460_0462,"4 Swaranden Eskil Pirrhoinen, hade intet emot denne Rächning att inwända, uthan bodh att man den för richtig ehrkänna skulle; ehuruwäll han En tunna Salt war nå"
86,Kexholm,0460_0462,"tt emädan såsom befinnes att Hinrich Pir- hoinen, med sin Son Eskill Pirhoinen effter nu liqviderad Rächning blifwa till Rådmannen i Nyen Hinrich Blankenhagen skylldige Tyx D:r 1 öre Km:tt dy dömmes der samma"
87,Kexholm,0500_0502,"rgmestaren Gabriel Himmel begierte af Rådhmannen Hinrich Michellson att han wille neddeela honom en Rächning, oppå dett dem öre emellan. ährgående Hambne Arendet, som åmannen Arrenderat af Staden; så wäll som"
88,Kexholm,0500_0502,"ch så ffta der om hade pulserat. Rådmannen Hinrich Michelson, lofwade att willia gifwa Borgmästaren Rächning medh aldraförsta, och sökia att alt skulle blifwa klart, Således wara passerat, lagligen ransakat, "
89,Kexholm,0505_0507,"Elias Påhlsson Inkom Rådmannen ifrån Nyien H:r Henrich Blantenhagen och nu siette gången inladhe en Räkning emot Hindrich tierhon ses Eskill Pirhonen, angående dhe 99 st: Barkade lidar à 5 D:r stycket giör 4"
90,Kexholm,0510_0512,lmen sigh med Rådman¬ nen H:r Christian Hyrkz fullmäcktige Hendrich huar att hon effter den ingifne Räckningen på Rådstugun d. 10 Martij 180 tillbödh sig liqvidera med samma. Enur dhe 99 el:r 4 öre Capital sa
91,Kexholm,0533_0535,"616 hemius opwijsandes uthi Rätten Sahl. Arkiemästarens Erich Ambiörsons Material, räckning, som han wed Kexholms Arklie hållit; hwar uthinnan befans at han arkiemästaren, och tagit en Ballan"
92,Kexholm,0533_0535,"lm gode giorde, effter han samma ning tillförende under händer hafft, uthan honom där ähn uthi hans Räckning stå till beswär; begiärar han altså Räntmestaren Wälb. Zacharias Jonsson, sampt Borgare wäll:t Hans"
93,Kexholm,0533_0535,"be:de Pärsoner med åth skillige andre bem:te Erich Ambiörssons skrifftens Collationer bewiste denne Räckning wara Sahl. arklimestarens fyens dhet dhe uthi Edhstadh bekräffta wille, der det ytterligare för och"
94,Kexholm,0537_0539,Lars Jakewain p. 16. N.o 29 M. Matthiæ Alhemio meddeles Atest öf:r Sahl. Arksmästaren Erich Ambiörs Räckning P: 15. N: 28 Maria Pelkoinen emot Hind: Hindrichsson d: 22 N. 38 Maria Tobio emot hårda Jörstinen. 
95,Kexholm,0544_0546,"t få samma giäldh inkrafd, hafwer och Hendrich Pirhoin så wäl som dee andre borgare som giorde försträckning till Borgme- staren låtit sielf opteckna hwilcka borgare dhe hafwa welat antaga i betalning för sam"
96,Kexholm,0559_0561,"lle blifwa uthstötter, der han doch eij wist hiel uthi någon måtto förbrutit hafwa; fram- lade sine Rächningar som han öfwer Stadzens Intrader författat hafwer ifrån all den tijdh han Stadz Secrete- are tiens"
97,Kexholm,0559_0561,"re han åhrligen 100 D:r Sölf:r m:t uthaf Stadhen till löön åth- niuta borde, bewijsandes medh samme Rächningar sigh för åthskillige åhr ännu skiähligen hafwa att prætendera och fordra een Summa af Fyrahundrad"
98,Kexholm,0565_0567,"Tienare Johan Simonsson inlade uthi Rätten een Rächning, fordrandes der medh af borgaren härsamme städes Påel Eliaßon Ojala dhe 29 D:r 19 ö: Kopp:r mt hwil"
99,Kexholm,0569_0571,ion halfparten af detta arf sin syster godwilligen Cederade i Altså dö- mes denne dheras medh handsträckning in för Rätta giorde förlijkning stadig och fast att förblifwa. Och hafwer Anders Huttri att sökia E
100,Kexholm,0586_0588," denne Rysse förnöija, hwilket han och uthfäste nu för Rätten. Effter i Rätten uprättadt och sluten Rächningh förblif- wer handelsman Wäl:t Victor Gröön skulldigh een borgare ifrån Cronoborgh benembdh. Cimo G"
101,Kexholm,0586_0588,.  Leutnanten Welb: Arent Reyer hwar uthinnan fält- kären för 33 1/3 D:r Silf:r m:ts undfången försträckningh till sin tillhandlade gårdz inlöser här i Staden såssom och för des uthom undfångne 12 D:r 13 1/3 
102,Kexholm,0586_0588,"för andre hans Creditorer; Och på dett Rätt nestaren måtte giöra sig så mycket mehra om denna för- trächning igenbekommande försäkrat, altså anhåller han att denne hans prætention måtte i Stadzens Proto- coll"
103,Kexholm,0586_0588,"t alt för den skuldh refereres och Rentmest:n här medh præferencen, att emot bem:te sin giorde försträchningar gården effter des wärde antaga och här uthinnan alldeles åthniuta fram för alle andre Creditorer "
104,Kexholm,0587_0589,"h Michelssin  Wasil Kyki  Simon Cnutsson  Berent Casanen  5.  Abraham Wargh fordrade effter inlagdh Rächningh, af Rådman Hindrich knijdi för undfångit godz i Salt, tobak sampt Contante Penningar 403 D:r 24 ör"
105,Kexholm,0587_0589,er laga opbudh och innan lagens försatte tijdh gården in- löfa. Effter i Rätten oprättat och sluten Rächningh förblif- wer Elias Kuha skylldigh till Abraham Wargh 23 D:r 10 öre Kopp:r m:t hwilka han dömmes li
106,Kexholm,0590_0592,"ran Sperlingz skrifftelige resolution daterat Kexholm d. 28 Januarij nästledne, an- gående den försträchningh Borgmästaren Hinnel för Stadzens ehrhåldne privilegier och frijheet opå Sijk- fiskerijet haar uthl"
107,Kexholm,0592_0594,"mens hustro ifrån all den handell Johan Michell- sson medh Grentz Inspectoren hafft hafwer, hwilken Rächningh och ähr äldre Nembl:n af d. 12 September 678. än Inventarium, hwilken d. 6 Aprilis 679 ähr blefwen"
108,Kexholm,0599_0601,"Staffan Meroin, Erich Nylander Påfwell Lukari. Lars Kuha. Rådman Berent Casanen inlade i Rätten een Rächningh emot Rådhman Hindrich Michellsson af Innehåldh att hindrich till afbetalningh för sin giorde omkås"
