,parent,file,context
222,RO_1684-1687,0514_0515,"illa om H. Rådman Huken i detta måhl elliest lär hon komma om all sin ägendom, seijandes att hennes man finnes uphängd wid ett Trä och satten wid andra träet och wiste han på hwad ställe han hängde, hwil"
223,RO_1684-1687,0514_0515,"t der funnit honom hwar på poiken kom heem igen, och hon det lå- tit der widh beroo. Qu: när hennes Man senast warit till Herrans Nattward. R. 5 eller 6 wekor för än hon bortkom; Änkian tilspordes om hon"
224,RO_1684-1687,0514_0515,"tward. R. 5 eller 6 wekor för än hon bortkom; Änkian tilspordes om hon tilförene förmärkt af hennes man att han hafft olaka tankar om sigh? R Neij ingalunda, uthan han hade tänkt att reesa till Erffort, "
225,RO_1684-1687,0515_0516,"248 M.r Tobias Brandt kom 4:de dage- der effter till henne och frågade om hon låtit afskiära sin man ifrån Trået, och om hon låtit giöra kista åth honom och begrafwa honom i Moraset; hwar på hon swara"
226,RO_1684-1687,0515_0516," kista åth honom och begrafwa honom i Moraset; hwar på hon swarade, iag håller den för ingen ährlig man som säger att min man ähr upsängd der för än sådant bewijses. Fierskrotz gåsse som ähr dess hustrus"
227,RO_1684-1687,0515_0516,"egrafwa honom i Moraset; hwar på hon swarade, iag håller den för ingen ährlig man som säger att min man ähr upsängd der för än sådant bewijses. Fierskrotz gåsse som ähr dess hustrus halfbroder, upkallade"
228,RO_1684-1687,0516_0517,"d. 1 Aug: sidstledne ingif- ne skrifft 1. att Sahl. Claes Warge fuller altijd warit een wälbehållen man, men så hafwa dhe Nembl. Atij ter och Erland icke dess mindre nogsampt kräfft af honom desse pennin"
229,RO_1684-1687,0519_0520, Barberaren M:r Tobias Elias Brandt måtte tilspörias huru han kommit till det tahl lijka som hennes Man sig hade uphängdts bem:te Tobias Brandt swarade sig der af intet weta; än att han det första gången
230,RO_1684-1687,0521_0522,all bruka ty hade Walding uthaf sin egen mening i detta måhl witnat. 2 producerar Reus jembwäl Her- man von Elpens attest Sub Lit: 1o. deruthinnan Elpen berättar sig aldrigh om min Wicht på Socker eller 
231,RO_1684-1687,0522_0523,"h Waldingen refererar sig på, förmenandes att det af ett och annat tilfälle sig offta kan hända att man gifwer något Tobak till åth bönderna; så kunde till äfwentyrs Tobak när allenast ½ Skåhlpund sällie"
232,RO_1684-1687,0522_0523,"entyrs Tobak när allenast ½ Skåhlpund sällies wara på Wintskåhlen wägit. 4. att Räntemestaren Weid- man annorledes säger, än Waldingen för Rätta sagt af honom hördt hafwa; Ty Räntemestaren berät- tor sig"
233,RO_1684-1687,0523_0524,"gården sins emellan deelt hafwa. vid: fol: 307: Den 10 Dito Utj Fierskortskans Saak angående hennes Man, för det han ähr bortkommen, blef Borgaren Alexander Sunni upkalladt och der om tilspordt, som berä"
234,RO_1684-1687,0526_0527,"is; hwar på Magistraten swa- rade att bodan blifwer Cronan til bästa, och må Johan Kröger sökia sin Man igen bäst han kan Jöran Tobbi och Kånan Carin Johans- dotter blefwe upkallade och till- sporde på h"
235,RO_1684-1687,0531_0532,"ade det in- tet rätt förstådt, påståendes sig intet mehra fådt än 10½ RD och 32 Slantar, som hennes Man burit til henne. För det öfrige berättade bem:te Peter och Simon Jöran 529 281. Jöransöner att då d"
236,RO_1684-1687,0531_0532,"bna een deel der af här qwar, så kunna i få dem igen, när i dem behöfwa, hwarpå dhe tilstält hennes Man Anders Niel- son och räknade honom till 20 RD. Spec: i handen, men ingalunda hade Referent sagdt de"
237,RO_1684-1687,0532_0533,"t Swarande. Käranden berättar då han i förleden Onßdag som war d. 28 7br: af Magistraten til Ålder- man för Skomakare Embetet blef kallat, han den samma dagen uthsändt W:r Michel Herman att affordra Embe"
238,RO_1684-1687,0533_0534,"z etc. och emedan M.r Michel Herman ul på een tilbakom, sade M:r Zacharias åth honom i det så tagan man witne derpå, han ähr een handzfått, och sådant mehr än een gång repeterat. vid: fol: 288: Skieppare"
239,RO_1684-1687,0535_0536,"ngående hennes Sahl. Mans begraf- ning, hwar på Rätten samtyckte till fölliande Resolut: Aldenstund man eij annat weet än att för det- ta handelsman härsammastädes Michel Hinrich Fierschrot fördt här i S"
240,RO_1684-1687,0535_0536,"t huus läsit sin Morgonböön, lijka som han berättes tilförene waritz wahn dageligen att läsa så att man intet spordt hoos honom någon lijknelse att wela sielf giöra aff sig, deremot denne RådstuguRätten "
241,RO_1684-1687,0536_0537,"förgörande här i Staden warit, nu förtijden finnes alla wara för ö- than sanning och grund. Ty will man så för ofwanbem:te motiver skull, som och af een Chri- stelig kärleek förmoda det bästa, och att ha"
242,RO_1684-1687,0539_0540,"daten Johan Mårtenson för 3 åhr sedan; och emedan hon säger, sig då intet wetat annat än att hennes man Anna Rasalain den tijden war död och ihiälslagen uti Ryssland hon altså sådant måtte bewijsa eller "
243,RO_1684-1687,0539_0540,"ller och för sitt brått straffas; Rea säger, at alla dhe som hon den tijden hafwer frågat om hennes man, altijd sagdt den samma wara död och ihiälslagen i Ryssland. Qu: hwem sådant henne berättadt? R. de"
244,RO_1684-1687,0539_0540,"rfwisari och Loppis. förmenandes sig fuller kunna skaffa bewijs derpå, och wore det wist att hennes man warit reda 4 ½ åhrbort ifrån henne, då hon trolofwade sig med bem:te Soldaten Johan Mårtenson och b"
245,RO_1684-1687,0540_0541,"ors Dilation, till att bybringa laglig bewijs derom, sig hafwa hördt af trowärdigt folk, att hennes man warit död den tijden hon hafft Lägersmåhl med Soldaten Johan Mårtenson jembwäl, och hwad för tijd h"
246,RO_1684-1687,0540_0541,"öd den tijden hon hafft Lägersmåhl med Soldaten Johan Mårtenson jembwäl, och hwad för tijd hen- nes man blifwit dödh, då wijdare uti Saken skal skee hwad som Lagen kan medgifwa. vid: fol: 325: Fiscalis A"
247,RO_1684-1687,0543_0544,"r RD, - 26 „ 36 dening:r Sedermehra togh Rätten denne saken wijdare i be- tänkiande och befan sedan man alla dhe Poster som Peter och Simon Jöransöner berätta af desse stulne 100 Rubl. hafwa uthgifwit ti"
248,RO_1684-1687,0543_0544,"D. 36 demnin- gar, 2 jembwäl af Peter och Simon Jöran- soners 305 söners egen bekennelse, och sedan man alla dhe Po- ster som dhe af dhe stulne 100 Rubl. annorstä- des berätta hafwa uthgifwit tilsamman d"
249,RO_1684-1687,0545_0546,308 man och tilbödh sig att wela den Edhgång som honom d. 19 hujus af Rätten ähr defererat så wij¬ da prӕst
250,RO_1684-1687,0545_0546,"m honom d. 19 hujus af Rätten ähr defererat så wij¬ da prӕstera att han intet weet huru mykit Fohr- man korke huus hafwer tagit af desse Pennin- gar, hwarpå honom förehöltz, att han ähr Peter och Simon J"
251,RO_1684-1687,0547_0548,"wingar såsom deras förre Pupiller, så oan- sedt Wargens arfwingar föregifwa sig ärfft de- ras Sahl. Man och Fader och altså wara frij för deß gield; ändoch och aldenstund befinnes 1 att Sahl. Claes Warge"
252,RO_1684-1687,0548_0549,"å 150 D K.M.t á 6 pro Cento Åhrligen berättandes bem:te Sahl. Borgmestarens Enkia, att hennes Sahl. Man desse Penningar hafwer lånt af Sahl. Capitein Spitzens Sterbsuus Medell, och altså såsom omyndige b"
253,RO_1684-1687,0548_0549,"ffter det 14 Cap: Rådst: B. saakfälles. Ty tilsades Valentin samma böter strax att betahla, elliest man blifwer nödgat med Execution att förfahra, lijkmätigt hans Excell: Kongl. Rådet och General Gouvern"
254,RO_1684-1687,0552_0553,"for- dring, inläggiandes der jempte twenne Räkningar af det som sahl. Borgmestaren af Sahl. Timmer- man i dess lijfstijd undfådt hafwer, berättandes derjempte att effter sluten Räkning fr. Borgme- stersk"
255,RO_1684-1687,0554_0555,"igit bewijs af Feltwebelen Evert Huuk och af Soldaten Bertill Simonson, som ähr hennes Styffdotters Man, hwilka attestera, att några åhr bort åth i loppis warit ett all- neentl rychte att denne kånans fö"
256,RO_1684-1687,0554_0555,"ilka attestera, att några åhr bort åth i loppis warit ett all- neentl rychte att denne kånans förre man An- te Rasalain i Ryßland warit och der blifwit ihiäl slagen; hwarpå hon wijdare tilspordes när hen"
257,RO_1684-1687,0554_0555, te Rasalain i Ryßland warit och der blifwit ihiäl slagen; hwarpå hon wijdare tilspordes när hennes Man då sanfärdig i Loppis blifwit dödh? R. för 3 åhr sedan har han för begången heemgångh skull af een 
258,RO_1684-1687,0554_0555, åhr sedan har han för begången heemgångh skull af een bonde blifwit ihiälslagen; Wa- randes hennes man i sin lijfztijd een elack miss- gierningzman nembl. een förlupen dragun een Man- dråpare och hästet
259,RO_1684-1687,0554_0555,; Wa- randes hennes man i sin lijfztijd een elack miss- gierningzman nembl. een förlupen dragun een Man- dråpare och hästetiuff; alt derföre han och mån- ga åhr warit på flychten och lefwat såsom bil- to
260,RO_1684-1687,0555_0556,"lofwat sig med Soldaten Johan Mårtenson, och hafft med honom lönskeläger icke allenast hennes förre Man Ante Rasalain för åthskillige begångne miss¬ gierningar skull några åhr tilförende warit på flychte"
261,RO_1684-1687,0555_0556,"straten wille imponera Sahl. Rådman Timmermans Enkia att producera sin Sahl. mans gieldbook, på det man må kunna see, huruwijda den Räkning, som bem:te Tim- 559"
262,RO_1684-1687,0556_0557,"betahlning, men då intet neeka till denne gielden, förmenan- des käranden wijdare, att hennes andra Man Sahl. Fierskrot intet hafft macht att bortgifwa som nu för detta til Militiens behofwa brefwa be-"
263,RO_1684-1687,0557_0558,"rligare sin betalning af Swaranden, jempte 3 RD. Rät- tegångz Expenser. kea swarar att hennes Sahl. Man ingen Räk- ning hafft med Sahl. Fierskrot uthan med Sohn bindern, som igenom förlijkning ähr uphäfw"
264,RO_1684-1687,0557_0558,"y blef han up ytterli- gare förmahnt att erläggia bem:te Saaköör innom nästkommande onsdag, elliest man blifwer nödgad att grijpa till andra me- dell. Valentin bijbrachte wijdare, att deß moder har till "
265,RO_1684-1687,0559_0560,"amma räkning sönderrijfwit. Rea nekar aldeles der till att någon Räkning varit emillan hennes Sahl. Man och Sahl: Fier- skrot, anhåller altså om uthslag i Saken som med nästa skall föllia. vid: fol: 336."
266,RO_1684-1687,0559_0560,n Otto Sol- dans och fordom Gerichtsfougdens Blankenha- gens Attest har bewijst att kärandens Sahl. Man Michel Henrich Fierskrot efftergifwit och uphäfwit een fordring som Sahl. M:r Ebbe Falk och honom e
267,RO_1684-1687,0564_0565,"än Swa- randen juramento Supplatorio sin Sahl. Mans gieldbook bestyrcker, helst emedan hennes Sahl. Man gifwit sine Obligationer åth Sahl. Borgmestaren, hwaraf præsumeras att Sahl. Rådman af förgiälenhee"
268,RO_1684-1687,0565_0566," Ah- signationen af den 10 Martij 686 til h. gil- felts Committent Peter Hesel, efftersom Sahl. Råd man så hårdt antog Sahl. Borgmestaren att få dem till sin näring fortsättiande, och att Interesse Penni"
269,RO_1684-1687,0565_0566,"på Fr: Borgme¬ sterskan förnam några kannor Brennewijn för dess arbetzfolk wara tagne af Sahl. Råd¬ man, derföre Rådztienaren Pendix treegån¬ gor sändes till Timmerman att förnimma dess quantum, men Timm"
270,RO_1684-1687,0569_0570,"dotter Taipalain anklagas för böndagbrått Michel Hiurich Fierskrots Änkia anhålles att hennes Sahl. man, som ähr hittat i watnet motte begrafwas. 239. 566. Michell Fierskrots Änkia anhåller om een öpar T"
271,RO_1692,0006_0006," och slogo honom med pistohlen brunn och bloduger. Johanligen Swarade: sig i förståne ropat hanss „ man in til sig, til att disponera honom til dess gieldz betalning, men Länssman kört bort till förr¬ sk"
272,RO_1692,0007_0007,"rerade sig hafwa allenast sagt åth Johan Kuen, ingen åhrl. borware uthan kontbårgare öf:r faller en Man så som i giör, tilståendes där jämpte, att Swen för honom Caverat hoos Clas Larsson, hwar på ännu r"
273,RO_1692,0009_0009,"ng. Justitiæ Borgmestaren begärte sådant att noteras, ty emedan Bröker tilstår det ena, altså kunde man lättel:n afftaga, att det öfrige är sant, som Borgmestaren refererat, framwijsandes Borgmest:n en K"
274,RO_1692,0012_0012,"noterat blif:a Dito blef 3:die gången annoterat dene Kryddegårdz Tompten i Paßola belägit, som Råd¬ man Hr Lars Malm utaf Hr Ränttmestaren Christopher Bure kiöpt hafwer./. Då framkom Monsr Petter Schultz"
275,RO_1692,0016_0016,"den då intet welat försällia, förminnandes nu lijkwäl samma platz hafwa försåldt reda åth Randelss¬ man Antoni Miles för 1500 Dr Kmt, hwilket han för¬ menar med witnen kunna bestyrckia, protesteran¬ des "
276,RO_1692,0016_0016,"hrwetz gårdh, hwilket blef ad notam tagit vidf: 25 d: 5 Martij Handelssman Jacob Johan Lund, jag om Man Almais yrkade wijdare på det gårdzköp, han med Sal. Johannan Tabars Änckia Ingeborg Matzdotter, om "
277,RO_1692,0017_0017,"24 man Hans Hinrich dobbin effter Obligations Dato af honom Regeberg, des halfwa Tompt kiöpt och betalt; h"
278,RO_1692,0021_0021,"r- randens arm wore fullkombl. häkter? Rp. Neij, u¬ than han ännu wara, under Cur; altså och emedan man intet kan weta, om käranden fåår lyte på armen eller eij, ty kunde utj denne Saken icke än- nu någo"
279,RO_1692,0027_0027,"kommit om sitt Lyff, och om hon fallit uthföre, wiste hon intet, bekännandes referentin, att hennes man Petter slagit sedan henne 2 öhrfyl derföre hon icke bättre sedt effter bemte Sara; såsom hennes gra"
280,RO_1692,0028_0028,"stru, som kommer dijt, och sedt på lijket, hwilket och Grels strax gifwit tilkänna åth den aflednes Man Johan Simonsson, Denna Karin tilspordes, hwad för tijdh hon funnit Sa- ra döder? R för Middagen Kl."
281,RO_1692,0029_0029,"t, och det samma må öfr gå dem som hafwa giordt det, att iag skal betala det andra gången; säijan i man desse ord igen; hwarpå refl, rent regererat, att Borgmestaren tilskick at domen til den ända, att h"
282,RO_1692,0032_0032,"nfö¬ randes deruthinnan, att Kongl. Förmyndare ordning är uthgången 22 åhr sedan Rea trädde med sin Man Paul huppunen i Giffte, hwilken och då alz intet ägde, och för¬ den skuld på sitt yttersta wed befr"
283,RO_1692,0034_0034,"ch Johan Snidares attest som i detta måhl ll beropar sig uppå, eij kunna gillas, 4:to hade kärandes Man fuller yrckt på samma de¬ ras arf, men blifwit af Sal. Huttuin, och sedan af des änckia, nu warande"
284,RO_1692,0038_0038,"tt en sådan Actoris giärning wore en Skalm stycke, hälst emedan han Swaranden wore en gammal ährlig Man, och icke hade förtient att blifwa således narrat och skimpfat; fördenskul och han ännu påstår, att"
285,RO_1692,0041_0041,"palis wägnar, effter wexel Noustume på all hin¬ der, skada och omkåstnadt, som igenom det, att Råd¬ man Hucken denne wexlen eij welat acceptera, torde förorsakas, med begäran, att sådant i Stadz Proto¬ c"
286,RO_1692,0041_0041,"så myckit mindre sin Sal. Mans gäldböcker effter Contrapartens begäran inlefwerera, som hennes Sal: Man hwarken kunnat sielf skrijf:a el.r Läsa, mindre någon tienare der tilhålla, wore altså ingen book f"
287,RO_1692,0042_0042,"e Skomakaren M:r Hans Jochim Emoot Rådemacher Swarande; Actoris hustru närwarande ursäcktade hennes Man, 6 det han för des siukligheet skul intet kunde sielf upkomma, och den Eden, som Swaranden af ho- n"
288,RO_1692,0043_0043,"låter igenom sin bodhpoika Michel Schmitt be- igen. rätta, huru såssom hon sig förundrar, att Ampt- man törss inkomma med denne sin klaga, emedan hon honom allades oskälige prætensioner reda gott giordt,"
289,RO_1692,0046_0046,"d böör wara fast, sampt be:te köpmäns befall- ning, i detta måhl, effterlefwa, som en ährl. Timmer, man anstår, doch icke allenast mycket hindrat be- Skiparbete, som des egen drengar, hwilke wid sam¬ na "
290,RO_1692,0047_0047,"som han, förme¬ nar uti Sal. Paul Huppunens Sterbhuus wid des döde¬ lige frånfälle blifwit qwar, så man sedan finge see, hwad för skiäl dhe hafwa emot det inlagde Inventa- rium att tala; Men Fullmechtige"
291,RO_1692,0055_0055,f att hafwa hafft Lägersmåhl med Jacob Johan Lund. denne Maria Andersdotter wärdenne gången stämbdt man kom icke tilstäd. Kirstin Petersdotter sielf närwarande contesterar och bedyrar sig aldrig hafft ot
292,RO_1692,0056_0056,"öran Aitman för 60 D:r, begärandes att detta gårdz- köp nu första gången måtte upbiudas; Jöran alt- man tilstod samma köp; blif altså des första opbu¬ det förteknadt. d: 6 Julij Rådman Larss Malm Låter 2"
293,RO_1692,0060_0060,"n Ketusaari Christer Riddare och Henrich Rid¬ dare Matth: Almenius Hållendske Skip¬ paren och Styr- man herr Häringz angde oarlafz uthi kastande i fåhr¬ watn. dare; hwilka berättade, huru såssom dhe styr"
294,RO_1692,0060_0060," hwilka berättade, huru såssom dhe styrt be- Skippares Skepp hijst åth mitt utj prickorne, då Styr¬ man ledt dem wid armen utur Skippet, seijandes sig wara både Styrman och Låtzman, och sedan han seglat "
295,RO_1692,0060_0060,"igit, hade han då där om bordt til¬ talas; Magistraten swarade, att sådant wore lönligen skedt, och man intet förr, än nu där om fådt förnimma; Parterne wijstes til affträde. Ericksättaren Henrich Matzso"
296,RO_1692,0061_0061,"tzman Swarade, att de fuller på Skippet begärt des ordinarie Låtzmans Löhn, men Skipparen och Styr¬ man låtz intet dem höra, och först här i Staden på Li¬ cent huuß samma löhn af dem erlagt. Skepparen Bo"
297,RO_1692,0063_0063,"ndens hustro uthropat för en Lijfflanskkåna, handt löperska, som ingen wiste hwarest hon och hennes Man wore ifrån sampt kärandens Slächt gamble fougden Ni¬ lis Lundh, som doch lenge sedan warit dödh, fö"
298,RO_1692,0065_0065,"ang: Lägersmåhl hafft Soldaten i Narfwan Staffan Brusison så der Capitein hoos Compagnie, til ächta Man, med hwilken hon och aflat barn som än är i lijfwet, men samma Soldat för 6 åhr sedan blifwit dödh "
299,RO_1692,0065_0065,"räpä. Rätten pröfwade skiäligt, att Kirstin Matzdotter, sitt bewijs, som hon, angående hennes ächta Man och des dödh, beropar sig oppå, måste by¬ skaffa, för än något wijdare, om detta hennes Lägersmåhl "
300,RO_1692,0068_0068,"och för des reparation 8 D:r Km:t så wore och be:te besichtningzman Mr Wilken appellantens afwungh- man, och protesterade altså Appellant emot des itzord, sampt begärte att Controleuren måtte på¬ läggias"
301,RO_1692,0070_0070,"ta O rätta sijdan, men hufwudskalen och intet lӕderat Krögerskan Helena tilspordes, hwarföre hennes Man¬ Johan Tolo intet framkommer? R den samma legat siuk wid 4 wekors tijdh, och ännu liggia; Q. hwem s"
302,RO_1692,0071_0071,"l, att du dem betala kan; hwarigenom Reus blifwit altererat, och sagt: att i skolen see, det iag är man för ett paar glas, så wil iagett paar lå sönder, mehra på skämpt, än att sökia der med oliudh, kast"
303,RO_1692,0073_0073,"nes, syffande där han, att änckian såssom sielf tilstådt sig eij minnas kunna, hwad som hennes Sal. Man egentel:n qwarlembnat; där jemt och des åthskillige inlefwererade upsatz, och berättels ser om henn"
304,RO_1692,0073_0073,"ens dödh ett richtigt och giltigt Inventarium låta uprätta, men efter som det intet wore skedt, och man på högsta Rätten nu ey kunde säkert gå, altså mån te man sig till wijdköfftigheetz afböijande det 1"
305,RO_1692,0073_0073,"a, men efter som det intet wore skedt, och man på högsta Rätten nu ey kunde säkert gå, altså mån te man sig till wijdköfftigheetz afböijande det 14 Cap: gifft mbl. St: nu behaga låta, hälst emedan, om ho"
306,RO_1692,0078_0078,"cke taalt å deras fäderne, och alt så förtegat deras rätt, 2do att den tijden Påul huppunen afleed, man icke än wetat af Förmyn¬ dare ordning, förmenandes i ty bem:te Änckian sig intet wara skyldig, at n"
307,RO_1692,0080_0080,"fnört, och syntes nästan heel hwijst, jäm¬ wäl måålningen fram i Schäsen afslijtit; hwar¬ utaf utaf man Lätteln kunde afftaga, att Appellat mehra än 6 gångor, som han föregifwer, den brukat; re¬ peterand"
308,RO_1692,0081_0081,"tt för än hon wille sittia i Corps dequardie, wille han hel:r det bortstulne betala. Augustin Lang¬ man C: Brijta Simonsdotter, ang: stöld. Swaranden tiltaltes derföre, men hon inwände der emoot, sig såd"
309,RO_1692,0082_0082,"e hade han Jensk, sökt hoos gerichtsfougden Wal- dingen arrest på samma häst, som och igenom go- de man den samma låtit wardera. Gerichtzfougden Waldingen berättade, att hafwa och skriffteligen samma"
310,RO_1692,0083_0083,"ade utj Edhstadh, det samma häst blif:t wärrerat å 15 el:r 16 D:r, effter som den warit lijten, och man fuller förr, för 2 RD:r en sådan häst hade kiöpt. S Handelssman Jacob tilspordes, hwarföre han icke"
311,RO_1692,0084_0084,"nu Barberaren upkom igen, sade han en Skelm haf¬ slagit mig, och en hora hafwer dragit mig i håret, man hwem han meente, wiste witnet intet, ey heller mehra i denne Saken att berätta; tog alt¬ så afträde"
312,RO_1692,0086_0086,"regn på sijdan in i Schäsen, seijandes sigh intet kunna weta om träet warit tårt eller rådt, effter man om wintertijden och träntz råhers eij wäl kan skönia, menandes doch, effter bräderne på Schäsen om "
313,RO_1692,0086_0086,"des alt så att hon öfwer detta måtte examineras. Swaranden bekende sig fuller hafwa tagit kau- nan, man skiöt skulden på Fältskären Sal. Eb¬ besänkia, hustro Christina hård, att då hon hade bakat hoos ky"
314,RO_1692,0093_0093," injuriӕ klaga beropar sig på, böra afhöras uti häradz Anna och Dorothea huppunen anhålla opartyske man att wardera Sal Paul Huppunens huus och gårda. häradzrätten, der under dhe såssom på landet bo¬ 177"
315,RO_1692,0099_0099,"r på Rät- ten pröfwade skiäligt, att Controleuren detta des reservation Skriffteln inlägger, på det man må see, huru wijda det kan antagas. vid: 208. Notarien Monsr Laurentz Brodzenius å sin Principaler,"
316,RO_1692,0104_0104,"t executionen, som Leut; elliest säkert ärhållit som expresse i bem:te allejato förmäles, tij wiste man intet, med hwadh fogh käranden kom¬ mer igen att tilägna sig twärt emot sitt förra påstående wid Ge"
317,RO_1692,0105_0105,"ajorskan, då hade han ju öfwerdragit gården och giordt sig ägande af samma prätension, ja til Leuth man, den han för alle anwände expenser till Executions uthsökiande i åf:de 16 wekor medh sampt interess"
318,RO_1692,0105_0105,"om Kongl. randen där effter sökia wille el:r skänckia, effter som en practionabet regel är, att det man en gång beha¬ gar, sedan intet kan återkallas; in summa; det borde nu hwar sökia sin uthkorade Man,"
319,RO_1692,0105_0105," man en gång beha¬ gar, sedan intet kan återkallas; in summa; det borde nu hwar sökia sin uthkorade Man, och posito nung tamen concollo, att Käranden intet af henne sökt, eller wid sökiande finge, så kun"
320,RO_1692,0106_0106,"202 Börmans huus, beropandes Notarien på bem:te Bör¬ man och Alexander Röling sampt Arrendatoren Christian Siirto til witne, och anhölte, att emedan Bröker "
321,RO_1692,0107_0107," under Inspectoren Alexander Röling fönster, som då skalte Brodzenium för beli¬ hundh och hund etc: man Brodzenius swarade intet annat, utan iag finner Eder fuller. Brodzenius badh, att låta besee des bl"
322,RO_1692,0107_0107,"pa. Bööker refererade, sig welat i Handelssman Stenens wägnar affordra några acter af Notarien Bör¬ man, wid det samma gick han in til Inspectoren Ro¬ Ting och drucko tilhopa, kommandes Bondzenius effter"
323,RO_1692,0110_0110,"smason och Matt Christerson förklarade sig, att dhe alla wore utj en radh, och wela alla stå för en man, utj det dem i denne gången kunde öf:r gå. Fiscalis påminte Zations officij, att desse timmer¬ man "
324,RO_1692,0110_0110," man, utj det dem i denne gången kunde öf:r gå. Fiscalis påminte Zations officij, att desse timmer¬ man missfirmat Justitiæ Borgmästaren, och i går intet welat effterkomma des befallning til¬ att gå til "
325,RO_1692,0112_0112,"hwilken wärdering doch, så wijda den effter Hr Justitiæ Borgmeste befallning af gode och re¬ delige Man, är anstälter, i största wyrdnat hålles, mon så wijda den är på en wrång wijs uth- tijdning af Leut"
326,RO_1692,0112_0112,"begäran honom något wijdrig effter åth blefwe; Men Leut: wårdade nu icke mehra om, hälst han en god Man för sig hafwer, som fordringen sig åtagit, och effter som Bruukz Patron förmedelst bem:te arrest Le"
327,RO_1692,0112_0112,"d ingen annan, i ty måhl hafwa att giöra, uthan lembnar där emoth käranden, att sökia sin Uthkorade Man, och betahla Käranden uth, som öf:r des bewijslige fordring är, hälst golf¬ den är liqvide och icke"
328,RO_1692,0117_0117,"r färdigande, förmenandes att emedan Gillius be- kendt, att Steven den tijden derföre begärt borgz- man af M:r Regeberg, altså måste ju flere än 2 paar der af warit, ty elliest hade det intet stort inpor"
329,RO_1692,0118_0118,"en läto igenom Notarien Mons:t Brodzenium upbiu¬ dantt köp, som dhe slutit med Johan Hinrichson Ny¬ man, såssom Dorotheas Son, om den kryddegården. Possula, hwilken bem:te hustrur nyligen fådt på de¬ ras"
330,RO_1692,0121_0121,"e- 233 hysat löst folk, twärt emot öfwerhetens förbudh, som dem är tilsagt, och kundgiordt; ty hade man fuller skiäl derföre dem med alfwarlig straff, att ansee; doch lijkwist förskones dhe denne gån- ge"
331,RO_1692,0121_0121,"emte, sig för slijkt otillbörligheet framdeles att achta. / Hustru Maria Jöransdotter Emoot. hennes Man Stadz Frhrman Erich Christerson Hustru Maria berättar, huru såssom hon blif:r nöd gat att gifwa kla"
