,parent,file,context
332,RO_1692,0121_0121,"ustru Maria berättar, huru såssom hon blif:r nöd gat att gifwa klagel:n tilkänna, det bem:te hennes man för detta henne myckit illa och Tyrännisk handterat, och oachtadt Justitiæ Borgmestaren honom allar"
333,RO_1692,0121_0121,"brun och bloduger, framwijsandes åthskillige blånader och blodsår, som hon samma gångon fådt af sin man; Justitiæ Borgmestn berättade, att samma hu- tro om nattetijden kommit til honom och sökt beskydd, "
334,RO_1692,0121_0121,"ienare som på Rät- tens befallning besichtigade denne hustrun, in- tyga- Maria Jöransdr emot hennes Man Erich Christersson Erich Christerßon ang: oenigheet och slagmåhl"
335,RO_1692,0122_0122,"a, berättandes att des Sk 235 tydeligen nog wore, och att praxis wid alla doom stolar tillåter, att man sig i alla saker in omnem eventum något förbehåller, enär Appellationen enom blif:r af slagen, och "
336,RO_1692,0122_0122," sig i alla saker in omnem eventum något förbehåller, enär Appellationen enom blif:r af slagen, och man lijkwist med andre och sedermehra erhåldne starkare skiäl wore i förmodan att ett be¬ nägnare sluth"
337,RO_1692,0125_0125,". angående en Schass, per definitivam är afgiordt och den där emot sökte appellationen, emedan Sum- man ey war appellabel, afslagen, så att domen alla¬ reda ernådt vires ret judicata; Ty pröfwer Rätten h"
338,RO_1692,0132_0132,"t, ty det wore Differentz emellan Pykt och fat- tigt folck, dhe rijta lembna köttet fult med fetma, man 255"
339,RO_1692,0133_0133,"len, som tyfwarne långst med inallen bort burit och effter sig spilt; Stallskullen wore så låg, att man kan halmen taga uthigenom dö¬ ren, och sielfwa gården icke omkring stängder, Elliest säger hon sig "
340,RO_1692,0134_0134,"tt tyf- wen Christer Michelson än sedermehra welat åth Mustcant skan sellia talg, men emedan hennes Man hade befalt henne intet wijdare där med sig be¬ fatta, hade han altså låtit det blifwa. där näst in"
341,RO_1692,0134_0134,", hwij hon sådant icke sielf giorde, men hon swarat henne, det Hr Rådman Schlyter, som lönar hennes man, torde henne seya, det hon wäl sielf behöfde talgen, derföre icke we- lat där med gå åstadh. Wijdar"
342,RO_1692,0135_0135,"t skole i Skåppet intagas, oppehållit, då det foge- ligit wins hafft, druckit sig fuller på Hr Råd- man Hukens krogh hela dagen och öf:r Natten intil andra dagen, låtit sina Cammerader öf- 17 Dr lena och"
343,RO_1692,0139_0139,"gången, huru wijc- kit talg nödwändigt en Oxe böör hafwa, ey heller trodde det wara en miracul, att man af 2 fleta Oxar och 2 ferta fåhr haf:r i alles bekommit 2½ lb talg, sedan han af kötet talgen gränt"
344,RO_1692,0144_0144,"ärandens klaga, warit för kårt, der på wederbörln sig att förklara, hälst emedan han behöfde en god Man hans oskyldigheet att befordra; Icke deste mindre wille han wälmeent, denne gången föreställa, huru"
345,RO_1692,0146_0146,"han KrygzRättens Protocoll welan förkasta; den be¬ gärte Dilation föruntes Bröker, såssom en gammal Man, och denne Saken syn röra ähran. Gabriel Imnelm Wemttia Balthasar Ladv: Nica Wåldinghys Böissman # "
346,RO_1692,0150_0150,"16 Matt husu tilspordes, huru han sluppit löös ifrån Corps de guarde Maria Jöransdotter emot hennes Man Erich Chri- sterson, angde oenigheet och slagmåhl Martzen Krans emot Johan Schrning, angde för- tie"
347,RO_1697,0004_0005,"iel Hinnell och Baltha- har hado med Rådmännerne Christi an Hueck, Lars Malm och Jacob Bois- E.O.J. man. Handelssmannen Hans Jürgen Lackman gaf igenom inlagd Supplication tillkäna de, det han wed sin hee"
348,RO_1697,0004_0005," sin heemkombst ifrån Wijborg förnummit, huru såssom denne Rätten honom Sipärer öfwer Ciembnärs do- man i Engen- Lagens Saak. honom pålagt Handellssmannens i Lö- beck S:r Engenhagen förmeente fordring at"
349,RO_1697,0011_0012,"tijdh laga broen, hade han ingen nekat. Sedan berättade Rådz Tienarne Måns Gadde och Augustin Long. man opå tillfrågan, att dhe sedt rummet der hästen brutit sitt barn, som warit emellan Kopoinens och Sa"
350,RO_1697,0016_0017,"t han sedt Annikas Moder Carinhaff på fingren 2ne Sölfwer ringar, och att Annicka sagt, dett hennes Man dem hittadt, mehra wiste han intet och togh så affräde. vid: 40. Thomassons gårdh här i Staden för "
351,RO_1697,0017_0018,"derkastat sig i detta måhl Stadz Rättens Jurisdiction, hwilken 2:o icke heller skall wara konungens Man eller 29 een Cronobetient, uthan Licentmest:n Lindm. med mehra som han ej dess Exception så wijda a"
352,RO_1697,0018_0019,"ns uthförande, effter som han, som opsagt sin handtering å denne ohrten torde resa här ifrån, innan man kun- de erhålla något remiss i detta måhl. Mart:s Martens förklarade sigh willig att stella. för si"
353,RO_1697,0019_0020,"ne det intet giöra kunde? hwar till hustrun swarat; det hon såldt sin kiortel åth Anders Tyskä, men Man- nen då warit aldeles höpen; tilläg- giandes wittnet, att denne Johan som är hans granne tillförend"
354,RO_1697,0026_0027,"aria, sampt 2ne barn med henne samman aflat. Rätten til sporde honom, hwarest och af hwilken Präst- man dhe wijgde woro? hwar till Jacob gaf till swars, att een Präst på Stzka- ri h:r Samuel Lentz ben:dt"
355,RO_1697,0029_0030,"ppå yt- terligare, att emedan hon uti denne sin uthsago wore aldeles skilliachtig med sin förmeente Man Jacob Kifwienen, i ty hon wille påstå sig i Narfwusi wara med honom wijgder, men han föreburit såda"
356,RO_1697,0031_0032,"tet mehra öhl då H:r Lieut:n Duben och Fendrichen Jordan sagt till Hebenstrijdt honom sielf sedt at man icke kände bekomma Öhl, hwarföre det wore bäst att hålla opp, hwar på Ste benstrijdt sig högt oblig"
357,RO_1697,0034_0035,"e instälte sig och åf:n be:te Soldat An- ders Anderßon, berättandes att denne rättens wakare Lijsas Man Soldaten Gustaff Pehrsson wa- rit een rum tijdh borta ifrån Lyssbeta, men hon lijkwäl blifwit hafwa"
358,RO_1697,0035_0036,"eskylte Lijssbeta tillstod att hon warit hafwande Hr då hon gådt uthur åf:r be:te Krig af sin ächta man Soldaten Gustaff Pehrsson hwarföre hon intet orsaak haff sitt foster att förgiöra, berättandes huru"
359,RO_1697,0035_0036,"r befalt att gå bort, hade begifwit sig in hoos Snickaren Jöran Petersson, och där tillijka med sin Man, som då warit siuklig, oppehållit sig i Snickarens Bad- stugu 63 stugu; Enär nu Snickaren fastlagzf"
360,RO_1697,0035_0036,"h högel: nekade sigh med någon fremmande den tyden bedrifwit otucht, uthan hade hoon Barnet med sin man aflat. I lijka måt- to nekade och lyssbetas Moder sig således tahlt, som Anders berättadt, uthan so"
361,RO_1697,0037_0038," effter som han icke straxt i hennes Mans Lijfztijd, uthan först om Pingsttijden, som ma dag hennes Man blif:t dödh, giordt saken anhengig, och bracht henne därige nom uti arrest, oachtadt honom icke kun"
362,RO_1697,0037_0038,"it åhr if:n mehrbemte krog, hade han tagit sitt herberge uti witnetz Badstugu och sig därjempte sin Man alt in till tess han afgick meddö- den, oppehållit; förl:ne wintras fastlag tijden hade witnetz man"
363,RO_1697,0037_0038,"Man alt in till tess han afgick meddö- den, oppehållit; förl:ne wintras fastlag tijden hade witnetz man om en mårgon henne /: Lyssbeta :/ skickat till Staden att kiöpa sig fisk, då hon igenkommande med b"
364,RO_1697,0041_0042," honom skyl dig blifwit, som tienar desse Parter till skillnadt. / Handelssmannen Hans Jurgen Lack- man inkom med een Supplication, dess C medelst han sig wijdlyffeln beswärer öfwer dess Cautionister, at"
365,RO_1697,0042_0043,"hl. Snickarens Hin- drich Nymans dotter kiöpt, hwilken och lefwererat Peng:r där till. Roman påstod man påstodh deremot högel. sig hafwa lefwe sitt förra, att Nemblen Kjander för dhe 2 L℔ Lijn wore honom"
366,RO_1697,0043_0044,"nens Christopher Andersons trägne begäran således annoterat. /. Såssom Stadz Fiscalen Matthias Prof man nu åter anhölt, att innan den aff Ciembner Rätten bewiltiade Concursus Cre- ditorum uti fordom Hand"
367,RO_1697,0044_0045,"de: att hon förleden wintras jem wäl warit inne hoos Snickaren Jören Peterson, der Liesbeta med sin Man då äfwen giäste, och enär hon begaf sig där ifrån till Handelssmannen Hans Hindrich bobin Liesbeta "
368,RO_1697,0045_0046,"å kunde wijt hiel på 8 mk. pgr. Rätten intet admittera henne att giöra Edh i denne saak, som hennes Man / pröfwes Anders wara delator uti dock giorde hon uthan Edh fölliande berättelse: att nembl. den ti"
369,RO_1697,0045_0046,"ättelse: att nembl. den tijden då Lyssbeta warit krögerska i Borg- mester Lados Krogh, skall hennes Man fram- ledne Soldaten Gustaf Pehrson sällan A.Jöns warit hoos henne och altijd siuklig, så att hon f"
370,RO_1697,0045_0046,"fter Påsk in till dem i bemte krog och uthan något föregångit annat tahl sagt dhe orden, som hennes Man och före- gående Gertrud berättadt. Tyssbeta ne- kade nu som för detta med hög bedyrelse sig med Sk"
371,RO_1697,0046_0047,"ig här för Rätta hafwer förklarat. Rätten förehölt Anders Andersons hustro Annika att så wäl hennes Man, som och Gertrud Andersdotter sagt, att Lyssbetas Moder Annika af annat tahl blifwit föran- låten t"
372,RO_1697,0049_0050,"om uppehållit sig i ber.de Krog; nogsampt weta. Anders frågades hwa- rest dhe förtijden wistas, att man dem i detta måhl afhöra kunde? Rt dem wara bortreste på Finska sijdan, wetandes han intet seija på "
373,RO_1697,0049_0050,"ara Mårtens dotter Edel. afhör der, hwilken intygade, att hon i Sommars straxt effter det lyssbetas Man Soldaten Gustaff Pehrßon blef begrafwen sedt att Lijssbetas Moder Annika Jörensdotter med en Krögar"
374,RO_1697,0051_0052,"rifftel. wille in- läggia Rätten tillsporde dy Wiborgen, om Sittmans dotter är ogift eller äger een Man? hwar till han swarade henne wara giffter i Carelen; seijandes på wijda, re tillfrågan hennes Man h"
375,RO_1697,0051_0052,"n Man? hwar till han swarade henne wara giffter i Carelen; seijandes på wijda, re tillfrågan hennes Man hafwa Mundhel: honom Matthias Wiborg prætenderar för- medelst arfzrättig- heet Jochim Bro- kers går"
376,RO_1697,0051_0052,"sig hafft, så anhåller fullmechtigen, det gullsmeden igenom laga doom kunde tillhål. Zacharias Duri man C: Hinrich Te masson, om 30. c. Silfwers præte- sion."
377,RO_1697,0052_0053,"en Mr Hindrich Thoma- son godwilleln tillstår att hafwa emot- tagit af Fältskiären Zacharias Durch, man 30 lodt Sölfwer att förarbetas, och dem än intet åter lefwererat; dy finner Rätten skiäligit att Gu"
378,RO_1697,0054_0055,"klarade sigh, att han allenast före- hållit Procuratoren det han icke bordt kal- la honom een löser Man, så wijda han sig i Narven nedsatt. Rätten antydde Par- terne, att dhe denne Saak särskilt kunna ut"
379,RO_1697,0061_0062," måtte giöra redo för sig och inläggia een Räckning öfwer den här tills förde dispositionen, på det man fin- ge ske hwad så wijda kan wara att på- minna, helst det nu wore een god tijdh förfluten, sedan "
380,RO_1697,0064_0065,"onom på foten; hwar af så wäl som och att drengen opå Grans begiäran icke welat låta afföllia grun- man, så wijda icke heller han /: Acterfelt :/ fådt 40 hade begge Gräner- ne icke aflåtit att bedia hono"
381,RO_1697,0071_0072," förfahra med Saken, som för Rätten förswarligit och dess Embete eenligit wore; hwarföre och emedan man här tills af Ryttaren Teckes frånwaru på Commenderingarne deruthinnan blifwit hindrat, dy låfwade R"
382,RO_1697,0089_0090,"at misstan kar till henne, som hon lijkwist icke skal afweta; tillståendes elliest Carin att hennes Man Johan straxt enär desse galoner fans der af weta fådt, men för samma orsaak skull icke p kunnat det"
383,RO_1697,0089_0090,"ter wordo bekommande. Sedan hade Carin bedt henne blifwa hoos bar- nen, så lenge hon ginge till sin Man i Corps de Guarde; Och enär Carin sielf blef quarhållen i arrest på Skantzen, hade Anders 171 Ander"
384,RO_1697,0092_0093,"ij 696, attestera, sig wär- derat ber:de gård för 200 D: Kmt: Förden- skull Jacob Böis- Jacob Böis- man betalar Ber till Pappmens geld H Johan Nyman. med Nymans der hoos fogade quitancer"
385,RO_1697,0095_0096,"garen Bertill Par- pinen; dy instelte sig dess hustro Annika Oloffzdotter och berättade, att hennes Man för någon tijdh sedan reest opå landet i me- ning att förskaffa sig medell, hwar med han kunde stel"
386,RO_1697,0095_0096,"it fall lärer lijka fullt i saken resolveras; Och blef Annika Olofzdotter antydt, att hon detta sin Man oförsummel:n kundgiör på det han må weta sig där effter rätta. Ao 1697 d. 3 Maij. höltz laga, Rådst"
387,RO_1697,0099_0100,"ig haf ra förnummit, som skulle det hoos Han delssmannen här sammastädes Berendt Dobbin Jacob Böis- man och Hinrik Luhr Förordnas till Bijsittiare uti Siörätten. Lars Staf inlägger en Skul om Berend D 6,"
388,RO_1697,0100_0101," intill dess Rätten erhåller Resolution, huruledes utj slijte måhl procederas boor, effter som d 14 man sig i så måtto å Öhrs och stelle, som we- derböhr allareda för detta haf:r förfrågat. som således b"
389,RO_1697,0100_0101,a- ken ågångne doom af d. 19 Aprilis 694 som således annoterades. Widie gången lät Secreteraren Her man Hertz ochjuda dess slutne Gårdzkiöp med Mårten Lijkonen som skiedde uthan någons klander eller insp
390,RO_1697,0101_0102,"er å Lagboken dheras Trohetz och huldskap ledh, uthan och togo den samma af Stadz Secreteraren Her- man Hertz och Ciembners Notarien Johan Jesper Hinnell, effter den formular som Hans Excell:tz uti åf.r "
391,RO_1697,0102_0103,"96 18 D:r tillhoopa 48 D: Km:tz wärde, som för- teknades. /. R R Sedan inlade Fiscalen Matthias Wed man dess Replicam emoot Juden Leviets seert Welss jempte ett Extract uthur Stadzens Wågbook, angde det "
392,RO_1697,0103_0104,"198. hustro Annika Oloffzdotter och gaf tillkenna att hennes Man wore i gåår stembder Råd- mannen Boisman till swars, ang:de een fordring opå dheras gård; Och emeda"
393,RO_1697,0103_0104,"en, ändock hon låtit honom weta hwad Rätten förr i detta måhl resolverat dij begärte hon det hennes Man ännu nå- got råderum måtte förunnas. har e- moot påstodh wäl Rådmannen Jacob Böks man, att effter s"
394,RO_1697,0103_0104,"on det hennes Man ännu nå- got råderum måtte förunnas. har e- moot påstodh wäl Rådmannen Jacob Böks man, att effter som Pappinen allareda så många terminer försuttit, och icke betalt honom effter Ciembnä"
395,RO_1697,0105_0106,iembnär Rät- tens mäst ber:te Parter emellan ågångne doom Daterat d. 21 Juny 694. hwaruthinnan Cort man gottgiöres åfde honom tilldömbde 10 mk. och Portman ändå erkiännes wara skyldig till Walter 50 D: 1
396,RO_1697,0109_0110,"an delssmannen Lang dess berättelse om Gräner nes uthlåtande emoot honom intet lagl. bestyrckt, det man af honom såssom äfwen af kiäranden i denne Saak befullmachti gat, ey heller begära kunnat, warandes"
397,RO_1697,0112_0113,"as; Men med det öfrige lät Rätten anstå till frambättre. / Vid: 349. Framkom Fiscalen Matthias Wed, man med Lagläsaren Laurentz Brodzeni- us, och begiärte Fiscalen, att lagläsaren måtte wijsa dess Fullma"
398,RO_1697,0113_0114,"tij 693. å Cortmans wägnar, för dhe honom tilldömbde 104 D: Km:t warit med arrest belagd, och fort- man sedan på Fiscalen transporterat efftersom han icke kunnat obtinera betal- ning för Walters undanhål"
399,RO_1697,0113_0114,"t, helst han nu skall sedt, att Walter i den första Räck ningen af d. 4 Maij intet crediterat Cort- man för sin tappa, icke hel:r Cortman skall Hr Debiterat Walter för dess tappa uthi Räckningen af d. 14"
400,RO_1697,0116_0117,"d- männerne Christian Hueck, Lars Malm, Jacob Böisman, Erland Jere- miæ, Hinrich Luhr och Aug: Bör- man./. Denne gången instälte sigh FiscalenPost 225 thias Wedman emoot Juden Levi Assert Welst anhålland"
401,RO_1697,0125_0126," hwilken Rådman igen till sigh togh, wijdare förmäh- Sig ler. Rätten bewilliade att föregående Råd- man Böismans reservatum med obliga. tionen således till dess säkerheet in qvan- tum Juris skulle annote"
402,RO_1697,0127_0128," opbudh opå Pappises gårdh, det 1095 åhrs Protocoll wijdare för uthwijsar, hafwandes Rådmannen Böis man sedermehra erlagt besagde dooms innehåld till Nyman, hwilken deremot dess hafwande Rätt till Gården"
403,RO_1697,0133_0134,"t, Nl. 20 Dr Sm:t; Orkar han intet Botum plichte med kroppen för desse Böter haf:r Simon Jöranson i man- gell af penningar med kroppen plichtadt. / Ano 1697, d. 19. Junij höltz laga Rådst: dag närwarande"
404,RO_1697,0135_0136,"å sine egne och samptl. sine Bröders wägnar een supplication, Mårten Smis des Swärfader Hinrich Ny- man ang: Arf Hinrich Nat man å Sampt sine Bröders sine Bröders"
405,RO_1697,0135_0136,"ine Bröders wägnar een supplication, Mårten Smis des Swärfader Hinrich Ny- man ang: Arf Hinrich Nat man å Sampt sine Bröders sine Bröders"
406,RO_1697,0137_0138,"266. Rådstugu Rättens doom uti Saken emellan Stadz Fiscalen Matthias Wed- man Latione Officii klagande, och Juden Levi Assert Wellss Swarande, angde det Svelff skall hafft Tobac"
407,RO_1697,0146_0147,"ter Straf ordningen de A:o 1653. 1. Wijdare påmintze Bergen om uthslagh; pr 4 mk öfwer Tiufpoikarne Man Eskelson och Bak- Påhlson. Och emedan Bergen nu med Eed be- tygade, att dhe Specificerade Maatwaror"
408,RO_1697,0148_0149,"tet föryttra kan, ey heller inbekomma sin ute stående geld, skall trycka och ruinera. Och ehu ruwäl man å denne Ohrten medh Debyfö- rerne af Christeligit medlydande wed denne älende och särgel. tyden mås"
409,RO_1697,0148_0149,"skall på Dilation wa- rit uthsedt, något rum hoos sig finna; Och alldenstund wed så fatt saker, der man intet hafwer betenckiande en kiöpman uth, perssa, sådant här och där att uthropa, och derigenom des"
410,RO_1697,0153_0154,in Grän- effter denne Rättens doom till Acterfelt borde/ Johan Tafwast Ackerfeltz wugnar i: Ben- am Man om ett Biörn skin-
411,RO_1697,0154_0155,"innell tillsporde Gran, hwad han der med meente? Hwilken swarade sig intet mena der med, dock kunde man fåå see, hwad som blefwe där af, enär saken kan me till den högl. Kongl. HåffRätten, förme- nandes "
412,RO_1697,0158_0159,"tt foster hwar medh hoon då gådt, enär hon kom uthur Borgmest: hr: Ros krogh, påståendes att hennes Man sielf som länge der effter med döden afgick, henne häf- dat, hwilket och synes så mycket troligare "
413,RO_1697,0159_0160,"llare- da i mangel af föda begifwit sig opå landet; dy är denne doom intet publicerat, helst såssom man ingen kundskap kunnat inhäm- pta om henne, antingen hon wore i Lijfwet eller eij; dy præsumeras det"
414,RO_1697,0160_0161,"en Rätten, och att han i denne Rätten måtte skyndsampt hulpen blif- wa, effter som han een reesande Man wore och hade een klar saak, och således begärte niuta hwad honom rättmätigt tillkommo? Rätten repl"
415,RO_1697,0163_0164,"en, då Brijtas Moder legat dem begge att hafwa utj een säng, brede wed den, som sopp witnet med sin Man legat utj. Men om Bröllopet säger hon sig den tijden intet hördt tahlas, är heller wetat att Brijta"
416,RO_1697,0163_0164,"nnens Michel Terwoins 1. §. Hustro Ingeborg Johansdotter wijdare före stält, och så wijda Ingeborgz Man allenast befans wara Syskone barn med Brytad Noder, dy admitterades hon till witnes Eedh; intygande"
417,RO_1697,0170_0171,"tter nekar sigh hafft brödh till Sahlu, och förebär sig ett brödh á 8 ö: K:m:t ährnat bära till sin man, som uti Staden arbetat, enär in Bagarens dräng brödet ifrån henne borttagit, hade hon gådt till hu"
418,RO_1697,0173_0174,"ig uti Stockholm opå Borggens i Sorda- wala Anders Immonens lodia, i mening att komma hijt till sin Man; Men som hon opå reesan ifrån berde Skuta oförmodel.n skall wara bortkommen, och en Poike Johan Eri"
419,RO_1697,0176_0177,"s Mathias Hinrich Schu- machers Sterbhuuss och Qwarlåtenskap, utj hwilken Ritter såssom een Bolagz- man interesserat, till Ciembnär Rätten här in loco att optagas och slutas, skall bemte Rätt förmedelst "
420,RO_1697,0180_0181,"f:r sagde Förordning det uthtryckel:n belärer, och dhe för Gudh höga Öfwerheeten sampt hwar redelig Man tryggeligen kunna och wela an- swara. Och till yttermehra säkerheet och styrckio att Handelssmannen"
421,RO_1697,0181_0182,och effter dhe äre löössdrifr så pålägges dhe att ofördröijeln wijka ifrån Staden 355 Brigitta Bar- man C: Liesbeta Andersdr och C: rin Zachariasd:r ang: stöld.
422,RO_1697,0182_0183,": dag närwarande Borgmestaren Gabriel Hinnel med Rådmännerne Christian Huek, Lars Malm, Jacob Böis- man, Erland Jeremia och Johan Georg Fänisch. / Denne gången wardt effter Justitiæ Borg- nestes Gabriel "
423,RO_1697,0183_0184,kaffa Sufficiente Cau- tionister för deras pupills Påhl Buschertz underhänder hafwande medell. Råd- man Luhr tillböd sig jempte dess Swär- moder Sahl. Rådman Polckens Enckia hu- stru Catharina Peterzdott
424,RO_1697,0183_0184," jempte dess Swär- moder Sahl. Rådman Polckens Enckia hu- stru Catharina Peterzdotter och Sal. Råd- man Dettleff Jochims Enckia hustro Bri- gitta Barckman att gå i berde Borgen, sampt sielfwa Cautions Sk"
425,RO_1697,0184_0185,"cob Böisman, Erland Jeremia, Hinrich Zuhr, Johan Georg Jänisch och Aug: Borman. /: Fram: Jacob Böis man anhåller att komma til sin betalning af Sal. Krögers Sterbhuus. Framkom Hinrich Närman och præsente"
426,RO_1697,0184_0185,"an han dess afskedh framtedt. Narman begärte sådant att innotera, protesterandes der emoot att her- man honom således förklenat, med an- sökning, dett måtte Zeerman stella Cau- § tion för sig, att icke s"
427,RO_1697,0185_0186,"e remitteras till LandzTin get, så wijda den samma opå landet passerat. Påstmestns Fullmechtig Zeer man itererade sitt förra petitum, att först måtte Resolveras, huru wijda När- man kunde antagas till Fu"
428,RO_1697,0185_0186,"stns Fullmechtig Zeer man itererade sitt förra petitum, att först måtte Resolveras, huru wijda När- man kunde antagas till Fullmechtig el- ler icke. Ehuruwäl Procuratoren Erich Leerman Exciperar emoot Hi"
429,RO_1697,0186_0187,"364. Gabriel Hinnel med Rådmännerne Chri- stian Stuck, Lars Malm, Jacob Böis- man och Johan Georg Jänisch; Borg mest:n Lado lät sig ursächta. /. Hrr Tridie gången blef Borgarens Sal"
430,RO_1697,0188_0189,"å dess Swärfaders Majorens Wälb:ne Christopher Armfeltz Bondes Steppan Jacob. lofl wägnar, att wara Man för Leut:n Schulman och stå i hans ställt, förenandes sig derjempte med Ondruska Mikitin att in för"
431,RO_1697,0189_0190,"bland an- dra discourser berättat om een stry- dig Saak, som han hafft i Deval, i ty han slagit een Man een Öhrsyl, hwilken kom- mit honom att stå 200 rDr, men honom Leut: allenast kostot 12 RDr, hwar em"
432,RO_1697,0192_0193," och det så Kjärt honom är att undwijka alt answar. // vid: 378. Såssom Rätten af Rådman Jacob Böis man wardt föredragit, att dhe Pertzedler af Sahl. Johan Krögers Sterbhuuss, som ännu Casper Martin Carl"
433,RO_1697,0192_0193,"å utj osäkerheet opå gam- bla Rådstugun; Dy bewilliade Rätten att dhe å nyo skohla wärderas, på det man sedan finge see, hwad der med wijdare kan stå att giöra, och uthgafz fördenskull till wär- deringzm"
434,RO_1697,0197_0198,"ympt tillbörln aftraffas, som sielfwa Libellen, det med flere omständigheeter exprimerar. Handelss- man Carl Döbin badh, att denne Saak till Ciembner Rätten såssom dess rätta forum remitteras, williandes"
435,RO_1697,0197_0198," förmält finnes Handelssman Debin wille intet tillstå sigh hafwa så illa meent der med att han Råd- man Hurck jäfwat, effter som och han förme nar honom sielf bordt afhålla sig derifrån så wijda han siel"
436,RO_1697,0199_0200,"isabeth Lång här med heel wäl tillfredz och förnöigder, jem wäl Tienstl betackandes M:r Anders Nor- man för sådan sin godheet här uthinnan Således uti god förtroligheet oss emellan wara effter tillstånd "
437,RO_1697,0204_0205," Kongl. Cammar Collegio sig att förfråga huru med dess qwarlåtenskap skall förhål- las; altså kunde man intet tillgiöra, innan högst bem:te Collegium sig deröfwer ttrat, då hwar och een Creditor effter s"
438,RO_1697,0208_0209,"warande Borgmest:ne Gabriel Hinnel och Balthasar Lado med Råd- männerne Christian Huck, Jacob Böis- man, Erland, Jeremia, Hinrich Luhr, Jo- han Georg Jenisch och Aug: Börman Rådman Malm är excuserat. Bor"
439,RO_1697,0211_0212," Agneta Mårtensdr ja ytter- lagare tillfrågan sig hafwa sedt, det både Matz, dess Syster och Syster Man med den för rymbde Wendela ätit blåkåhl. hwar till Matz nekade, seijandes att dess Syster giftz hon"
440,RO_1697,0211_0212,"drog Borgaren Zitting att 2:o effter Rättens gottfinnande RådzTienaren Måns gadde och een fremmande man tagit Eskel Sigfredsons gårdzrum i ögonsicht, men der intet funnit sådant slag gräs, som han utj Es"
441,RO_1697,0214_0215," att Swaranden Hinrich om een affton Kl. 7. kommit till honom med een yxe i handen och frågat, hwar man kunde få brännewed ledan han nu något dröigt och emot kl. 9 bortgådt 419. bortgådt, hade witnet lag"
442,RO_1697,0215_0216,"affton för än Staqvetet wardt nederbrutit, Hindrich wa- rit hoos honom med een yxe och frågat, hwar man kunde få brännewed, och sedan emoot kl. 9. samma affton bortgådt, hwar på straxt om Mårgonen han bl"
443,RO_1697,0216_0217,ifwandes saken för det öfrige uthstelt till bättre bewijs för desse 3 m:rs Böter plichtade Agneta i man gel af Peng:r med kroppen. /. vid: 457. No 1697 d: 6 Novembris höltz laga- Rådst: dag närwarande Bo
