,parent,file,context
0,Kexholm,0134_0136,"anden Maria Clemetz dotter läger sigh intet mehr hafwa taget ähn 6 kärfwar halm och gifwit till sin mågh Johan Pällin, och något lijtet höö på släden till qwarnen Effter som hennesmågh icke war tilstädes,"
1,Kexholm,0681_0684,"ns med Erffwin- ger måtte honom hans andra af samma præ. centimer opfylla, / d: Jeremias Michelssts Mågh Mårten Gran å samptl. Sterbhusetz wägnar infen sig Behmen till swars och swarade att så wäl hans Sn"
2,Kexholm,0704_0707, improberar och gillar. altså dömes bemte Bernt och Erich Casa tain för hwilcken nu Erich Casalains Mågh Simon Pihoin nu är fullmech tigh och här närwarande att samma restenams böön forderligast förnöija 
3,Kexholm,0714_0717, och wäl stält hafwer aflade sin Eedh och giorde denne fölliande bekennelse: att Besmen Matte ormas Mågh och Jochim Freese wore komne till henne uti krogen då Jochim af Samuel Påhlsons hustro som då warit
4,Kexholm,0758_0761,f hans Sal. Swärfaders for- som Rådmans Sal. Jurgen Starckwedh Carie Porten belägne dömpt sin andra Mågh Archli mestaren Carl knäffta att sigh derå wånachtig huus bebyggia hwilcken andeel med derå stående
5,Kexholm,0759_0762,oldt hertz att han wedh den tijdh han bödde här i staden haar medh sitt dagelige um gänge medh hans Mågh fäldskären warit ophofwet och orsaken till all den oenigheet som i Echtenskapet emellan Fäldt fören
