,parent,file,context
0,Kexholm,0126_0128,"r nu? och i dett samma hafwer b:te På- wel Gröön, samme ordh hördt, och är dher på uthsprungen uthi Släden och honom uthi ahn sichtet slagit, så han all Uppswullen war och blånadt bekommit, och honom ähn d"
1,Kexholm,0134_0136," mehr hafwa taget ähn 6 kärfwar halm och gifwit till sin mågh Johan Pällin, och något lijtet höö på släden till qwarnen Effter som hennesmågh icke war tilstädes, dy uppskiötz till nästkommande Rådstugu dag"
2,Kexholm,0134_0136,"under tijden när han hafwr kommit till Rijsijdan, hafwer hon gifwit honom hen lampn höö medh sigh i släden. doch icke kunde det bekenna, att han effter Erich Malljanens berät- telse 3 permes höö och en Per"
3,Kexholm,0186_0188,"llkenna huruledes Borgaren ifrån Sordawalla Jöran Mäyer hafr annammat honom 2 st:r hattar, uthi sin Släde, att fortföhr ligt till Kexholm, denna a 2½ RDr in specie och den andra å 1 RDr inspectie, hwilken "
4,Kexholm,0323_0325,"edh en Schumph Swaranden Michell düster säger, att det wa- sandh att der om Natten och utastade min släde, doch lätt han dem godwilligen dom besökia; Ty han hade alldristredt, att dett skulle att det skule"
5,Kexholm,0323_0325,"att drijfwa; bekänner och strax om Rätten när Compagnies betiänte ahn men och begynte visitera hans släde, hafr hon strax willigen uthan någon gensagu dem rullen oppwist då strax samma uthsagor hafft, som "
6,Kexholm,0327_0329,"tt tierhoinen den skulle och tillsagt men sådan der hem kommo, hade hwar andeste samula warit uthur släden bortagit; då der honom hade frågat, hwarföre han hade sin släda Ladig giort då Pir hon hade sagt, "
7,Kexholm,0364_0366,"en intet nu lährer ga att framsättia; wijd detta således passerade nu Arendatoren Jacob Ruth med en släde köpan s; Då hoppman Örtken b:te Ruth igenom fän- en fick see komma, sade han, nu kommer uthan, der "
8,Kexholm,0469_0471," swarat; att Rådh må intet hielpa mig; der med denne dråparen hade tagit hans säck och kastat uthur släden och der må körde han sin däg åth qxarna, och under wägen hörde han en röst som frågade honn hwart "
