,parent,file,context
0,RO_1659_1699,0030_0030,"t och lagdt Under lijkens wäs- stra arm en i hoop bundin groff Lijnklut, uthi een knuta, medh Salt, Talg, och skafning uth af hennes egen trojekraga af swart tygh som hon sielf seger, men ingen kan wäll w"
1,RO_1659_1699,0165_0165," Eric Peerßon igenom wederbörandens Assistense låtit arrestera 13. lb Smör 9 lb geddor, och half lb Talgh till Näste Rådstugu dag, hwilken nu framkal- lades och tilfrågades, hwadan den godzet upkiöpt, Swar"
2,RO_1659_1699,0165_0165," Maij:tz Ordning och Kiöpm. B. 23. Cap. böhr han mista sitt godz, 13. lb Smör, 9 lb gedd:r och ½ lb Talgh, och der til bötha 40 mk.r S.r M.t och alt detta wari Konungz eller Hans hög Grefl. N.s een saak. d"
3,RO_1659_1699,0166_0166," och derifrån tagit ½ t:a Råg, 7 st brödh, 1 half fåår, 2 st foglar, en Orre och Tiederhöna, 8 mk:r Talg, 2 mk:r ull, och spunen Tråå, till 8 al:r Walmar, 1. lb fisk, Een Ny Lerfftz öfwer- deell, der af h"
4,RO_1659_1699,0166_0166,"oos Karja- laises hustro för 3 öhre brennewin, och den: 2: hos Airi: kaises Hustro för 2 öhre Dito. Talgen skall Frantz Keckoi- ses hustro hafft hoos sig. Men Skarprättaren den igen löste för 8 öhre K.r M"
5,RO_1659_1699,0166_0166,"re K.r M.t påstodh den warit hans egen. Keckoises Hustro Walborg tilstodh sig hafft hoos sig 1 mk:r Talgh, Airikaises hustro Karin Larsdåtter tilstodh sigh hafft Lerfftz armen allenast hoos sig, men sielf "
6,RO_1659_1699,0167_0167,"ro, den Enkian igen bekommit medh bedyrande att den warit hennes, den andra hoos Airikaises hustru, Talgen hoos Frantz Keckoises hustro, Foglarna upätit som Airikaises hustru intygat, och Skarpräntarn sie"
