,parent,file,context
0,Kexholm,0101_0103," som wedh skeneste Rådhstugu dagh till städes wore. Advocat Fischalen Johannes Scheffers breff dat, åbo d: 13 Aprilis 663 Inlades i Rätten, och effter öfwerläsan¬ det sade sampteligen Rentens besittiare,"
1,Kexholm,0176_0178,"a Ordre, ifrån P: Excell:tz Hr Gen: Gouverneuren, att publicera hwad den Högl:r Kongl: Hofrätt Uthi Åbo om dher klagande Borgarne förord- nadt hafwer. Men oansedt der klagande Par= ter i rättan tijd Cite"
2,Kexholm,0209_0211," Borgmester och Rådh N:o 53 Samma gång bleff den högl:r Kongl: hofrättz dom och resolution, Daterat Åbo d 11. Novembris 667, hwilken d 22 hujus ahn= kom"
3,Kexholm,0215_0217," och förbudh, dat: Stockholm dn 2 Novembr 1667. Sannegång blef den högl:r Kongl: hofrättz bref, det Åbo d. 25 Aprilis 667 till Wäll:ne herr Landzhöfdingen skrifwit, och nu nyligen i Wiborg öfwerlefwerera"
4,Kexholm,0300_0302," annars skee wid mindre han nu skulle fullfölgt blifwa er och der med wäll bemögde att en Advocat i Åbo blefwo betingad, som saken emot läsaren kunde uthföran; och han hans iak rätt mäteligen tillkomma /"
5,Kexholm,0310_0312,"b:te talat med honom om winteren de öfr, och sagt för denne Peter Jannukain, att nå- derskrefte opå Åbo reesan, och Sigfrijd Matzons Son Staphan, skall hafwa lofwat wilia försträger denser Brusio penning"
6,Kexholm,0349_0351,"er och Rådh samma gång hatt wälb:ne herr Landzhöfding en Publicera den högl. Kongl. hofrättzdån at: Åbo d 29 Aprilis 672. ahngående den skyllningen, som Borgaren Sigfrijd Matzon wid sin som Staphan, hafw"
7,Kexholm,0403_0405,"önn i try dygn, effter det 35 up I Rådst: B. så wäll effter den högl Kongl. befrättz resolution dät Åbo de 23 Aprilis 667. D 3 Aug: wed ord: Rådstugu doch, närwarande Borgmästar och Rådh N:o 40. Pålades "
8,Kexholm,0494_0496,"la de dato d 27 Aug: Ao: 1678. Hwar uthi finnes hinrich Pierfoin för- wälde på dett landh som jdhan åbor wara straffat till 40 mkr der med bewijsandes, an tinnan ingen deel hade att prætendera af Johans "
9,Kexholm,0533_0535,"t. ty  fälles han till syne 40 mk Sölf.r m.t för förste gången effter den höglofl. Kongl. Hofrätz i Åbos Resolution, och kånan som nu förste gången med Lönskelägo sig för- sedt förskones med böterne och "
10,Kexholm,0573_0575,"z medh den sidste Påsten ankomben Nådige skrifwelse till Bårgmästare och Rådh här sammastädes, Dat: Åbo den 27: Septembr. sidstleden, Af innehåld att Kongl. Maijtt allernådigst resolverat hafuer, att all"
11,Kexholm,0726_0729," Anders Pirhoin Blef till dömbdt i föllie af den Kongl: afRätt skrifftelige ankombne ordel Date rat Åbo den 6 Decembr. 690. Soldaten Anders Forsman medh Soldaters, herber- hans Enckia Anna Andersd:r Conf"
12,Kexholm,0854_0857,rdt till åhrligh Skatt 24. Cpr: erägnandes deraf wäxten 3. t:r effter tunnan och sedan uthsädet och åboens är swode som Skattas till Eftter afdrages qwarblifwer Spanmåhls Skatten 4:r 8 Dr som uthrächnas 
13,Kexholm,0895_0898,"h¬ ren med Lana som doch allt i H: Bårgmest. Gabriel hinnels och nu warande Bårgmestarens tijdh med åboens tillstånd och minne skedt är, hwil¬ ket eij är af det importance at der af något till Skatt kann"
14,Kexholm,0896_0899,"fwer Skatten ded af således berächnat i anseende till det åkeren kann fasta af sig, sedan uthsädet, åboens Erfwode som Skattas till helften Präste och Klåckare rättigheter uth¬ äro afdragne at af dhr 1. "
15,Brahea,0191_0192," Gu Dahl.r Sölfwer myndt, och kohnan för- skones skones första gångh, effter högh Kongl. Håffrätt i Åbo Resolution, men för widh skepellße emot Partain hon föröfwat. Ehrkänner Rätten, adt hon böther - 40"
16,Brahea,0230_0231,"å fältes han till – „ 40 mkr. Och kohnan förskehras förste gången; Effter högh Kongl. Håffrättens i Åbo Resolution/. Hoata Sawanpoika Käranden emot Erich Puhacka swa- anden om - 8 Claß Halm, den som af h"
17,Brahea,0232_0233," som andre gången ähr fallen i syndh; tå ther - 10 D.r Dito Waleur Effter högh Kongl. Håffrättens i Åbo, och stoor förstendömet Finnlandz resolution Anno 1674 d: 5 Augusti, höltes ordinarij Rådh Stugu da"
18,Brahea,0236_0237,"hafft legersmåhl med Anna Kaakitar, och han henne icke ächta will; Effter högh Kongl. Håffrättens i Åbo Resolution och stoor försten- dömet Finland, böther förste gången – 40 mkr. och Kohnan - 10 D. Sölf"
19,Brahea,0292_0294,"Sölfz Mynt, och Kohnan förskones förste gången medh Kyrckiostraff, Effter Högl Kongl. Håffrettens i Åbo resolution. ANNO 1679 28 Maij Höltes ordin: Rådstugudagh Nährwarandhe, Borg- mestare och Rådh. då f"
20,Sordavala/s1,0012_0012,"e Grefwe Gustaf Adam Baners Nådigste behagh, dhet Borgmästaren här i Stadhen sigh till dhen Kongl:n Åboske håffRätt förfoga skulle hans högh Grefl:gh Excell:ss Action, emoot Maijoren Wällb:e H:r Didrich "
21,Sordavala/s1,0015_0015," eij han förledhen wåras införsittiandhe RådstuRätt 12. RådstuRätt uthi Borgmästarens frånwaro till Åbo eet laga bewijs om sit förrehållandhe uthi sin här warandhe tijdh begiäradt, der  Emodh haf:r han f"
22,Sordavala/s1,0039_0039,"dhe sådant kungiordt houptman H:r Johan Tist[ell]  hwilken sedan uthi Borgmästarens från warro till Åbo, låtit för berörde Ryse Arestera till 60 kannor bränwijn, till Borgmästa[rens]  hemkompst, dhem Rys"
23,Sordavala/s1,0039_0039,"ågot bränwijn medh måth uthmånglat, och ändåch Borgarena den gångh uthi Borgmästarens frånwaro till åbo haf:r af H:r houptman Tistell och Rådmännen uppå hans bränwijn nådt Arest och wedh 40 mk:r Wijthe b"
24,Sordavala/s1,0040_0040,"m han tilllijka mz Rådmannen slagit Arrest oppå Juskis Bränwijn uthi Borgmä- starens från woro till Åbo, och til des hemkompst wedh 40 mk:r wijthe bränwijnet att bårtföra, för än laga dom öf:r gången war"
25,Sordavala/s1,0071_0072,"he förlåfwat ifrån dheras Ländher till Stadhen sigh att nedersättia, effter bröderne ähnu Ländherne åboo willja, och som desse den eena Staffan Käckoin från Pirti Pohja by och Brusius Lem- binen från Läp"
26,Sordavala/s1,0124_0125,"om gifua, Alle desse ähre förreste och eij hem ma, särdeles Mutka och Afwinen till Tafwastehuus och Åbo Lähn, huilkas hemkompst Eij snart skee lährer, medler tijdh opskötz medh widare Ransakningh i denne"
27,Sordavala/s1,0262_0263,"br 1687 afgångne Nådige Bref, medh hoosfogat Copia, af denn högl. Kongl. Hofrätz resolution de Dato Åbo d. 3 Decembr jusdemetr- ni, Uthi Saken emellan Johan Purhoin moot sin hustru Walborg Thomas- dotter"
28,Sordavala/s1,0319_0320,"kin Publicerades den höglåfl:a Kongl: Håffrättz till denne Rätt Nådige inkombne Skrifwelse, Daterat Åbo den 12 sidstleden Febr:, hwar uthi förmäles det Kongl: Maij:tt allernådigst resolverat, det alle re"
29,Sordavala/s1,0334_0335,"n den andre Pitkä Christer gått sin koos till sitt heemwist, som skall wara 2 Mijhl på denne sijdan Åbo Stadh och Somero Sochn utj een gästgif- ware gårdh: denne Nasaaken bleef frågat, hwad för een domb "
30,Sordavala/s1,0425_0425,"hwar uthaf han i dhe tanckar är att hans oxe i stället för denne andra är tagen, helst han åth alla Åboar på åfftabem:te holma dätta skall med diaken  iembwähl här i Stadhen, uppenbarat och i kyrckian ly"
31,Sordavala/s1,0439_0439,". Efftersom pröfwes högel:n af nöden wara, att dene Staden /: som åhrl:n tilltager medh Borgare och åboar, hwilcka kunna till Stadzens nyttigheeter något contribuera, där det förr  enär dhe fåå warit ick"
32,Sordavala/s1,0455_0455,"r å, hwar före han och dhem dijt fördt; men då dhe utj någre dagars tijdh såledz där fiskiat, skall åboerne i Tuoxlax dhem medh hugg och slagh öfwerfallit, hwarföre dhe och begifwit sigh hädan, Och hans "
33,Sordavala/s3,0005_0006,"j:tz Allernådigste förordningh af  sidstledne d 30 Octobris ifrån den Höglofl: Kongl: HofRät- ten i Åbo d 23 Decembris till denne Rätt öfwersändt, Om  Eedgångers wedh doomstohlarne förhållande; Så att de"
34,Sordavala/s3,0005_0006,"tz allernådigste Förord- ningh af d. 1 Martij förledit Åhr ifrån den höglofl:e  Kongl: hoffrätten i Åbo d. 7 Januarij hujus Anni till denne  Rätt öfwersändt, om rangen, att ehoo som där emoot bry- ter el"
35,Sordavala/s3,0010_0011,s Hulckoin. Så publicerades Kongl: Maij:tz Allernådigste förordningh ifrån  den Kongl: HoffRätten i Åbo d. 28 sidstledne Februarij till denne  Rätt öfwersändt angående Cessiones bonorum och huruledes  dä
36,Sordavala/s3,0014_0015,"Aprilis daterat och till  denne Rätt öfwersändt Breeff, hwilcket förmäler at den  Kongl: HoffRätt i Åbo communicerat högbem:te hans Excell:s huru  som Kongl: Maij:t af den 10 passato i Nåder behagat föro"
37,Sordavala/s3,0024_0025,"llernådigste Placat och för- budh af d. 18 Maij hujus Anni ifrån den höglofl:e Kongl.  hoffrätten i Åbo d. 4 sidstledne Novembr: till dene Rätt  öfwersändt, förmälande, att ingen må widh Straff, hwar- ke"
38,Nyen/RO_1684-1687,0016_0016,"räsens berättadhe at Rius har låtit föra till honom öhl till sahlu, 14 dagar för, än han reste till Åbo; och tillstår at Swaranden har kiöpt af honom sit huus för d, 17 D: Kopp:r m:t Rius bekänner änteli"
39,Nyen/RO_1684-1687,0039_0039,"lagdt, ty blifwer Appellationen in honorem Supe- rioris till dhen höglofl: Kongl: Aboiske hoffRätt i Stor furstendömb Finlandh har medh effter- gifwit och näst kommandhe juridica pro te"
40,Nyen/RO_1684-1687,0041_0041,"lations penningar erlagdh, ty blifwer Appel- lation in honorem Superioria till dhen Höglofl: Kongl: Aboiske HoffRätt: i Storfurstendömb Finlandh här medh effter gifwifwen och nästkom- mandhe juridica pro"
41,Nyen/RO_1684-1687,0130_0130,":r Bogislaus Röhling edeligen nu i saken må afhöras, emedhan han står på resandhe foot at resa till Åbo, och kom ske intet så snart kom- mer hyt igen; men Emedhan Swaranden be- rättar, sig intet för slå,"
42,Nyen/RO_1684-1687,0150_0150,"yrkio tiuf- nadh, ty skiuter Rätter henne under Gudzdom, till des den höglofl: Kongl: Håff Rätten i Åbo wijdare gifwer des nu- dige anledning huru medh henne yttmehra ma förfåhras, eller sanning igenom a"
43,Nyen/RO_1684-1687,0151_0151,"traffordnin- gen till Lijfwet och at hängias, hwilket dock till dhen höglofl: Kongl: Håff Rättens i Åbo wijdare Liuteration uthi Underdånighet blifwer hemstält; d: 14 Septembr. Uppå inkomne ordres och be"
44,Nyen/RO_1684-1687,0151_0151,"uren högwälborne H:r Jöran Sperling af d: 8 innewarandhe, sampt der hoos slutne den höglofl: Kongl: Åboiske håffRättens Resolution af d: 3 Augu: sidstledne, angående Kyrkio tiufwen Thomas Kompo, och at h"
45,Nyen/RO_1684-1687,0153_0153,s Excell:tz H: Gen: och Gouverneuren sub Dato Narfen d: 6 hujus och hoos slutne den höglofl: Kongl. Åboiske HoffRättens Resolution af d: 24 oc- tobri sidstleden at Stadz Magistraten skall Sen- tention if
46,Nyen/RO_1684-1687,0154_0154,"h Rijss för Rådh- stugu döran, och sedhan förwijsas Staden, dock detta alt till den höglofl: Kongl: Åboiske Hoff Rättens wijdare godtfinnan- de; Den 17 Junij Stadz Fiscalen Almenius C: S: Petter Schlüter"
47,Nyen/RO_1684-1687,0163_0163,"tså blef dhen samma hela Senatui förrläsan och som tyckt at öfwerskickas till Kongl: Hoff- Rätten i Åboo; Parterne blef der på sagt, dhe skulle här widh nå- got bero låta, Rätten wiorde dhem framdeles ku"
48,Nyen/RO_1684-1687,0168_0168,"Almenium emellan, angående injurier, blifwer effter inlagde Wadhpenningar till dhen höglofl: Kongl: Åboiska haffRät- ten, har medh effter gifwen och Appellant skall wara skyldig widh nästa Kongl: HoffRät"
49,Nyen/RO_1684-1687,0192_0193,"otter. Blefwo denne gången upkalladhe, och bem:te Hustru förehållit, huru såßom den höglofl. Kongl. Åboiske HåfRätten har så wijda approberat Borg mäster, och Rådz doom af d 14 Novemb: sidst- leden, at h"
50,Nyen/RO_1684-1687,0268_0269," Rätt, som Joon Jisti tii effter det 1: Cap: dräp M: wil: Stl hwilcket alt till den höglofl: Kongl: Aboiske HoffRätz wijdare nådige gådt finnande blifwer hemstält; Räkenmästaren Melchior Hardeloff å Arto"
51,Nyen/RO_1684-1687,0268_0269," Eedh bekräffta; och emädhan kiärandens Full- mächtig der till samtyckte ty aflade bemte Elias Eedh åboken, på alt det, som han i detta måhl in för Rätta bekendt hafwer, hwilcket och honom än ytterli- ga"
52,Nyen/RO_1684-1687,0308_0309,"il Militiens behof äro angrepne effter det 26: Cap: Eedzöre Stl och sådant till den höglofl: Kongl. Åboiska hoffRättens Nådige Resolution; vid erin Fiscalen Almenius; Emot Stadzdragaren Olle Somelain, oc"
53,Nyen/RO_1684-1687,0354_0355,316 Gartanoff då dem blef föreläsen den höglåfl. Kongl. Aboiska håffRättens Resolution af den 26: Septemb: sidstledne hwar uthinnan bemte Ryßer blifwa dömbde a
54,Nyen/RO_1684-1687,0362_0363,"ns Re- solution blifwa åthskildhe; vnt. p: 337. Dito Ankom den höglåth Kongl. HofRättens bref ifrån Åbo af d: 29: Octob: sidstledne, att Rådstugu Rätten intet skall uthgifwa peremtoriske citationers, uth"
55,Nyen/RO_1684-1687,0372_0373,"hielpa dem till be- handen thalning af det, som sal. Clas Wargens Änckia effter den höglåfl. Kongl. Åboiske Hoffrättens dom uthi Capital och intresse åth Lars Andersons Arfwingar blifwit skyldig, och sin"
56,Nyen/RO_1684-1687,0372_0373,"en Communice rade, på det de kunna förklara sig derpå; vd: p: 362. Uppå inkomne den höglåfl. Kongl. Aboiska håfRätz bref af d: 2: Novemb: innewarande blef Ryßen Daniel Co- nonoff och drengen Mattisci Gar"
57,Nyen/RO_1684-1687,0386_0387,"at uthi gifwa Handelsman Conradt Ziliax Lätt igenom S: Jochin Bröster producera den höglåfl. Kongl. Åboiske håffRättens Resolution af d: 16. Julij sidst leden, begärandes at, producerum derpå må skrifwas"
58,Nyen/RO_1684-1687,0421_0422,"n till nästkommande Pingeshelgen deße böter att erläggia. Ankom Kongl. LijoffRättens breef Sub Dato Åbo d. 12 Januarii sidstleden, hwaruthinnan betalles Kongl. Maij:tz trenne förordningar den första Date"
59,Nyen/RO_1684-1687,0444_0445,"n med Executi- onen må blifwa förskont in till deß han per- Supplicum kan sökia den höglofl. Kongl. Åboske hoffrätten. blef swarat att uti slijke injuriӕ saker ingen Ap- pellation kan effterlåtas, doch f"
60,Nyen/RO_1684-1687,0449_0450,"ne, Förmyndarne owit terligen uthur Wargens boda derpå anammat, Men 2 nu igenom den höglofl. Kongl. Åboske HoffRättens dom af den 20 Junij 1685 ähre tilhåldne, att swara jembwäl för 200 rD, och att betal"
61,Nyen/RO_1684-1687,0489_0490,"penser i detta måhl å både sijdor e- mot swarandra upsäfne, doch alt detta till den höglofl. Kongl. Åboske Hoffrättens wijda- re nådige godtfinnande och resolution. vid: fol: 315. Den 25 Dito. Stadz Fisc"
62,Nyen/RO_1684-1687,0507_0508,"Tyr- man, och William Ramses stulit hafwa, grundan- des sig denne befalning oppå den högloth Kongl. Åboske HoffRättens Resolution af d. 28 Juli sidstleden i detta måhl. altförtij anhölt Stadz Fiscalen Al"
63,Nyen/RO_1684-1687,0548_0549,. W: fol: 322. Sergeanten Sergeanten Lorentz Valentin 315 blef upkalladt och honom föreläsen Kongl. Åboske HoffRättens Resolution af d 8 Octobr: 1687 angående een Saak honom och Sahl. Hans Soldan sampt O
64,Nyen/RO_1684-1687,0555_0556,"ingsdotter och tagar henne till hustru effter det 2 Cap: gifftm: 23. St. L. Den 9 Dito Ankom Kongl. Åboske HoffRättens bref och befalning af den 18 Octob: sidstleden, att här effter enär något uthur Stad"
65,Nyen/RO_1684-1687,0569_0570,gelse i Kyrckian kungiöres af den höglofl. Kongl. Aboiske HoffRätten Kongl. Aboiske HoffRätten förbiuder Stadz Ma- gistraten att bruka wid underskrifwand
66,Nyen/RO_1684-1687,0569_0570,gelse i Kyrckian kungiöres af den höglofl. Kongl. Aboiske HoffRätten Kongl. Aboiske HoffRätten förbiuder Stadz Ma- gistraten att bruka wid underskrifwande jussu Senatus M Michel K
67,Nyen/RO_1692,0006_0006,"dagar der effter./. Dito förehades dohrman Thomas Påhlson, och förelästes honom den höglofl. Kongl. Åboiske Håff¬ rättens resolution af d. 4 Decemb: nästledne, att Nembl= bemte Thomas för des begångne ti"
68,Nyen/RO_1692,0006_0006,"tt stå honom til swars, utj mjuriæ angde injurier Thomas Pållson förehades och förelästes högl. K.r åboiske håff rättens resolution angde stöldh. Niclas Walding för ords til Servists- fougde och Diedrich"
69,Nyen/RO_1692,0079_0079,"de sijdor i denne saken giorde expenser, emot hwar andra uphäfne. /. Dito Inkom den Höglofl. kongl. Åboeste Håffrättens bref af d: 17 July nästledne til Magistraten här sammastädes, hwaruthinnan Kongl. M"
70,Nyen/RO_1692,0079_0079,"Rächning, hwaruthinnan som fordrar af Sal. Nilis Duas Sterbhuuss 240 D:r 20 öre Kopp.r mt../. hiul¬ Åbo Råffrättz bref ang: Nyia skiäls uptagande, blef publicerat Hiulmakaren Mr Henrich Mårtenson kärde E"
71,Nyen/RO_1692,0149_0149,"jnes gårdh – „ 275 K Knut Tullankast C: Controleuren Johan Schening, angde gefd och slägerij Kongl. Åbo håffrättz bref, jempte innelijcht Kongl. Maijts Placat, angde nyia skiäls optagande, blef publicera"
72,Nyen/RO_1692,0150_0150,"ohan Druwart, angde obewijslig tilmähle - - Thomas Påhlson förehades och förebästes höglofl. Kongl. Åboeste håffrättens resolution, ang:de stöldh - - -  "" - - „ -"
73,Nyen/RO_1697,0012_0013,"oi- ses Enckia hustru Sophia Catharina Jöns dotter och Conrectoren H:r Johan Agander, som förtijden åboor Sahl. Nils Dufwas gård böra böta till Bonden Wasell een fierde part af hästens wärda som är 10 D:"
74,Nyen/RO_1697,0098_0099,id: 341. p så öfwersåg till Ödmiukt föllie af den Höglofl. Kongl. HåffRättens Nådigtz Rescript Dat. Åbo d: 14 Novemb: sidstl.n Acta som äre passerade uti den wed Ciemb- ner Rätten här sammastädes afdömbd
75,Nyen/RO_1697,0099_0100,"ra, uthan pröfwer skiäligit det i föllie af den Höglofl. Kongl. HoffRättens Nådige rescript Daterat Åbo d. 22 Febo: 1695 Parterne uti högbem:te den Kongl. Rätten sig angifwa och i detta måhl resolution a"
76,Nyen/RO_1697,0111_0112," Fördenskull och till skylldigste föllie aff den Höglofl. Kongl. HåffRättens ankom ne rescript Dat: Åbo d. 4 Julij 694 betref- tande slijke måhl, pröfwer Rådst: Rätten"
77,Nyen/RO_1697,0150_0151,"ns Christian Diedrich Langens födia Philip Jöranßon ben.d, som een Kort bijdh sedan hemkommit ifrån Åbo, och nu 293. med een Rysk fahrkåst skall wara åth Stock- holm förrester, nyligen uti Stadzens Corps"
78,Nyen/RO_1697,0150_0151,"n uti Stadzens Corps de Guarde för honom /: Påhl :/ berättat, att för- in ber :/ Langens Lodia till Åbo afgick som kiedt ungefehr den tijden afr sagde Skuta med Cronones Spanmåhl här ifrån till Narven sk"
79,Nyen/RO_1697,0153_0154,"myckit. Sal. han gifwit Hr Kyrcksteds Skut folck. 299. Ladd, som af några Österbåttns boar warit på Åbo befrachtadt, skolandes han för afreesan här ifrån hördt, att Skiepp:n Johan Larsson medh samma Öste"
80,Nyen/RO_1697,0217_0218,akarens techta döör och åth Johan Steitens gård wed Tukala rägen som Timmermannen Staffan Bengt som åboor och Klåckringaren Grelss Simonson skall giästa
81,Nyen/RO_1697,0236_0237,om i Capital och interesse. 674 D: 6 ö: Km:t sampt den högl. Kongl. HåfRättens Reso¬ lution Daterat Åbo d: 17 Maij 697. dess medelst Supplicanten med dess ansökning angde inventer- och dehlning utj Sal. 
82,Kajana/RO_1659_1699,0126_0126," Cuopio, hwar på ähr fölgdt Wälbe:t Hr Assessorens för- maningz breff till hopman om Execution Dat: Åbo d 20 A- prilis 672. Hwilket bref Tickainen föregifwit Hopmannen sku- lat förahtadt kastadt på gålfw"
83,Kajana/RO_1659_1699,0171_0171,"ohan Gamman, och Rådman Hen- drich Cnuthßon./. Effter den Höglofl. Kongl. Håffrätz Resolution, Dat: Åbo d 25 Octobris Nästförledne hijt ankommen d 5 Decembris Ransakades dhe Moncenta som Kongl. Rätt före"
84,Kajana/RO_1659_1699,0182_0182,"r K: M:t Påål Pyycköinen giorde in- språåk, att samma Åker hafwer lydt Under sam- ma gårdh, som han åboor, påladhes bem:te Pyyköinen att han tillställer bem:te H:r Johan hans Penningar igen, innan 14 dag"
85,Kajana/RO_1659_1699,0227_0227,"och alle Engiarne. Frågades RådhMännerne hwarföre dhe hemma- net lagdt i Linda, och icke förskaffat åboe der på, hwilcka swarade sigh 2:ne gångor weelat der på Åboe tillsettia; Men Enckian dem förhindrat"
86,Kajana/RO_1659_1699,0227_0227," net lagdt i Linda, och icke förskaffat åboe der på, hwilcka swarade sigh 2:ne gångor weelat der på Åboe tillsettia; Men Enckian dem förhindrat, Och såsom denna saak icke Competerar detta forum att afhie"
87,Kajana/RO_1659_1699,0337_0337,"ll- deles Nederfallen, som sedermera af bem:te Capitein ähr Op- bygdt och in till dato klanderlööst åbodt; detta effter begiäran Attesteres och Meddeles. Företredde Borgaren Jacob Canainen och angaff Joh"
88,Kajana/RO_1659_1699,0339_0339," att Terwoi till Sahl. Bengt Hambnz hust: och arffwingar försålt allenast sitt Qwartter, Och han nu åboor till huilken skrifft Rätten eij någon Witz ordh gifwa kunde emedan Anders Terwoi nu som för detta"
89,Kajana/RO_1659_1699,0352_0352,"m hon legat, wara dödher, ginast gångit och berettat för Påhl Leinoi- nen som straxt der brede wedh åbodde, huilka och medh hust: Anna Peersd:r som lijket skulle twetta, skohla besichtigat och befunnit, "
90,Kajana/RO_1659_1699,0356_0356,"h in¬ qvarterat och in till den tijdhen, och een tijdh der effter j all Wahnl. tillsammans j gården åbodt; Till alt detta bem:te Margetha icke Till dett Ringaste Neka kunde, Men sedan som Fordelbergh för"
