,parent,file,context
0,RO_1697,0063_0064,"de, att han fådt förl:ne Wåh- ras och höstas något Tobak med Skiepparen Johan Jerisen Enhusen ifrån Amsterdam S D om Wåhren een gång med Skieppn Wolcke Douves och med Sahl. Jochim Danman en gång, som giör till"
1,RO_1697,0063_0064,"r med dess Patron i Holland hafwer. Rådmannen Luhr berättade att han igenom dess Com- misshafware i Amsterdam Dötgens ben:d införskrifwit 2ne faat Tobak, som af en Jude Abraham Levi Möller wid nampn eller denn"
2,RO_1697,0120_0121,ed dess af reesa här ifrån fådt af Reedarne ett aldress. breff till Handelssmannen Hirich Dutgens i Amsterdam och wetat att dess innehafwande last war till ber:de Düttgens consignerat? gaf Skiepparen Tiertz ti
3,RO_1697,0123_0124,"bekiendt, att hafwa hafft i Rådmannens kiellare hwar opå bem:te Rådman framtedde Han delssmannens i Amsterdam Hinrich Hytgens till honom affärdade bref och Rechningh, dessmedelst han besannade att Dytgens för "
4,RO_1697,0166_0167,"ra de een Obligation, som framl:ne Skiepparen där sammastädes Jochim Danman d: 8, Septembris 1695 i Amsterdam uthändigat tillståendes dessmedelst att hafwa blifwit skyldig till Daniel och Levi Möller 80 holl: "
5,RO_1697,0247_0248,"annens i Narven S:r Jean Bomgårdens och dess Compagnions, wegnar andrager, att Sr Nicolaus Kohl uti Amsterdam hoos Sr Jean Langerack och St Jean Nessing opå Borgarens Paul Mausens och andras begiäran här å Öhr"
6,RO_1697,0248_0249," sig dessme¬ delst opå dess förre ingifne Suppliqve, angde den Rätt, som Sr Langerack och Nessing i Amsterdam prætendera på ett partie D Dito Bomgar en emot Cata rina Barckman in Simili casin"
7,RO_1697,0249_0250," ringaste med dem angde denne Toback han delen haf:r att bestella, uthan skall No Ne- colous Röhl i Amsterdam godzet för hennes Räkning och äfwentyr insändt, det hon och med be:te Röhls Räkning af d. 23, 7bris"
8,RO_1697,0250_0251,"Jean Bomgards re Compagnions såsom fullmechtiges wegnar för S:r Jean Lange¬ råck och Jean Nessing i Amsterdam an- håller, att det Tobacket som dhe dersamma¬ städes till S:r Nicolaus Kohlen lefwererat och han s"
