,parent,file,context
343,s3,0014_0015," att ehrläggia och betala.  Petter Pettersson Polack som söckte att winna Burskapen  ähr een förare Son ifrån Sallmis sampt förer ett godt loffordh  nu sigh, aflade och giorde sin Borgare Eedh lijkmätigt"
344,s3,0015_0016,s begiäran i Protocollet inföört.  Bonden ifrån Carmala by och denne Sochn Petter Kijnain medh des  son Johan stälte sigh för Rätta och klagade uppå Borgarena  Christer Martinen och Johan Kåistinen för d
345,s3,0015_0016,26 hufwudet och fadren Petter Kijnain 1 Pust: Jembwähl Käistinen som slagit hwardtera så fadern som Son 1 Pust. Deße Marti- nen så wähl som Käistinen kunde icke neka där till uthan sade  sigh det giordt 
346,s3,0015_0016,"m Käistinen kunde icke neka där till uthan sade  sigh det giordt medelst det deße Bönder fadren och Son uthaf  någon emellan Koistinen och Kijnaiset hoos Borgaren Johan  Laukain, hwarest dhe druckit, erw"
347,s3,0032_0033,59. Bonden ifrån Hälylä by och denne Sohn Påhl Räpo  förekom klagandes uppå Borgaren Påhl Kuockain för  dett han stulit af honom 2 småstänger
348,s3,0039_0040,"en afladhe. Bårgarena Matz Turuin, Anders Hulckoin och  Anders Hafwerin Caverade för Henrich Johan- son Danskain ifrån Martonwara by och Liebeletz  Sochn, att han medh det aldraförsta skall afleggia 74. "
349,s3,0039_0040,"ifrån Pelis Sochn RådhMänn: Thomas Hulckoin och Isack Mackoin Caverat Joans Wallin barnfödd bårgare Son här i Staden Rådh Män:n Thomas  Immoin och Thomas  Hulckoin Cavera:e Jacob Jacobsson Kurcka, sammal"
350,s3,0039_0040,"n Rådh Män:n Thomas  Immoin och Thomas  Hulckoin Cavera:e Jacob Jacobsson Kurcka, sammal:s  bårgare Son i Staden  Råd Män Brun  Ohlson och Iscak  Mackoin Caverat Henrich Brusiusson Lembin ifrån  Sordawal"
351,s3,0043_0044,"in oppå flych- ten till Sawolax i Seminge Sochn och Roikos by hos  Mickel Nousiain, hwarest Immoins Son Matz som  honom effteriagade fasttogh och hijt till Sordawala  medh lempan tillbakars hemptade, och"
352,s3,0047_0048,"89 Framkom Bårgaren Matz Juvoin, och beklagade sigh  huru såssom Rådman Thomas Immoins Son Anders  har sielfwilligt förpantat uthan honom 1 T:a Spanshs  Salt för lådie fracht i nästledne hös"
353,s3,0047_0048,"n låfwat honom uthan fracht  att hempta bådhe Salt, Järn och annat ifrån Stockholm  för det Juwoins Son warit lijka som båtzman  opå Fahrkåsten och oppehållet sigh heela reesan medh  des egen kåst, och d"
354,s3,0047_0048,"för dijt reesan, å begge sijdor differerade dhe härut- innan hwar andra Eeden; Men emedan Im- moins Son Anders nu är förrest till Nyen, altså  Upskiutes medh denne Saak till des Immoins  Son Anders, och "
355,s3,0047_0048,"an Im- moins Son Anders nu är förrest till Nyen, altså  Upskiutes medh denne Saak till des Immoins  Son Anders, och Immoins Son Matz ifrån Nyen  heemkomma, då härutinnan entel. doom falla  skall, helst d"
356,s3,0047_0048,"nu är förrest till Nyen, altså  Upskiutes medh denne Saak till des Immoins  Son Anders, och Immoins Son Matz ifrån Nyen  heemkomma, då härutinnan entel. doom falla  skall, helst dhe begge warit reese Cam"
