,parent,file,context
652,Nyen/RO_1684-1687,0462_0463,"st till NederRätten remitteras. Pölken anhåller att blifwa beskyddad wid sin obli¬ gation och klare fordran. Och emedan Swaranden re¬ cognoscerade sin hand under dess Obligation, jempte och tilstår att Pölk"
653,Nyen/RO_1684-1687,0463_0464,"e Falkens lundell, som han hafwer hoos h: Major tra¬ ser för Medicamenta till Guarrisons folket att fordra och det för den fordring skull, som härrörer af Nierskiot skans första Man Sahl. Gottfreid trme¬ Lo"
654,Nyen/RO_1684-1687,0463_0464,"ul¬ le hafwa åth M:r Falk cederat Sahl. Ermelers gield, uthan Vierskrot hafwer hafft een särde¬ les fordran hoos be:te Falk; men om han sig derom 461 145 derom hafwer förlijckt wiste Swaranden intet, doch o"
655,Nyen/RO_1684-1687,0463_0464,"tet, doch om Attesterne wille deras uthgifne Attest edeligen bekräffta, så wille hon låta falla sin fordran. Rådman ifrån Wijborg h:r Sven Moderus Anhåller å Sahl. Gerichtsfougden Håkan Frostens Änkias wägn"
656,Nyen/RO_1684-1687,0478_0479,"l. Bruchtens Änkia Swarande karanden anhåller att blifwa beskyd wid den Execu- tion som han för sin fordran skull, af Rätten till- förende undfådt; och att få hennes huus i possess. Brichtens Änkia lät igen"
657,Nyen/RO_1684-1687,0480_0481,"ast af nå- der boo dher uthi; Ty kan Jochim Bröker som deremot intet kunnat bewijsa och hafwer till fordra af bem:te Brichtskan, uppå samma huus och nom derutinnan Rättens assistence meddelas till sin ändte"
658,Nyen/RO_1684-1687,0491_0492,"gernhts- fougden H. Huxen och begynt att klaga öfwer Barberaren Tobias Brandten angående een skuld- fordran; men derwidh hafwer Swaranden straxt brukat myken otijdigheet och ohöfligheet, sampt satt 489 201 "
659,Nyen/RO_1684-1687,0557_0558," åth käranden sig hafwa efftergifwit åth M:r Ebbe een deß egen, men intet den Styf- barns gield, ty fordrar Actrix än ytterligare sin betalning af Swaranden, jempte 3 RD. Rät- tegångz Expenser. kea swarar a"
660,Nyen/RO_1684-1687,0557_0558," blifwer nödgad att grijpa till andra me- dell. Valentin bijbrachte wijdare, att deß moder har till fordra ock Sahl. Borgmestar Stiernman för något land som han af henne innehafwer begierer altså att Magist"
661,Nyen/RO_1684-1687,0558_0559,"333 blef swarat, att deß Moder kan Sahl: Borgmestare Enkia sielf tiltahla och sin fordran inkrefwin, och om intet annat, henne lagligen derfö- resökia, då honom Rättens assistentz skall me"
662,Nyen/RO_1684-1687,0561_0562,"erichtzfougde härsammastädes h. Blen¬ kenhagen på handelsman Berend Debbins begiä, ran och för dess fordran till bem:te Elpen låtit tilförende samma wahror arrestera, anhållandes nu bem:te Elpen att H. Blan"
663,Nyen/RO_1684-1687,0561_0562,"a åth Berend Dobbin, uthan bem:te Martin be- rättes hafwa sedermehra förnöigt Berend Dobbin för sin fordran till Elpen, men så- dant ähr skedt Rätten owitterligit. Sergeanten Lorentz Valentin blef åker påmi"
664,Nyen/RO_1684-1687,0561_0562,"lefwererade. eentt, hwaruthinnan dess Moder hustru Eli- sabeth Stampel offererar till betalning een fordran af 20 D. som hon berättar af Pe- ter Slyter härflyta sampt lo D kopp: som hon säger af Sahl. Borgm"
665,Nyen/RO_1684-1687,0561_0562,"yter härflyta sampt lo D kopp: som hon säger af Sahl. Borgmester Stiernman för 1 T:a land hafwa att fordra, seijandes bem.te Serge- Til Conventarium d. 13. Feb. 559"
666,Nyen/RO_1684-1687,0565_0566,"dess gård, som den tijden berättas af handels, mannen Wulff begieres til hypothec för dess hafwande fordran till Sahl. Timmermans Sterb- huus. För det öfrige anhåller käranden att Swaranden måtte tilhållas,"
667,Nyen/RO_1692,0007_0007,"a föra den til Borgmestaren, och sökia arrest derpå, in til tess Actor ställer dem för deras skuld, fordran tilfredz. Actor regererade sig hafwa allenast sagt åth Johan Kuen, ingen åhrl. borware uthan kontb"
668,Nyen/RO_1692,0007_0007,"för honom Caverat hoos Clas Larsson, hwar på ännu re- sterade 36 Dr 16 ö: K:mt, och att Sm:r Thomas fordrar af honom betalning för en klädning, den han doch intet giordt efter Actoris sinne; förmenandes där"
669,Nyen/RO_1692,0011_0011,"effter som Saken, som af den häftige /: doch få fänge :/ angif- wande låter sig see, min närwarelse fordra- de, ty ptesterar Citatus in solennissima juris Ja- må, det intet häruthinnan ransakat, slutit och "
670,Nyen/RO_1692,0016_0016,"nes barn skaffa huusrum, sampt kiöp- skilling emot en discretion hålla hoos sig, in til tess der på fordras, då han dem på ett bräde åth weder¬ böranden wille uthlefwerera; hwilket bemte Lands Fullmechtig A"
671,Nyen/RO_1692,0016_0016,"welaskaffa bewijs, förme- randes när jempte, att Stewen icke så lenge hafft för- drag med denne sin fordran, om hon icke reda warit förnöigd, hälst emedan Stewens Styfson Handels Berendt Dobbin Lars Staf, a"
672,Nyen/RO_1692,0023_0023,"lmenium kärande Emoot HäradzSkrijfwaren Lars Staf Swarande Rells inkom med S:gh Contra R. Ting, och fordrar truthinnan af käranden 42 D:r 30 öre K:mt, begä¬ randes att Käranden måtte sin Rechning, som han i"
673,Nyen/RO_1692,0025_0025,Jost Stewen kärande Emoot Skomakaren Mr Michel Regeberg Swarande Actor inlefwererar en Rächning och fordrar pro- Salo Matthias Almenius Jöran Michelson ang:de öhljellning om Påskhelgen 41 Saldo af Skomakare
674,Nyen/RO_1692,0033_0033,"annens Albrechtz peningar må blifwa i qwarstadh sätt 11 D:r 21 ö: Kmt, som han af ho¬ nom haf:r att fordra, in til des han med honom Clarerar; som till Lätz. Sammaledes begärte h:r Borgmestaren Herman Hartz"
675,Nyen/RO_1692,0033_0033,m Clarerar; som till Lätz. Sammaledes begärte h:r Borgmestaren Herman Hartz arrest på så myckit des fordrar af honom ähr Nembligen hwilket af honom ähr Nembligen hwilket och bewilliades.  7. Johan Kyander l
676,Nyen/RO_1692,0034_0034," Swaranden skyldig, inne¬ hållit, på det Swaranden arfwet Clarerg måtte; wore altså denne kärandens fordran effter Kongl. Placat om præscriptionen de A:o 691 ännu icke præscriberat, hälst emedan med arf in "
677,Nyen/RO_1692,0035_0035,"tt förtekna, det han 300 D:r K:mt af bem:te M:r Rådemacher, effter en richtig liqvidation haf:r att fordra. Capitein Wälb:de h:r Gustaf Murath lät jämbwäl inpro tocollera des fordran af 84 D:r Kmt, som hono"
678,Nyen/RO_1692,0035_0035,"ig liqvidation haf:r att fordra. Capitein Wälb:de h:r Gustaf Murath lät jämbwäl inpro tocollera des fordran af 84 D:r Kmt, som honom af bem:te Mr Rådemacher för resterande 21 paar Commiss Skoor, återstå. vi"
679,Nyen/RO_1692,0039_0039,"enium kärande Emoot Och Berendt Valentins Änckia hustru Elisabeth Stampel per Bartholdum Lin� Actor fordrar af Swaranden 45 RD:r Capital, som hon effter hennes uthgifne Obligations innehåld af d: 15 Martij "
680,Nyen/RO_1692,0039_0039,"äler, uthlåtandes sig Rells, att där Actor des Rechning med Eed kan bestyrckia, wille han honom des fordran Contentera. Fullmechtigen antra detta till wijdare Communication med sin Principal. vid: §: 4 Skom"
681,Nyen/RO_1692,0042_0042,"Dr Kmt innehålla, doch förplichtar sig Arrendatoren, att fast bem:te gården mindre taxeras, än hans fordran och barnsens fäderne sig bestyger, wille han doch lijka fult barnsens Fäderne dem tilställa. Hwar "
682,Nyen/RO_1692,0043_0043,"er reda gott giordt, och där hon wille så noga taga medh honom, hade hon af honom myckit mehra till fordra, än han kunde betala, begärandes altså att Amptman, såssom en Löös karl, måtte på¬ läggias, att stä"
683,Nyen/RO_1692,0054_0054,"Jost Stewen erhållit på 200 D:r Km:t, hwilke han Skomakaren af Handelsman Mår- ten Ziliax haf:r att fordra, anförandes Skomaka- ren pro ratione, att Lewen sielf tilstådt den obliga- tionen på 100 D:r K:mt h"
684,Nyen/RO_1692,0054_0054,a des Rechningh på 234 D:r K.mt. som han å sin Sal. Faders wägnar af Nils Duus Sterbhuus hafwer att fordra./. Michel Rege- berg arrest re laxeras. Johan Wesmans prætension utaf Sal. Duas Sterb: huus. Företo
685,Nyen/RO_1692,0055_0055,ndra Son Johan Clason 14 D:r 15 ö: K:m:t och des Swärson Arwed Gouwinius 39 Dr 9 öre k:mt hafwa att fordra. Stadz Fiscalis Almenius ratione officij Emoot Brijta Matzdotter ben:dh Brijta framfälte til witne 
686,Nyen/RO_1692,0072_0072,"134. sig oppå den skyld fordra p:r Pastor Clajus af dess Sal: Moder hafwer att prætendera, och der om för detta här i Rätten inlag"
687,Nyen/RO_1692,0072_0072,"uppå, och där kunde h:r Pastor Clajus sin skuld sökia, där han förenenar af des Sal. Moder hafwa at fordra; påståendes där jempte sig Bogislaus alz intet äga, och altså intet kunna constringeras att betala "
688,Nyen/RO_1692,0072_0072,"e. Handelssman Berendt dobbin igenom Mons Almenium kärande Emoot Hans Hinrichson Swarande; Käranden fordrar af Swaranden den gullring igen, som des hustrupantt att hoos Swaranden, och med Edh uppå Swaranden"
689,Nyen/RO_1692,0074_0074,"Stadz Timmerman Matt Christerson kärde Emoot Handelssman Diedrich Blom Swarande; Käranden fordrar för 100 st: balkar, som han för 5 – åhr sedan med honom hade tingat, en rest der af 2 Dr K:mt. Reu"
690,Nyen/RO_1692,0074_0074,t p. och peningar derföre richtigt betalt; Bem:te Timmerman och än utj 5 åhrs tijdh intet wij- dare fordrat på någon rest; ty blifwer bett Blom för denne Timmermans tiltaal i detta måhl befrijat. Hiul- 138.
691,Nyen/RO_1692,0078_0078,"rlige finnes, så att änc¬ kian dem med Edh, som Stiufbarn effter Kongl. förmyndare ordning ändtel:n fordra, icke för- uthan fahra af Sielawåda, kan bestyrckia; Ty finner Rätten ingen annan uthwäg desse Part"
692,Nyen/RO_1692,0079_0079,"des./. d: 3 September Rådman Sal. Hans Pölkens Änckia Lät inlefwerera en Rächning, hwaruthinnan som fordrar af Sal. Nilis Duas Sterbhuuss 240 D:r 20 öre Kopp.r mt../. hiul¬ Åbo Råffrättz bref ang: Nyia skiä"
693,Nyen/RO_1692,0082_0082,"han Theslef, hwaruthinnan befinnes, att Jensk alt 680 Lagl. sökt Bonden Abraham Råcka, och af honom fordrat 14 Dr 24 öre K:mt och 10 T:r Tiera, och att bemte Råcka för stembning försittiande blifwit saakfäl"
694,Nyen/RO_1692,0084_0084,"Rechning, och fordrar uti Barberare Löhn, för det han i samma slägmåhl blifwit blesserat, sampt för an¬ nat skadeståndh "
695,Nyen/RO_1692,0103_0103," Käranden då måtte få Stadz Fastebref där på; förbehållandes sig Actoris fullmechtig all den öfrige fordran, så i Capital som interesse och expenser af Leut: Schalin på wederbörlig Ort och ställe att sökia,"
696,Nyen/RO_1692,0105_0105,"hyran ifrån wijda¬ re tiltaal i dij måhl frij erkänna, sampt Käranden til S.r General Majorskap sin fordran att sökia, wille Det wid denne exceptionen allegerade Document cub N:o 1. war en Kongl. General Go"
697,Nyen/RO_1692,0105_0105,"1691, att eme¬ dan Johan Torwest och Nicolaus Limatius Lå¬ til läggia arrest på Leut: Suen Schalins fordran hoos General Majer, Hynterbergskan, ty kunde sup¬ plicant Schalin därante arresto ingen execution "
698,Nyen/RO_1692,0108_0108,"ansklås, som och allareda af Leutnanten sielf honom anslagne wore, och BrukzPatronen för den öfrige fordran så i Ca¬ pitalet som interesse och Expenser Leutnanten sökia fåår; och såssom Leut:s Fullmechtigh "
699,Nyen/RO_1692,0109_0109,"wilket Rätten aggrierade: och effter som dess för- uthan war en lijten strijd dem emellan om Skuld¬ fordran af 14 D:r Km:t, ty modererade Rätten den effter skiäligheeten til 12 D:r K:mt./. Controleuren Wälb"
700,Nyen/RO_1692,0113_0113,"mechtig heemskiutne iämbwäl Saken under Rättens omdöme, där widhängiandes att Brukz Patron hade til fordra af Leutnanten mehra än Leuth prætension i Riga och des gårdh här i Sta¬ den impokterar. scutnantens"
701,Nyen/RO_1692,0114_0114," fullkombl:n liqviderat, och Rätten altså eij kan, weta, huru stoor bem:te Brukz¬ förwaltarens hela fordran til bem:te Leutnanten egentl:n är, eller huru wijda han hafft skiäl, att hålla sig både wid Leutna"
702,Nyen/RO_1692,0115_0115,"n prætensionen på 1094 D:r 31 öre K:mt, som bem:te Nyngreen å des fäderne af be:te Cordt, Sillijter fordrar, så att bem:te Nyengreen hät falla den samma på 700 D:r K:m:t ett för alt; hwar emoot Cordt Sahly¬"
703,Nyen/RO_1692,0117_0117," omdöme, om han el:r Regeberg wid denne Actionen brukat flitile wijdlyfftigheet, el:r om och Steven fordrat 2 gångor betalning af Regeberg för des obligation, hwilket uthur Rechningarne sig lärer finna, för"
704,Nyen/RO_1692,0132_0132,"å¬ gon Advocat, tij kunde och käranden wäl föru¬ than en lijk wijdlyfftigheet Saken til ändskap be¬ fordra. d: 12 Novembris Handelssman Johan Classon låter 2dra gången opbiuda den gården han af Fält- hären "
705,Nyen/RO_1692,0145_0145,"ke des mindre hade Reus i föllie af inkombne höga öfwerhetens be¬ fallning denne Heiki sin häst wäl fodrader och beta¬ ning för sitt Smör gifwit, där jempte och honom des expenser, uplafyllnad och skade st"
706,Nyen/RO_1697,0022_0023,"2, hwarformedelst Sahl. Gullsmedens Mr Anders grans Gårdh är Licent Inspe- ctoren för dess hafwande fordran till Gran af 396 D:r 16 ö: Kmt: immitterat worden, det sielfwa Immissions Instrumentet med meh- ra"
707,Nyen/RO_1697,0052_0053,"omasson Swarande, angde 30 lod Sölfr dem Durchman gifwit till gullsmeden att för arbeta och nu igen fordrar, med dhe där af härrörande Expenser; Afsagd på- Nyens Rådhuuss d: 1 Martij. A:o 697. Emedan Gullsm"
708,Nyen/RO_1697,0076_0077,"efrijader. Men där Rätten skulle finna skiäligit, att utl gifwa Fastebrefwet, så är han till at be- fordra saken till sluth nögder, att kyr- kioheerdens Menckens Enckia dess præ- tension i Fastebrefwet förb"
709,Nyen/RO_1697,0093_0094,"l Johan Nyman 10 D:r Skyldig, och eme- dan Sahl. Erich Wargens Enckia igen utaf Nyman skall äga att fordra; Dy begärte han att af dhe medel som Rådmannen Boisman nu för Papunen i Rätten de, ponerat 10 D:r k"
710,Nyen/RO_1697,0094_0095,"189 wer att fordra 12 D: 16 ö: Kmt:, begiärandes att så myckit kunde för honom med ar- rest beleggias. / Rådmannen Joh"
711,Nyen/RO_1697,0105_0106,"Cortman i RådstugukRätten till dömbder, hwilken den samma sedermehra opå Fiscalen för dess hafwande fordran transporterat. här opå producerade Lagläsaren Brodzenius Råd- stugu Rättens doom af d. 15 Maij 169"
712,Nyen/RO_1697,0107_0108,ssus. Det hafwer Handelssmannen Richardt von der Hardt effter dess Räckning af d. 2 Maij: hafft att fordra af Sal. Handelssmannen Johan Kröger för förstreckte wahror een Rest af 556 mkr 8 mk: Pubsko eller 1
713,Nyen/RO_1697,0107_0108,"ger för förstreckte wahror een Rest af 556 mkr 8 mk: Pubsko eller 1002 D:r 8 ö: Kmt. om hwilken sin fordran han befinnes hoos Sahl. Kröger igenom Handelssmän- ner Christian Diedrich Lange, och Henrich Gråån"
714,Nyen/RO_1697,0107_0108,"Krögers död dess Tå sig, sökt att få bonis cedera, trädt med Gran uti Action wed Ciembnere Rät ten, fordrandes af honom, såssom den derige nom det förbem:te skolat för Krögerma- rat, åfwansagde 500 mkr 8 ß:"
715,Nyen/RO_1697,0115_0116,"en enär domen föll i Ciembnen Rätten A:o 694. in Junio, uti hwilken doom Walter betalt Portman dess fordran effter Rådstugu domen, och således Cortman blifwit 2ne gångor be- talt, Nembl:n een gång igenom Ci"
716,Nyen/RO_1697,0115_0116,"som Fiscalen om liqvidi beblan- dande med illiqvido anfördt, wore utan fundament, efftersom Walters fordran warat äfwen wäl liqvid, som Ciembners doomen uthwijsar. Fiscalen Weiman repeterade deremoot prio, "
717,Nyen/RO_1697,0116_0117,"s egen kellare och intet wetat halfwa wåggengen derföre betala, så wij, da dem ingen af honom skall fordrat, till- biudandes sig dock dhe återstående peng:n att erläggia, hwarföre och som han nu så wäl som "
718,Nyen/RO_1697,0122_0123,"Sophia Debin ang:de det Arff dhe effter bem:te dheras Sahl. Broder som Barnlöös aflijdit, hafft att fordra, i ty Arrendatoren Pastor i alla måtto afstår och afseijer all prætension uthaf Arf, aff hwad nampn"
719,Nyen/RO_1697,0122_0123,"ler skiäl ytterligare af dheras Swägerska eller hennes Erfl:r un- der något skien eller prætext att fordra el- ler begära, effter som hon med dess fölliande uthsago och dem tillsagde Summa, sampt dess wilko"
720,Nyen/RO_1697,0126_0127,"n nen Johan Nyman utslagt, hwarmedelst han och trädt utj Nymans Rätt, som berde Gård för samma dess fordran 3ne reesor allareda lagl. opbiuda låtit; Förden- skull samma gårdh lijkmätigt wärde ringen honom i"
721,Nyen/RO_1697,0130_0131,"och an nan gång påminnelse giordt, men ingen be- tahlning erhålla kunnat; Fördenskull som ma Hubens fordran af 1217 qv 1½ ß. lübska till hans säkerheet kunde inprotocolleras effter som och Rådmannen honom a"
722,Nyen/RO_1697,0156_0157,"tare och Rådh här sammastädes, angde Wälbemte Ryttmestns till Handelssmannen Berendt Dobin hafwande fordran, Daterat Narven- Otto Reinholt Bock C: Be- rendt Dobbin ang: geld. d: 10, Julii 1696, sampt bem:te"
723,Nyen/RO_1697,0166_0167,ng hoop Sal. Bogislaus Rö- Ting. 325 och som han Wldh således ber:de Penningar af Rölingen hade att fordra; altså bad han dett måtte denne dess fordring till hans säkerheet inprotocolleras; hwilket Rätten i
724,Nyen/RO_1697,0177_0178,"a om orskofwen äre skiälige, och derpå sedan sådan tijd föreläggia, som dhe finna nöd- wändigheeten fordra; Dy ansöker Han- delssmannen Schumacher ytterligare, att blifwa uti denne dess skiälige ansökning w"
725,Nyen/RO_1697,0193_0194,"st af innehåld, att Brand- ten förbundit Uhrmakarens såår opå hufwu- det, som gådt in till Cranium, fordrandes han 4 RD.r läkiare Löhn, dett Attesten som i dag war uthgifwen wijdare belärer, an- hållandes u"
726,Nyen/RO_1697,0203_0204,"398. giordt en ny nykel der till, så hade han derföre äfwen att fordra 9 D.r Km:t; hwar opå Ar- rendatoren honom igenom Jochim Bröker, låtit anbiuda 6 D:, men som han ing"
727,Nyen/RO_1697,0204_0205,"/. Här wed begärte Rådman Wäll:t Chri- rian Stuck ett Handelssmännernes i Lubeck, tintz och Bruning fordran till Sahl. Kröder af 577 mkr läbste kunde till deras säterheet, Paul Liper an håller at kom- me ti"
728,Nyen/RO_1697,0204_0205," me till sin be- talning af Krö- gers Sterbhuus. Christian Auck låter förtekna Hintz och Brun- ning fordran till Sal. Kröger. blif:r införteknadt, som in quantum Juris bewilliades. /: 401 N 1. Emedan Ryßon "
729,Nyen/RO_1697,0222_0223,"nnan han af Handelssmans härsamma. tädes Hans Jürgen Lackmans samptl. Cau- tionister pro saldo ännu fordrar 1907 D:r Kop:r m:t, anhållandes Fullmechtigen Blan- kenhagen, det Cautionisterne som sig åta git f"
730,Nyen/RO_1697,0222_0223,"r Kop:r m:t, anhållandes Fullmechtigen Blan- kenhagen, det Cautionisterne som sig åta git för denne fordran såssom deras pro¬ S. D. pre skuld att stå, Lijkmätigt deras egen förskrifning af d: 11 Julij 694. "
731,Nyen/RO_1697,0226_0227,"en som Rådman igen till sig togh, wijdare uthwij L. K sar, begärandes Rådman Jenisch, att dene dess fordran till Linæus kunde till hans säkerheet inprotocolleras, hwilket Rät- ten in qvantum juris bewilljad"
732,Nyen/RO_1697,0226_0227,"ewilljade./. Sammaledes berättade Borgmestaren H:r Balthasar hado sig hafwa af Skrifwaren Linӕo att fordra 40 och några D:r kroggield, skolandes Linӕus honom försäkrat, att wil- lia det fram för alla andra "
733,Nyen/RO_1697,0250_0251," Protocoll. Walter exciperade emot Stocksiö, så wijda dhe skola hafwa något sins emellan, i tij han fordrat af Stocksiö Räckning, men han sådant åtskillige gånger afslagit, sampt honom /: Walter :/ snäst St"
734,Nyen/RO_1697,0253_0254,"n¬ thonij Hinrich Blankenhagen, sampt Han delssmans Hans Jürgen Lackmans Cau¬ tiopister, ang:de den fordran, Randelss¬ man Wricht hafwer till Lackman, och hwad, Handelsman Lackman i anledning der af dehls e"
735,Nyen/RO_1697,0257_0258,"ch wärderat af dhe der till förordnade gode Män, sampt således till afbetahlning på Malins hafwande fordran af 300 RD:r wärkel:n skolat uthmätas; Men såssom Rådman Wäll:t Hinrich Luhr med Ran¬ delssmannen S"
736,Nyen/RO_1697,0257_0258,"as ännu icke skall effterkommit, så anhåller full- mechtigen, Joh: Hin: Frisius låter förteckan deß fordran til Mårten Hind: Qu liax."
737,Nyen/RO_1697,0258_0259,"r 1200:de D:r Kmt, hwar med hans gård jemwäl skall wara opbygd; anhål¬ landes fördenskull att berde fordran, En¬ kian till säkerheet äfwen kunde inproto colleras, som in qvantum Juris bewil¬ liades. // Samm"
738,Nyen/RO_1697,0258_0259," opå hans A dess Anna Luhrs fordring till Mårten land: Ziliax inforo tocollares../. Peter Schluters fordras til Mårt Hin: Zilius för¬ tecknes./. 507. hans gårdh, som effter Rådmannens begä¬ ran till wederbö"
739,Nyen/RO_1697,0259_0260,"m är brede wed Sal. Borgmest:s Hertz och Arfwed Jo¬ winii gårdar belägen, till underpons för ber:de fordran, med dhe wilkohr och Condi¬ tioner, sone sielfwa obligationen wijdlyfft gare upprimerar; hwarföre "
740,Nyen/RO_1697,0259_0260,"m all dess lösa och Fasta ägendoom, i syn- nerheet sitt wåhnhuus beläget emellan Sahl Hinrich Luhrs fordran till Berendt Deb¬ bin förtek: 509. Sahl Borgmest:ns Hertzens och Handelssons Arfwed Gowinii gårdar"
741,Nyen/RO_1697,0259_0260,"gationen af d: 30. Julij 1696, uthförligare wed handen gifwer bediandes Rådman att denne hans klaga fordran till hans säkerheet nu jembwäl kunde inprotocolleras, effter som han sig öfwenwähl dess Rätt och f"
742,Nyen/RO_1697,0262_0263," H. Blankenhagen å Jöran Wichts wägnar P: Hans J: Lagmans Cautionister, angde giäld – 43 Anna Zuhrs fordran till Mårten, Hinr: Ziliö inprotocollares T Brita Hartwigs dörer C:t Roman Korolkoff angde det han "
743,Nyen/RO_1697,0263_0264,"åsom Citatus C: Matthis Lindher R 411. angde slagwåhl —, 4 Balthasar dato låter inprotocollera dess fordran ja till Barthold Linæummann 413. till Barthold Linæummann 413. Christina Lydia. Jacob Kifwenen ang"
744,Nyen/RO_1697,0263_0264,"immermans Sterb¬ if: huus, angde gield Claes Berg Förlijkning med And: Bomgardt amoteres Claes Berg fordran till Joh: And: Ritter, annoteres Carl Dobbin S:t Claes Berg angde relation af den wara slagd Chris"
745,Nyen/RO_1697,0263_0264,ck Brandes C: Claes Joh. Skogh angde slagzmåhl.  Do 193. 242. 253. bens till And: Bomgardt hafwande fordran. arrest som opå någre twistige Balckar skall 249 249. Christian Huck låter inprotocollera Jacob Hä
746,Nyen/RO_1697,0263_0264,ristian Muck C: Carl Dobbin ang:de Wijkesmåhl Dr Christian Huck låter förtekna Hintz och Bru¬ ningz fordran till Sahl. Kröger —. Claes Berg kiöper Giärdt Anderson Raskz gård R Daniel Lindberg C: Annicka Mat
747,Nyen/RO_1697,0264_0265,ield _ _ 387 1 gieldh _ _ 387. Elisai Federot defererar Eden åth Thomas Matz son angde een strijdig fordran — 40. son angde een strijdig fordran — 401. Elisabeth Gungel utslöf:r sin Gård åth dess „ Son Bere
748,Nyen/RO_1697,0264_0265, Federot defererar Eden åth Thomas Matz son angde een strijdig fordran — 40. son angde een strijdig fordran — 401. Elisabeth Gungel utslöf:r sin Gård åth dess „ Son Berendt Johan _ 402 „ Son Berendt Johan _
749,Nyen/RO_1697,0265_0266,"on Huttunen angifwes för Kyrkiotiufnad Henrich Tenwäst: Olof Mårtenson angde Stöld p. Henrich Luh:s fordran till Berendt Dobbin förtecknes Af Johan Christian Martens understeller Rättens om¬ pröfwande, huru"
750,Nyen/RO_1697,0265_0266,Anklages för Otimen Jocestus Johan H. Ingenhagen låter inprotocollera en till Robert Comin hafwande fordran Johan Sigfredson försällier sin gård åth Oloff Commiss för Swenson Johan Died: Hebenstrijdt h:r Er
751,Nyen/RO_1697,0266_0267,anmans Obligation — 324. Danmans Obligation — 324. Danmans Obligation — 324. Dito låter intekna sin fordran hoos Sal. Bo- gislaus Röling 394. Lars Malm och Hinrich Zuhr C: Heidwinkel ang.r 330 wijtesmåhl La
752,Nyen/RO_1697,0267_0268,"genom Fullmechtigen Wedman ingångne förlijkning med Berendt Debin förtecknes - 504. Peter Schlyters fordran till Mårten Henrich Zilias inprotocollares 506. R Roman Grolkoff h:r Johan Kijan angde giäld, 70 ♂"
753,Kajana/RO_1659_1699,0003_0003,"chel Bengtßons honom meddelte full- macht, deruthinnan han fullmächtig giör be:te Isaach Hanßon att fordra af Borgaren här i Staden Erich Jacobßon en Post Penngr, som han effter richtigz Räkning och sin han"
754,Kajana/RO_1659_1699,0006_0006,"samma book. Och effter såsom be:te Captens Son mz sin Moor reste i Winttras härifrån förr än Frantz fordrade af her Thomas sin book igen, och hand bör hand fylla; Altså blef af Rätten afsagt, att her Thomas"
755,Kajana/RO_1659_1699,0020_0020,"skal om denne handel H. G. N:e Uthi underdånigheet tilskrifwas om så nödigt synes. /. Jacob Laninen fordrade af Skomakaren Johan Matzsson betalning för några ståckar, hwar til den andra intz ne- kade, uthan"
756,Kajana/RO_1659_1699,0021_0021,ärade sig några Bårgaren öfwer Olof Murmestare at hon inte wille betala dhet dhe hafwa af honom att fordra dy blef dem låfwat att han effter deras begäran skola citeras til nästkommande Rådstugu dag.
757,Kajana/RO_1659_1699,0026_0026,"ör sådan beskylning ehrkändes frij. Sal. Lars Madßons Änkia, H. Anna Erichzdåtter ifrån Uhlo Stadh, fordrade af fattigfogdens Son, Madz, betalning för 3½ al:r Swart gråt kläde à 7 D:r aln, som han af hennes"
758,Kajana/RO_1659_1699,0027_0027,"r K:r m:t för samma kläde, emedan dhet är uthi Sahl. mans giäldbook op- fört och står obetalt. Item fordrade be:t änkian af Christer Heinåinen bårgaren i Cajana Stadz 17 D:r 8 öhre Kop:r m:t för några pertz"
759,Kajana/RO_1659_1699,0027_0027,"om pålagt, att han betalar henne dhet öfriga, och ställer henne klagelöös effter 16. Cap. Rådst. B. Fordrade åffta be:t Änkian och af Anders Heinoinen effter Rächningen som i giäldboken upfört ähr - 66 D:r "
