,parent,file,context
439,Sordavala/s1,0399-423," och Mårthen Taskin.   Bonde från Liebelitz Sochn och Ruokolax by Johan Lap- palain ben:dh förekom, fordrandes af Borgaren An- ders Haloinen 4 Dr 28 /: Kop:r M:t, flytande af något  Smör, Haloinen för någon"
440,Sordavala/s1,0399-423,"hws skyll- digh wara skall, een Engh af 6 goda lass åhrligen at  bruka i afbetahlningh till des den fordran af Bonden // [TK 401] 2 wore ehrlagdt, hwilcken Engh hans Modher H:o Brijta  Olofzdotter alredo ut"
441,Sordavala/s1,0399-423,"ium för någre åhr sedhan, äre  obetahlt, dy föruntes det och Mackoin så wijda En- kian tillstår den fordran, och tillsades Immoin at till  des innehålla Sölfwet.  A:o 1692 d. 29 Februarij höltz Ordinarie Rå"
442,Sordavala/s1,0399-423,"ch Mårthen Taskin. Då förekom Bonden och Ryssen ifrån Ilamantz S:n och  Konnunniemi by Tijmo Tubain fordrandes af Borga- ren Staffan Climpo icke allenast 73 D:r 16 /: Kop:t M:t, flytan- de af allehanda Wahr"
443,Sordavala/s1,0399-423,"t, eftter 3:ne giorda tillförende Mundtl:  ansökningar, icke skall willia det giöra; denne 73 D:rs  fordran jempte 3 t:r Rågh tillstodh Climpo i sigh rich- tig wara och låfwade giärna honom förnöija; hwarfö"
444,Sordavala/s1,0399-423,"n  Mårthen Taskin och  Borgaren Matz Jufwoin.  Då stälte sigh för Rätta Borgaren S:r Brun Olofzson  fordrandes eftter een liqvid Rechining af Bobl  Oloff Waris 6 D:r 31 /: K:r M:t, flytande af Toback  Waris"
445,Sordavala/s1,0399-423,"eftter det  16 Cap: i Rådst: B.   S:r Brun Olofzson lefwererade i Rätten een Rechning hwar uti  han fordrar af Påhl Årafwain eftter dhem emellan  giord liqvid 128 D:r 16 /: K:r M:t, flytande af försträckte "
446,Sordavala/s1,0399-423,"kedh huru  wijda medh dheras Rechningh ähr beskaffat, eftter som Zilia- kus först vigilerat utj sin fordran af Årafwain, då Rätten  ett sluth här uthinnan giöra will; I medler tijdh sattes  dhe 75 D:r K:r M"
447,Sordavala/s1,0399-423," dran, som emoot dhe öfre Creditorer, såssom Bonden ifrån  Lijgola Oloff Hansson Käkälein, hwilcken fordrar, sedan  Årafwain honom i gåhr betahlt 20 D:r 20 /: K:r M:t, af honom  ännu 26 D:r 12 /:; Rådman Is"
448,Sordavala/s1,0399-423,", det alt Årafwain  sielf tillstodh sigh skyldig wara, föruthan Borgaren  Johan Christersons 7 D:rs fordran som oliqviderat ähr,  och dy will det eij tillstå: Och dätta giorde Brun så  mycket mehr som att Å"
449,Sordavala/s1,0399-423," dare anhölt om någre af Rådet som skulle dhen öfre af  Årawaises Egendomb besee, som och till hans fordrans  afbetalning kunde anslåås, dy nembdes Rådmennerne  Mutka och Taskin det att förrätta, hwlicka ho"
450,Sordavala/s1,0399-423, då Uthslagh här uthi falla skall.  Bonden ifrån Pelgijerfwi S:n och Leppelax by Christer  Kächköin fordrade af Ryssen och Boblen här i Staden // [TK 409] 18 Cuisma Lewoschoff 1 D:r 16 /: K:r M:t för Skiudz
451,Sordavala/s1,0399-423,"an- sedt Christer honom skiudzat som war yngre Brodhren;  dy ehrkände Rätten Cuisma ifrån Christers fordran  frij, och stående honom fritt at sökia sin Brodher Hen- rich här om det bästa han kan och gitter."
452,Sordavala/s1,0399-423,H:r Gustaff om gården och annat huad i  Enckians hws skulle finnas som kunde opfylla denne  55 D:rs fordran; Medh wijdare begiäran at gården (den  Sahl: Jörensson förmåt sigh igen under sufficient Caution  
453,Sordavala/s1,0399-423,"re behielpas där uth- innan, som at den gården tillförende blifwit H:r Gustaf  tillährkändt i denne fordrans afbetahlningh, och H:r  Kyrckioheerden icke då giordt någon anmählan om sin  fordring; föregifwan"
454,Sordavala/s1,0399-423,"lmechitge des Swähr Son  Borgaren Simon Hurri icke wiste att swara till den- ne Saken mindre bem:te fordran förklara, dy påla- des Såickel att oprätta een Rechning här öfwer och den  sedhan till Rådman Mart"
455,Sordavala/s1,0399-423,iest  will undwijka något serdeles på hans öfwer- dådh fölliande Straff.  Borgaren S:r Brun Olofzon fordrade af Anders  Haloinen 18 D:r 8 /: K:r M:t för åthskillige undfångne  wahror och Contante penningar 
456,Sordavala/s1,0399-423," Anders Haloinen  sig wara skyldigh till Borgaren Matz Jufwoin  6 D:r 6 /: K:r M:t Jufwoin af honom fordrar, flytan- de den gielden af Contante uthlänte Penningar  för 3 åhr sedhan; hwarföre Haloinen dömbde"
457,Sordavala/s1,0399-423," dhe 6 D:r 6 /: K:r M:t innan Sohl- sätter 14 dagar eftter det 16 Cap i Rådst: B. // [TK 419] 36 Än fordrade Rådman Jöran Wallius af åfftabendt  Anders Haloinen 2 D:r 8 /: Kr Mt, hwar till såssom han  eij h"
458,Sordavala/s1,0420_0420,än. Påhl Waroinen Johan Mutka. Jöran Wallius och Borgarena Brun Olofzson sampt Mårthen Putkoin. Den fordran som Bonden Petter Sigfredson Härckäin haar till Rådman Johan Mutka bestående af 43 D:r 16 öre K:r 
459,Sordavala/s1,0421_0421,"mman af juffthandeln dhem emellan: Hwarföre såsom Ryssen Offanatioff emoot deße 40 D:r han hade att fordra af Climpo för Jufft, bekommit 13 st:n hudar à 3 D:r är 39. Dr och Peningar 7 D:r 16 ö: K:mt:, som g"
460,Sordavala/s1,0426_0426," Gustaff  Sincko, att där med disponera som sitt eget: Men som dätta icke förslår stoort emoot hans fordran och han"
461,Sordavala/s1,0427_0427,"kus full- mechtige Munsterskrif:n Erich Bergh med gifwen full- macht af d. 20 sidstledne Julij, och fordrade af Stadzens Inwånaren Påhl Årafwain effter Rechning så för Toback som uthlänte Penningar, beståen"
462,Sordavala/s1,0427_0427,"a i sig richtig är: Hwarföre och i anledning här af frij erkändes Påhl Årafwain ifrån H:r Zilicakus fordran, och dömbdes honom dhe resterande 6 ö: K:r M:t han sigh skyldigh giör, till Ziliakus ell:r des ful"
463,Sordavala/s1,0427_0427,"ch såssom dene Årafwaises Penningar 75 D:r K:r m:t han för sin Gård bekom, är så för denne Ziliakus fordran  som andre hans gäldenärers prætensioner in seqvestro hoos Rådman Mårthen Taskin d. 2 nästförwerkn"
464,Sordavala/s1,0427_0427,"orer, effter dheras begiäran at dehla och pro- portionaliter jämka sigh emellan, som hwars och dens fordran är till, det bästa dhe kunna och gitta. där näst. 59 Där näst fordrade äfwen M:r Erich Bergh uppå "
465,Sordavala/s1,0427_0427,"h emellan, som hwars och dens fordran är till, det bästa dhe kunna och gitta. där näst. 59 Där näst fordrade äfwen M:r Erich Bergh uppå H: Mårthen Ziliakus wägnar af Borgaren Staffan Climpo Contant 4 D:r 16"
466,Sordavala/s1,0430_0430,gan oppå des Modher Brijta Olofz- dotter om något höö hon sigh tillwält – 1 - „ - Anders Jurfwaises fordran af Johan Henderson Jurfwain — 6.- Anders och Johan Jurfwaises påminnande om förlijk- ingen medh Jo
467,Sordavala/s1,0430_0430,nders Heickurinen angifwer Anders Haloinen för Tiä- ru inskeppande på hans lodia – 4 Anders Taskins fordran af Anders Haloine 53 Anders Tuchkuin tilltalar Johan Tijain för 1 kiöpt Sölf:r Ring - 55 Anna Pett
468,Sordavala/s1,0430_0430,öröfwat Slagz- måhl på henne - 62 B. Brun Olofsons fordring af Bobln Oloff Waris - 10 Brun Olofsons fordran af Påhl Årafwain - 11 Brun Olofson framwijses 1 lysten Sölfz: kanna kiöpt af bonden ifrån Liexa Ni
469,Sordavala/s1,0430_0430,från Liexa Nils Isaachson Nickinen – 15 Brun Olofsons fordring af Martino Canuti - 27 Brun Olofsons fordran af Anders Haloinen - 35. Brusius Laitinen anklagar Clemet Heinoin för een såld häste - 38 Brun Olo
470,Sordavala/s1,0430_0430,d - 56 Clas Påsuinen kiöper af Jacob Tårfwinen en Gård här i Staden - 8. Christer Kächköin gior een fordran till Cuisma Lewosioff – 17. Claes Matzson Päsuises Borgare Eedz afläggjande - 22 Christer Martises
471,Sordavala/s1,0430_0430,äsuises Borgare Eedz afläggjande - 22 Christer Martises Borgare Eedz afläggiande - 22 E Erich Bergz fordran af Clemet Päsu - 18 Eskell Råihas fordring af Henrich Wallio - 22 H:r Erich Boumans bewijß om des 
472,Sordavala/s1,0431_0431,E H:r Erich Bouman anklagar Joseph Taskin för förargelse och oliudh i Kyrckian - 37 Erich Bounan fordrar på sin SwährMoors wägnar af Stadzens Inwånare och Borgerskap sampt Boblar någre Pastoralier - 42 G
473,Sordavala/s1,0431_0431,ista om 1 fåår - 47. H Henrich Hämälein anklagar Clemet Päsu för stulen Talg - 42. Henrich Hämälein fordrar af Jacob Saickoinen och Cle- mett Päsu för något ihoop tillåns tagit Toback - 42 Henrich Waroinen 
474,Sordavala/s1,0431_0431,pr som ingen Ägare haf:r och i stället för sin bårtkombna söker sig tilägna - 55. Johan Lappalaises fordran af Anders Haloinen — 1 Johan Mutka klagar på sin Pijga Carin Caupi - 56 Isack Mackoin Arresterar d
475,Sordavala/s1,0431_0431,t i pantstående Sölfret hoos Thomas Immoin och Petter Wallij Enckia tilhörigt - 7. Isach Maiskoises fordran af Påhl Årafwain - 12. Johan Christerson fordrar af Påhl Årafwain - 12. Johan Waris klagar på Eric
476,Sordavala/s1,0431_0431,tter Wallij Enckia tilhörigt - 7. Isach Maiskoises fordran af Påhl Årafwain - 12. Johan Christerson fordrar af Påhl Årafwain - 12. Johan Waris klagar på Erich Räina för lådie förderf:de - 14. Johan Staffans
477,Sordavala/s1,0431_0431,- bränd Segel uppå des lådie - 31  Jöran Wallij fordringh af Anders Haloinen - 36 H:r Johan Mathias fordran af Thomas Möttö - 36 Jöran Tijmoin kärar till Anders Haloinen och Daniel Abramson uti inskeppande 
478,Sordavala/s1,0431_0431,"rande öfwer Anders Heickurinen - 44 Johan Kiuckoinen J Johan Kuckoinen Arresterar Petter Härckäises fodran  Johan Mutka för hans hästz förderfwande, hwilcken Ar- rest under H. Simon Hoppenstångz Caution se"
479,Sordavala/s1,0431_0431,ch herres Nådigste Pla- catz Publication angående Stembning wedh doomstolarne - 40 Kyro Gaurilaßons fordran aff Staffan Climpo - 46 Kongl. Maij:tz wår allernådigste Konung och Herres Nådigste Placatz Public
480,Sordavala/s1,0431_0431,"ng och Herres Nådigste Placatz Publication, om nya skiähls optagande - 52 L Lars Mårthenson Putkoin fordrar af des Swåhrfader Jöran Wallio sin hustros resterande Arff - 53. M Mattx Jufwoises fordran af Påhl"
481,Sordavala/s1,0431_0431, Putkoin fordrar af des Swåhrfader Jöran Wallio sin hustros resterande Arff - 53. M Mattx Jufwoises fordran af Påhl Årafwain - 12 Matz Pumalaises fordring af Påhl Årafwain - 12 Matz Rautias fordran af Johan
482,Sordavala/s1,0431_0431,Jufwoises fordran af Påhl Årafwain - 12 Matz Pumalaises fordring af Påhl Årafwain - 12 Matz Rautias fordran af Johan Christerßon - 12 Mårthen Kåstama och Lars Pitkäin fordra af Anders Rautia för försåldt lå
483,Sordavala/s1,0431_0431, Påhl Årafwain - 12 Matz Rautias fordran af Johan Christerßon - 12 Mårthen Kåstama och Lars Pitkäin fordra af Anders Rautia för försåldt lådie deehl - 16 H: Mårthen Thoranius giör een Prætension till Petter
484,Sordavala/s1,0431_0431,in kärar till Thomas Juanom ett Segell utj een dhem emellan sluten lådie deehl - 30 Mattz Jufwoises fordran af Anders Haloinen - 35 H:o Maria Babbe anhåller om ett Bewijs och samanhängh med Greels Terfwoins
485,Sordavala/s1,0431_0431,"han Mutka - 45 Matz Rautia tilltalar Petter Årafwain om 1 bårtkomit Swijn - 56, 59 Mårthen Ziliakus fordran af Påhl Årafwain - 58 Mårthen Ziliakus fordring af Staffan Climpo - 69 Matz Tåifwain klagar på Lar"
486,Sordavala/s1,0431_0431,"lckin querar på sin Saak emoot Clemas Snickarin angående Slagmåhl - 10, 17 Oloff Hansson Käkäläises fordran af Påhl Qrafwain - 12 Oloff Såickel fordrar få sin hustros och swägers Henrich Glo- meri wegnar nå"
487,Sordavala/s1,0431_0431,"rin angående Slagmåhl - 10, 17 Oloff Hansson Käkäläises fordran af Påhl Qrafwain - 12 Oloff Såickel fordrar få sin hustros och swägers Henrich Glo- meri wegnar något Arff Martinus Canuti tagit af dheras för"
488,Sordavala/s1,0432_0432,ll Thomas Hulckoin för gången Caution uti Toback Confiscation i Safwolax - 3 Påhl Olofsson Karhises fordran af Petter Leinoin - 10 Påhl Huttuin Kiöper Een gård af Måns Uimoin här i Staden - 4 Petter Schuldt
489,Sordavala/s1,0432_0432,aution Johan Mutka för honom skulle i Nyen hoos H:r Pölcken gått sig före wettw - 32. Petter Mutkas fordran af Brusius Laitinen - 43. Petter Leinoin opbiuder Michel Ruttus hoos sigh stående Pant - 47. S Sta
490,Sordavala/s1,0432_0432,Rautias hoos Petter Hulckoin stående Sölfwer Stoop för gången Caution i Safwolax - 5. Tijmo Tubains fordran af Staffan Climpo - 7 Tijmo Tubains fordring till Anders Haloinen - 8 Thomas Hulckoin anklagar Pet
491,Sordavala/s1,0432_0432," anklagar Petter Awofwain, för nå- gon uthsläckt Tiära, han warit wållan till - 13 Thomas Hulckoins fordran af Anders Haloinen - 53 Toro Climoßon föör een klagan på Johan Sincko om Een  Hästz bårttagande - "
492,Sordavala/s1,0444_0444,21 Då förekom Rådman Wähl:t Brun Olofsson och fordrade uppå  S:r Henrich Johansson Glumeri wegnar medh gifwen fullmacht Stockholm d. 1 Augustj [1]692 da
493,Sordavala/s1,0445_0445,"ne tijden hållit jemb- wähl och i förstone hijt föördt, Tiufnadh sampt Gårdz hyra Tijain af Kuckoin fordrar och söker om, och Stadztienaren Johan Nijrain föregaf sigh honom i afftons tijdel:n Cite¬ rat för "
494,Sordavala/s1,0454_0454,"ill 6 mkr: effter den 31 puncten i gruufarticklarne. Där näst förekom Pijgan Chirstin Suomalain och fordrade 14 wekors löhn af Rådman Isack Mackoin för det hon tient där utj huset, doch icke warit stadd til"
495,Sordavala/s1,0454_0454,"ifwit, hwar emoot Påsu eij heller hade att säija du ehrkändes Hafwerinen ifrån Päsus tilltahlan och fordran frij och otilltahlt. Anno 1693 d 4 Septembris höltz ordinarie Rådstugu dagh I Sordwalla Stadh, När"
496,Sordavala/s1,0455_0455,"ackoin eller des hustro Walborg Greelsdotter Swarande, angående 14 wekors löhn pijgan  af det hwset fordrar, och sidste Rådstugu dagh, effter Macko- ses begiäran medelst det uppskuten bleeff, att hans hustr"
497,Sordavala/s1,0456_0456,"ande Rådmän. Brun Oloffson, Joran Wallius, Isack Mackoin och Mårthen Taskin. Borgaren Panoff Climpo fordrade af Ryssen Simana Kuchnoin  helfften uti ett Commass och 10 st: Nafwar sampt 1 stoor hoffstång  ha"
498,Sordavala/s1,0457_0457,"Waroinen, Johan Mutka, Isack Mackoin,  Jöran Wallius och Borgaren Thomas Immoin. Rådman Johan Mutka fordrade uppå Borgarens i Nyen  Johan Clasons wegnar medh gifwen fullmacht af d. 28 sidst- ledne Septembr:"
499,Sordavala/s1,0457_0457,"tillstår gielden wara i sigh richtigh, men föregaf sigh sänt medh Styrman Jöran Sichwo up- på denne fordran till Johan Claßons föräldrar 3 llb  Smör, där doch uti Rechningen intet mehr opföres och godt- giö"
500,Sordavala/s1,0459_0459,"4 st: fönster Rutor 16 ö: Så at han allenast giör sigh honom skyldigh 7 D:r 29 /:, emoot Im- moises fordran: Immoin swarade, att han tillförende be- tahlt Climpo för desse honom påförde Påster, så medh Penn"
501,Sordavala/s1,0459_0459,"z saken emellan Borgaren Thomas Immoin kä- rande och Staffan Climpo Swarande, angående någon gield  fordran, och sidste Rådstugu dagh medelst det opskuten blef, att Climpo låfwade bewijsa medh witnen till d"
502,Sordavala/s1,0459_0459,"er 16 ö:, så at dätta bestijger sigh till 4 D:r 19 ö: K:r m:t som afgår af Immoi- ses 36 D:r 8 öres fordran: Blif:r dy Climpo än skyldig  till Immoin 31 D:r 21 ⁒ K:r mt:, hwilcka 31 Dr: 21 /: kt:mt: Climpo "
503,Sordavala/s1,0462_0462,"erdera- des för 11 D:r 3 ö: K:r m:t hwar af och Stadztienarens Jacob  Karfwises 2 D:r 16 ö: K:r m:t fordran skall betalas, och det  öfre andre Creditorer emellan jämkas, så frampt han icke  imedler tijdh oc"
504,Sordavala/s1,0466_0466,are Eedz afläggiande Anders Hafwerinen emoot Staffan Ignatason om Slagzmåhl Anders Tuchkuin gör een fordran till Petter Lukasson utj hans Saaköhrens oafbetalande B. Brun Oloffson uthkeesas och antages till 
505,Sordavala/s1,0466_0466,uti Ställe och Sääte Brun Oloffsons Bewijß om sitt Tallgsmältande och förde lefwerne Brun Oloffsons fordran af Clemet Päsu C. Carll Ottossons Borgmestare fullmacht opplästes. Clemet Päsu och Anders Hafwerin
506,Sordavala/s1,0466_0466,fullmacht opplästes. Clemet Päsu och Anders Hafwerinen twista om een lådiehandel Chirstin Swomalain fordrar någon löhn af Isack Mackoin. Cuisma Lewonschoff angifwes af Henrich Waroinen för oloflig Pärlehand
507,Sordavala/s1,0466_0466,ijkan gåt uhr kyrckian Elias Laitin emoot Henrich Sichwoin om opbur en gieldh G. Georgij Sculptorij fordra uppå des Moders wegnar af Johan Tijain H. Henrich Sichwoin och Johan Staffanson Kuckoin twista om n
508,Sordavala/s1,0467_0467,woins Borgare Eed afläggiande Henrich Mårthenson Hirfwoins Borgare Eedz afläggiande Henrich Glumeri fordran af Martini Canuti Erfwingar H:r Henrich Sundij fordran af Martini Canuti Erfwingar I. Joseph Läski
509,Sordavala/s1,0467_0467,ins Borgare Eedz afläggiande Henrich Glumeri fordran af Martini Canuti Erfwingar H:r Henrich Sundij fordran af Martini Canuti Erfwingar I. Joseph Läskin och Petter Leinoin twista om ett hästekiöp Johan Kijn
510,Sordavala/s1,0467_0467,artini Canuti Erfwingar I. Joseph Läskin och Petter Leinoin twista om ett hästekiöp Johan Kijnaises fordran af Henrich Hämälein Isack Mackoises fordran af Anders Tuchkuin Johan Mutka och Isack Mackoin twist
511,Sordavala/s1,0467_0467, Petter Leinoin twista om ett hästekiöp Johan Kijnaises fordran af Henrich Hämälein Isack Mackoises fordran af Anders Tuchkuin Johan Mutka och Isack Mackoin twista om någre Tiärutunnor H:r Johan Mether kära
512,Sordavala/s1,0467_0467,t slagzmåhl Johan Tijain anklagar Petter Huckain för någre på honom fälte Skällsordh Johan Classons fordran af Skreddaren Samuel Cnutzson Johan Kaupin tilltahlar Petter Årafwa om fyndh Johan Mutka till tahl
513,Sordavala/s1,0467_0467,ons Publication angående Civil ehrenders optagande utj CiemnersRätterne i Städerne Lukeria Pukällos fordran af Johan Haloinen uti gången Cau- tion för Erich Nappain L. Lars Taifwain aflägger sin Borgare eed
514,Sordavala/s1,0467_0467,nen uti gången Cau- tion för Erich Nappain L. Lars Taifwain aflägger sin Borgare eedh Lars Pirhoins fordran af Hans Tåifwiain- Lijsa Pettersdotters och Thomas Inmoises liqvidation Lars Putkoin försällier En
515,Sordavala/s1,0467_0467,för absentiam uhr kyrckian på Bööndagen och Brennewijns bärande under Ottesongen Michel Petterssons fordran af Mårthen Kietäwein Margetha Mårtensdotter kärar till Michel Matikain om Smör Mattz Kartinen klag
516,Sordavala/s1,0468_0468,s att achta Elden O. Stadzens Borgerskap ansäijes att hålla Stadz Broarne wid macht Staffan Climpos fordran af Panoff Climpo effter domb uti en Arfträta Staffan Climpo tiltalar sine Timber karl:r Oloff Putk
517,Sordavala/s1,0468_0468, Staffan Lödjöin opbiuder Jacob Nattris Pant Sigfredh Pukari tiltales om Ryssen Callina Cornelioffz fordran till des Brodher Tarasia Pukari Simon Laickari anklages för fyllerij om Söndagz Morgon T. Thomas S
518,Sordavala/s1,0468_0468,om Hans Beessmans Saak Thomas Lappalain anklages för fylleij under Böndagz hög Messan Thomas Möttos fordran af Johan Martinen Thomas Immoises Prætension till Staffan Climpo Zacharias Mattzson Jumpains Borga
519,Sordavala/s1,0473_0473," skyldiga 48 D:r 8 ö: K:r m:t, flytande af Toback och Con- tant han dhem ihoop försträckt: Jembwähl fordrar Hulckoin  uti bem:te Rechningh appart af Martinen allena 11 D:r 5 ö: effter  een dhem emellan allr"
520,Sordavala/s1,0475_0475," Eedh å Book, den Lambinen af honom  begiärte, sigh eij een stoor deehl, och mehr än det Lem- binen fordrar, opburit; dy dömbdes Martinen dhe  23 D:r 8 ö: K:r m:t som ähr een richtig fordran, till Lembi- ne"
521,Sordavala/s1,0475_0475,"n det Lem- binen fordrar, opburit; dy dömbdes Martinen dhe  23 D:r 8 ö: K:r m:t som ähr een richtig fordran, till Lembi- nen att betala och ehrläggia, lijkmätigt det 19 Cap: i  Erfd: B: Stl:n. Emedan Stadze"
522,Sordavala/s1,0486_0486,"Matz Jufwoin kärande  och Enckian Anni Mähilein swarande /: angående 3 D:r K:r m:t Jufwoin af henne fordrar, flytande  af försträchte Penningar uppå Pant till Enckian  för någon tijdh sedan, men hon Panten "
523,Sordavala/s1,0491_0491,"a.  Såssom Borgaren Johan Tijain /: citterader till denne dagen  att comparera här för Rätta om den fordran rådman  Thomas Hulckoin af honom prætenderar :/ sitt förfall  medh Rådman Mårthen Taskin insänt, o"
524,Sordavala/s1,0492_0492, tagit  flychten i deße dagar.  Oansedt Rådman Isack Mackoin medelst sin ingifne Rechningh i Rätten fordrar af Borgaren Johan  Tijain 94 D:r 20 ö: K:r: m:t flytande af sammanhandel dhe i
525,Sordavala/s1,0493_0493,", emoot andre  små wahror han allena behållit; Hwarföre  sedan uthaf Mackoises 94 D:r 20 ö: K:r m:t fordran  afgår det som Tijain såledz förklarat och betahlt; – 82 D:r 16 ö: K:r m:t; Altså blif:r Tijain än"
526,Sordavala/s1,0494_0494,"r K:r m:t och sökie äfwen Tijain Tuchkuin igen, om  det han menar sigh skiähligen hafwa af honom at fordra, det bästa han kan och gitter. Såßom Ryssen hemma i Olonitz Omelska Marckinoff medh  aflagdan Eed å"
527,Sordavala/s1,0495_0495,"rt dhem  2ne: Påster af 10, och 7 D:r K:r m:t dhe icke af honom bekommit  och Eenbergh af dhem lell fordrar, uthaf det dhe skohlat  öfwerbekommit uti något arbete dhe honom giordt; Roos- lindt påstodh wähl "
528,Sordavala/s1,0495_0495, och Karfwinen  ware sedan skildt där ifrån; Men betreffande be- tahlningen Karfwinen för krögandet fordrar; Så ålig- ger honom
529,Sordavala/s2,0004_0005,n  ad Notam tagit och inprotocollerat lijkmätigt det 6 Cap:  i Jorda B: Stl:n Borgaren Påhl Huttuin fordrade af Borgaren Johan  Tijain 34 D:r 8 ö: Kopp:r M:t flytande af försträckte pennin- gar medh begiära
530,Sordavala/s2,0004_0005,"ckäin wittnade; dy  beroor dätta tills hans heemkombst, då Huttuin kan  honom lagsökia om denne sin fordran, förbehåller  sigh i medler tijdh praferencen för andre gäldenärer  Tijain kunde hafwa och icke an"
531,Sordavala/s2,0006_0007,och sökie  Mutka Ruotzlijnt igen det bästa han kan och gitter.  Handelsman i Nyen H:r Erich Näärman fordrade me- delst des till sin fullmechtige Borgaren Petter Mutka  öfwersendne och af honom här i Rätten 
532,Sordavala/s2,0006_0007,"or, anhål- landes så mycket mehr nu att förhielpas till sin be- tahlningh som att Termin till denne fordran alredo  i förledne höst [1]694 wore förfluten, denne Anders  Hämälein tillstår gielden wara richti"
533,Sordavala/s2,0006_0007,", men beklagar  sigh intet hafwa att giälda medh; hwarföre såßom  Anders Hämälein bekände att denne fordran i sigh  richtigh ähr; dy dömbdes han dhe 156 D:r 24 ö: K:r M:t till  Handelsman Erich Naärman ell:"
534,Sordavala/s2,0008_0009,"dhe  50 D:r 29 ö: Kopp:r m:t han af Hämälein medelst sin sidstledne Rådstugu dagh ingifne rechningh fordrad, flytande  af een sammanhandel :/ 22 D:r K:r M:t; dy dömbdes Hen- rich Hämälein att betala till Th"
535,Sordavala/s2,0011_0012," altijdh där uppå, du ähr  mehr skyldigh migh och lätt lagh och Rätt skillia oss  åth om du har att fordra af migh, men Haloinen  stijgit till Spijsen och fattat i kettelen, hållandes  Maten där i blifwit u"
536,Sordavala/s2,0013_0014,"ära kettelen dädan, helst Karhuinen och un- derkastat sigh lagh och Rätt, där han hade af honom att fordra,  dett Johan Tijaises och Johan Simbaises bekennelser sanna,  men Haloinen, slijkt icke achtat utha"
537,Sordavala/s2,0017_0018,"1 D:r 24 lisspundet  som giör 23 D:r 14 ö: K:r m:t och afdrages ifrån Salkoises  29 D:r Kopp:r m:tz fordran af Mutka, item för humbla, Salckoinen tillstodh sigh fått att Mutka, 1 D:r, Blif:r  dy Mutka skyld"
538,Sordavala/s2,0017_0018,"skin,  Thomas Immoin och Thomas Hulckoin. Fordom Borgarens Oloff Karhuises Enckia Anna  Hans dotter fordrade af Borgaren Eskell Råiha fracht för 10 t:r Tiära han framföört till Nyen uppå  hennes Sahl: Mans "
539,Sordavala/s2,0019_0020,"lsätter  samma dagh effter det 16 Cap: Rådst: B. till Håmälein at betala.  Borgaren Anders Tuchkuin fordrade af Erich Martinen  1 t:r Rågh för försträckte där å Penningar 5 D:r K:r M:t, för  Een obarckat ko"
540,Sordavala/s2,0019_0020,"5 D:r K:r M:t till Brun innan Sohlsätter samma  dagh effter det 16 Cap: Rådst: B. att betala. Äfwen fordrade Borgaren Anders Hämälein af  Erich Martinen för försträckte Peningar 15 D:r 16 /:  Kopp:r M:t, de"
541,Sordavala/s2,0019_0020,ningar; Så bekände och Bobullen Hans Nappain denne Anders Hämäläin  haf:a af 34. haf:a af honom att fordra 7 D:r 19 ö: K:r M:t; Altså dömbdes  Petter Pulli att betala 3 D:r Johan Simbain 3 Dr: och Hans  Nap
542,Sordavala/s3,0004_0005,"ööpsleef 1 D:r och 1 kista 2 D:r 16 ö: alt i Kopp:r m:t giör 19 D:r,  hwar af Bonden Petter Seisuin fordrar för gifwit koppar  5 mkr: att arbeta, men Smeden förfarit à 5 D:r; det öfra begä- gar Rådman Thoma"
543,Sordavala/s3,0004_0005,"ack Mackoin kärande och Bor- garen Johan Tijain Swarande, angående 12 D:r K:r m:t Mackoin  af honom fordrar, flytande af försträckte Peningar, in- fan sigh Mackoin, men Tijain, den Stadztienaren Erich Pylc-"
544,Sordavala/s3,0006_0007," sielfwa hålla och äga sampt där af betala öfwerskåttet af sin  gieldh, dhe andre af Raxi hafwa att fordra. Dätta lijk- mätigt det 10 Cap: Köpm: B: Stl:n. Sidst opbödz 2:ne gången den hoos Rådman Thomas Hul"
545,Sordavala/s3,0007_0008," 14 dagar effter  Rådst: B:s 16 Cap: att betala. Men betreffande dhe 4 D:r 24 ö:  K:mt Kettuin mehr fordrade för den Tallgen och Tijain  nekade till, så åligger Tijain effter låfwen framskaffa wåg  Zedelen,"
