,parent,file,context
0,RO_1659_1699,0019_0019,"ch fulmähtige försälia, effter dee om uthgågne patentz innehåldh. Bårgerskapet enhöltz om marknan i Brahea, hwar om Ma- joren, tillijka med Bårgmestaren låfwade framdeles skrif- wa till hans hög Grefl. Nåde"
1,RO_1659_1699,0055_0055,"K. M:t och Pekoinen behåller Fönstret, och lefrerar Leutn: sin Sölfskedh igen./. Markus Partainen i Brahea kärde till Påll Pekoinen, om 4 skålp: Tobak, Pekoinen af honom tingat och til sig tagit haf- wer me"
2,RO_1659_1699,0091_0091,"Lars Peerßon Biörn berättade och, att då han welat slå arrest opå Anders Määttä i Nurmes, och han i Brahea skulle för Rätta stå til Swars be:t Ikoinen för samma giäldh, hafwer Anders lof- wat ställa be:t Ik"
3,RO_1659_1699,0091_0091,"e for- dra fulla peningar eller 100 D:r Och dhe hwardera medh sin egen bååth reest ifrån Nurmes åth Brahea att stå dher för Rätta, men Anders intz kommit til Brahea uthan reest förbij. Sentens Så emedan And"
4,RO_1659_1699,0091_0091,"edh sin egen bååth reest ifrån Nurmes åth Brahea att stå dher för Rätta, men Anders intz kommit til Brahea uthan reest förbij. Sentens Så emedan Anders Määttä såßom Närmeste bördeman hafwer Arff sin Broder "
5,RO_1659_1699,0092_0092,"den hafwer delaktigh giordt uthi arfwet, dhet bästa han kan och gitter. Ifwana Sabathinen Bårgare i Brahea gaf Rätten tilkänna, det han förledne winter hafwer insatt hoos Kyrkioherden wällärde H:r Jacob Teu"
6,RO_1659_1699,0092_0092,"satt 5 pac- kor, Oßippa dåroskainen 3 packor, och Timo dubanen 2 pac- kor och han förledne Sommar i Brahea sålt samma lärfftz packor åth Simßon Nirainen och Markus Pardainen, hwilka reest till Cajana Sommar"
7,RO_1659_1699,0117_0117,"älborne H:r Rijk- dråtzens Hopman, Högachtadt Samuel Långh och Rådmännen Markus Pardainen Bårgare i Brahea, blef d 25 Feb åther pålagdt, dhet han skulle framskaffa den gull- ring han A: 670 om wåhren här i "
8,RO_1659_1699,0154_0154,"lat skall effter Kongl. Maij:tz Placatz 13 punct bötha 8 D.r S.r M.t. Anbelangande Påll Urpiainen i Brahea som Tobaket ägde och visitorerna i hååret fattadt skulle fuller ef- ter ordningen plikta, men emeda"
