,parent,file,context
0,RO_1659_1699,0092_0092," 6 manna Eedh för samma lärfftz packan sigh at befrja Framhades för Rätten Anders Määttä Bårgaren i Sordawala hwilken hafwer infördt een Påst Tobak, och wedh hans ankompst af Tullnähren Johan Gamman blifwit ho"
1,RO_1659_1699,0092_0092,"blifwa bårgan sielf; Men såßom han sedermehra framwijste inspectorens Wäl:t Erich Hanßons bref Dat: Sårdawala d 19: Decemb: 670: att han kiöpt af honom en Post Tobak, hwilket och war förseglat medh Compagnie S"
2,RO_1659_1699,0130_0130,"eningar Nembl. 5. RD.r in Specie åth Rådmans Hend. Knutßons Son Johan be:d hwilken begifwit sig til Sordawala och Peningarne i medler tijdh intz kommit til afbetalning, och han funnit honom hoos Hans Fader Hen"
3,RO_1659_1699,0280_0280,"förhållit, Jämbwähl uthan laga dom och Rättens uth- slagh, sigh understådt att föra en borgare ifrå Sårdavala benämbd Hinrich Hyförnen i hand kläfwar till Pielis, det han sade Commen- danten och Blifwijken sig"
4,RO_1659_1699,0282_0282,"ckioherden H:r Johan Antilius tillika med Kyrkio- Rådet, gåfwo tillkänna dett Hinrich Hyfwönen ifrå Sårdavala D:ra reminiscere d:r d 16 Martij sigh under högmeßo predikan här ifrå bortgif:r och förrest, förfrå"
