,parent,file,context
0,RO_1684-1687,0058_0058,"pl. 1676 Mässewijn _ _ „ 4 „ 22 Noch _ _ _ - - - „ 8, 28 A:o 677 Erich Abrahamßon „ 8 „ 22 A:o 1678 bååt fracht _ „— „ 24 676 Skutsfruchten – „ 127 „ 16. 678 till Båtzmännerne. öfwerlefwereringh _ „ 14 „ "
1,RO_1684-1687,0183_0183,"Furstret at påiken medh sit hemlig ting i handen lopp effter hennes swarta hund, och emedhan hunden bet om sig hadhe hon intet sedt at påiken kom så när till honom at han kunnat få tillgiöra medh hunden,"
2,RO_1684-1687,0484_0485," sedermehra för sin otijdig mun i arrest fördt, om hwilket alt Con- troleuren 3 st: Attester Sub A. Bet C. produce- rar. Denne Exception cum Documentis blef käranden com- municerat att swara derpå, vid: "
3,RO_1684-1687,0511_0512,"t och här i Staden Christnadt uthaf bem:te Diacono Ritzen. Båålbyggiaren här bem:te Diacono Ritzen; Bååt i Staden Christer Erichßon Tuckelain betygar, sig hafwa warit tilstedz då Såldaten Sigfridh Wanhain"
4,RO_1684-1687,0541_0542," dhe hade intet hafft sin flåtta widh handen; eller Rätten remonstre rade att sådant förmedelst een bååt nog kun- nat blifwa bestält, hwarpå dhe tygde, seijan- des doch effteråth, att Tåket strax 3 fambne"
5,RO_1697,0072_0073,"re hoos Jo- han Lupiainen, hade han gådt dijt med 2:ne Solda 137. # han dhe saknadhe uthur höähuset bet- stulit"
