,parent,file,context
218,RO_1684-1687,0480_0481,"htskans ägendom skal ho- så mykit lagen tillåter, på det han må komma kommande wår, och emedlertijd betala för samma kyrkiokista, så är thet mig samma kyrkiokista pannerlåtitun- Kokokholm d. 15. Mar. shrew"
219,RO_1684-1687,0481_0482,"n skall wara närmast till detta huus kiöp och få det samma för bem:te prijs af 800 D kopp: till att betahla effter ett åhr med 8 pro Cento Interesse, så att hon nu må träda till huset och taga det an för si"
220,RO_1684-1687,0481_0482,"ens domb af 1680 hwaruthin- nan Sahl. Jacob Wallenstendel för Witnes måhl, emot bruker ähr dömd att betala 40 M.r S:M:t böter och 3 D. S. M:t Expenser, Sr Sm:tt 479"
221,RO_1684-1687,0486_0487,"ser begådt, in- tet så hade förfahrit, bediandes Actor Sluteligen att Controleuren må tilhållas att betala honom bor berare löhn 24 D. K. M:t och för Sweda och wärck 20 RD:r, hwaremot Actor sig tilbiuder a"
222,RO_1684-1687,0486_0487,fcioff ifrån Nougårodz Inlefwererade sin skrifftel. Caution för Ryssen Matti fei Burmaloss att wela betala hwar månad 10 D S.M:t intill dess Hartarnofs rest af Saakörerne som ähr 91 D. 16 öre K:M:t fulkomb
223,RO_1684-1687,0490_0491,"198 intet har att betala med: ty dömes hon till 14 dagars Fängelse att spijsas med watn och brödh, och blifwer hon för kyrk"
224,RO_1684-1687,0490_0491,"och der- föregifwit 40 D. K. M:t. Sälliaren Peter Wanham tilstår kiöpet, och att han fådt sin fulla betahlning; blef altså på Con- trahenternes begiäran detta gårdzkiäp, nu första gången upbuden"
225,RO_1684-1687,0495_0496," och Erland Jere- mia wijdare anhållande af Sahl. Lars Anderßons 209 samptl. Arfwingar att få deras betahlning effter Rådstugu Rättens dom, och att arfwingarnes gård baakom Swenske kyrckian dem må blif- wa "
226,RO_1684-1687,0497_0498," 12 Cap: och för 3 blåna- der till 3 gångor 12 mk.r effter det 9 Cap: Sår- m. will: St: L. sampt at betala Barberare löhn, som skiälig kan wara, och gifwa käranden för dess sweda och wärck 6 D. S. M:t hwar"
227,RO_1684-1687,0499_0500,d. f. 305 Stadz Fiscalen Almenius å Engelsmannens i Narwen Wilhelm Walkers wägnar Anhölt att få sin betahlning uthaf H.r Brökers Tompt för det som Bruker ähr honom effter laga domb skyldig och sig bestyger 
228,RO_1684-1687,0499_0500,till 47 D 26 öre K.m:t Detta blef bewilliat eme- dan finnes att Bröker intet annat har in Bonis att betala medh. handelsman S.r Hinrich Linä Inlefwererar ett Attestatum af Rådman H: huaridh 217 Hinrich Bla
229,RO_1684-1687,0501_0502,"dt, och sedermehra dess Änkia af sitt löst och faste godz åth sin Sahl. Mans Creditorer hafwer most betala, och icke een daler deraf sielf behållit; derjempte och att den gården i ha- kelwärke som referent"
230,RO_1684-1687,0501_0502," 499. 221. hwilka den tijd då Referentens Moder sökte, som förbemelt ähr, sine Creditorer med någon betahl- ning att ställa tilfredz, icke som sig borde vi- gilerat, uthan sine fatalier försutit, att få sin"
231,RO_1684-1687,0501_0502," ning att ställa tilfredz, icke som sig borde vi- gilerat, uthan sine fatalier försutit, att få sin betalning uthaf referentens gårdh i Hakelwärke och sig den låtit af Magistraten tilsnventera för een giel"
232,RO_1684-1687,0501_0502,"jat, och af sine Creditorer sittia omolesterat, jembwäl och att bem:te Förmyndare icke må sökia sin betahlning hoos referenten eller dess bröder, såsom dhe dher intet ärfft hafwa uthan såsom deras procedere"
233,RO_1684-1687,0508_0509,"a dem bort, sampt låna dem här och 506 235. och der uth så åth Stadzfolk som åuth bönderne. jembwäl betalt sin egen gield dermedh som Cäm- ner Rättens Ransakning med mehra uthwijsar? R. han hade warit druc"
234,RO_1684-1687,0509_0510,"afwa uthgifwit för- uthan några kannor öhl som han af desse Pen- ningar 507 237 ningar jembwäl hade betahlt; Gerechtzfougden Hu- Den berättade der jempte, att bem:te Grels då han strax widh färska gierninge"
235,RO_1684-1687,0511_0512,"m:te Erich Pee son kiöpt hafwer, och derföre effter Contracts in- nehåld af den 19 Julij sidstleden betalt 40 D: kopp: anhållandes att samma bodekiöp nu första gången måtte opbiudas. vid: fol: 157. Anno 16"
236,RO_1684-1687,0516_0517,"ahlning och då bedit med det öfrige att wänta. 3. att dhe i alla Casi- bus vigiterat til att få sin betahlning af Sahl. Wargens änkia, låtandes sig lagligen förskrifwa allhennes ägendom för än hennes huus o"
237,RO_1684-1687,0516_0517,"ntet att förtänkia, att dhe sökia effter det, som dhe åth sine pupiller för Sahl. Wargen hafwa most betahla som lemnadt wackra medel effter sigh, hwilken Erich Warg och dhess nedarfwingar arfft och försking"
238,RO_1684-1687,0516_0517,"medel effter sigh, hwilken Erich Warg och dhess nedarfwingar arfft och förskingradt, och altså Före betala sin Faders gield; Refererandes 1. att sig Slyter och Erland sluteligen om deß vigi- lance på Proto"
239,RO_1684-1687,0516_0517,"land sluteligen om deß vigi- lance på Protocollet af d. 5 Nov: 1684, och bidia ½ att komma till sin betahlning igen effter Executions Stadgan. vid: fol: 263 - Den 5 Dito . kånan Anna Johansdotter blef åter "
240,RO_1684-1687,0523_0524,"f sig impytera, att dhe fuller sökt Hypothec på Rei moders ägendomb och gård till att få der af sin betahlning för det Sahl. Wargen warit skyldig, men då ohården här i Staden således och lagligen upbodt, in"
241,RO_1684-1687,0526_0527,"Jöran Tobbi och Kånan Carin Johans- dotter blefwe upkallade och till- sporde på hwad sätt dhe wille betala deras böter, som dhe sidste Rådstugu- dag blefwe saakfälte till? R. dhe hade intet att betala medh"
242,RO_1684-1687,0526_0527,"wille betala deras böter, som dhe sidste Rådstugu- dag blefwe saakfälte till? R. dhe hade intet att betala medh, ty wore dhe sinnade att taga hwar annan till ächta; anhållandes att få Rättens tilstånd dert"
243,RO_1684-1687,0529_0530,"len att sam- ma huus må nu förste gången blifwa opbudit på det be:te 527 Inspector må komma til sin betahlning, hwilket blef förtecknadt. No. fol. 298."
244,RO_1684-1687,0536_0537,"ijka som han berättar nu i Sommars hade Stupenio i Stockholm låtit inhendiga, men intet Swar mindre betalning derpå fådt. Samma arrest blef ad pericutum Supplicantis för- undt och Apotekaren Martens notifi"
245,RO_1684-1687,0537_0538,"ig een och annan gång protestando bewarat emot Berend dobbins den yngres Creditorer såsom sökte sin betahlning at få af samma Tompt, 4 Berend dobbin och sielf tilbiuder sig med Eedh att bekreffta det 535 29"
246,RO_1684-1687,0544_0545,"n angående Brökers Tompt som igenom Executionen honom Slyter ähr anslagen för 400 D. Kopp. M:t till betahlning, beropandes sig Ryter ibland annat derpå att Execution utj Brökers ägendom reda ähr skedt den 1"
247,RO_1684-1687,0544_0545,"a kiöp, wijdare än att han begierar Räkning af sine medarfwingar huru mykit på hans deel kommer att betala till be:te Nyter och 307 och deß Medförmyndare, hwilket doch effter Råd- stugu Rättens domb bem:te"
248,RO_1684-1687,0547_0548,r och skattadt. 2. Men hwad bem:te Peter Ryter och Erland Je- remia 313 mia sökia att få Nembl. sin betahlning af Sahl. Claes Wargens Arfwingar för det dhe för Sahl. Claes War- ge hafwa most betahla åth Sah
249,RO_1684-1687,0547_0548,"mbl. sin betahlning af Sahl. Claes Wargens Arfwingar för det dhe för Sahl. Claes War- ge hafwa most betahla åth Sahl. Lars Andersons arfwingar såsom deras förre Pupiller, så oan- sedt Wargens arfwingar före"
250,RO_1684-1687,0547_0548,"- skyldige deras Sahl: Mans och faders gield åth Peter Slyter och Erland Jeremias wederbörligen att betahla, och sådant i anledning af Kongl. Maij:tz Resolution och förklaring öfwerlagsens rätta förstånd ut"
251,RO_1684-1687,0548_0549,"delse af Sahl. Borgmester Hiernman hafwer lånt, och Sahl. Timmermans Enkia alt här till intet welat betahla; produ- cerandes til den ända bem:te Blix vidimerade Co- gier af sielfwa Obligationer, Nembl. den "
252,RO_1684-1687,0548_0549,"dan till 40 m:r effter det 14 Cap: Rådst: B. saakfälles. Ty tilsades Valentin samma böter strax att betahla, elliest man blifwer nödgat med Execution att förfahra, lijkmätigt hans Excell: Kongl. Rådet och G"
253,RO_1684-1687,0550_0551,"or, ty dömes han i anledning af det 5 Cap: Kiöpm: B. St. L. desse 10 ½ RD. Spec: och 32 slantar att betala åter och sådant till Engelsmän Johan Tyrman och William Ramses ifrån hwilka bem:te Peter och Simon"
254,RO_1684-1687,0551_0552,"öransöner bekendt på wägen ifrån Narfwen hijt uth för- 73. Rubl. 47 deningen tardt och för hästlego betalt –. 1 Rubl. 92 Dito bekendt här i Staden, uthgifwit för ett paar Skor och för bleeköhl - 1 Rubl. 44"
255,RO_1684-1687,0551_0552,"an lefwererat een stor Post penningar an bem:te Soldan will weeta uthaf; ty dömes Grels Soldan, att betala åter åth rätta ägaren Johan Fyrman och Wistiam Ramse så myckit som för Peter och Simon Jöransöner "
256,RO_1684-1687,0552_0553,"r swarade sig wara een ung kiöpman som behöfwer dess Styffbarns me- dell utij sin nähring, han will betala Inter- esse derföre och till underpant sättia all sin Ägendom. Bem:te Förmyndare begiäran gyltig C"
257,RO_1684-1687,0556_0557,"än som död tiltalt om denne gielden, då han beropat sig på Ståhlskan att han intet får af henne sin betahlning, men då intet neeka till denne gielden, förmenan- des käranden wijdare, att hennes andra Man Sa"
258,RO_1684-1687,0557_0558,"it åth M:r Ebbe een deß egen, men intet den Styf- barns gield, ty fordrar Actrix än ytterligare sin betalning af Swaranden, jempte 3 RD. Rät- tegångz Expenser. kea swarar att hennes Sahl. Man ingen Räk- ni"
259,RO_1684-1687,0557_0558,": 334. Den 23 Dito Sergeanten Lorentz Valentin 332 blef upkalladt och tilspordt, hwarföre han intet betalar dhe Saakörer, som den höglofl. Kongl. HoffRät- tens dom af den 8 Octobr: honom pålagdt, effter so"
260,RO_1684-1687,0557_0558,"ste sig wa- ra bem:te hustru Elisabeth Stampel een halföre skyldig, och slijke Saakören böra straxt betalas, men Sergeanten Lorentz Valentin dess betalning slår långt ifrån sigh, ty blef han up ytterli- ga"
261,RO_1684-1687,0557_0558," een halföre skyldig, och slijke Saakören böra straxt betalas, men Sergeanten Lorentz Valentin dess betalning slår långt ifrån sigh, ty blef han up ytterli- gare förmahnt att erläggia bem:te Saaköör innom "
262,RO_1684-1687,0558_0559,"elf, deels sin hustru, alt ifrån den 9 Julij sidstleden har sökt Rättens assistentz till att få sin betalning i föllie af Rådstu- gå Rättens dom af bem:te 9 Julij. Rätten påminte sig, att bem:te Controleur"
263,RO_1684-1687,0558_0559," hustru; Peter ena tijden till den andra, derföre han och Stadzfiscalen Almenius berättade att Con- betala i åhr desse Penningar, uthan Peter Stark måste hafwa fördrag till dess han får sin löhn för nestko"
264,RO_1684-1687,0561_0562," Elpen, men så- dant ähr skedt Rätten owitterligit. Sergeanten Lorentz Valentin blef åker påmint om betalning af dhe Saaköre, som den höglofl. Kongl. HoffRätten honom pålagdt efftersom han esomofftast dero"
265,RO_1684-1687,0561_0562," hwarpå han inlefwererade. eentt, hwaruthinnan dess Moder hustru Eli- sabeth Stampel offererar till betalning een fordran af 20 D. som hon berättar af Pe- ter Slyter härflyta sampt lo D kopp: som hon säger"
266,RO_1684-1687,0562_0563,"341 ant derjempte sig intet sielf äga att betala deße Saakörer med, sampt begierandes Dilation effter Juhlhelgen, då han will see att skaffa medell"
267,RO_1684-1687,0562_0563," effter Juhlhelgen, då han will see att skaffa medell. Blef swarat om Sergeanten intet inkommer med betalning, blifwer Magistraten nödgad att förordna Execution utj dess Cautionists Hans Hinrich Dubbins äg"
268,RO_1684-1687,0562_0563,"funnit denne saken bestå af mykit fåfänge prætensioner, och att Bröker i NederRätten ähr dömbdt att betala åth hustru 342 hustru Sophia Greij 13 D. K. M:t, hwaremot Bro- Kernu intet nytt, som han intet til"
269,RO_1684-1687,0564_0565,"ek skull denne saken efftergifwit Bröker; för det öfrige nekar Bröker der till sig hafwa lofwat att betala Expenser, tij han wore een fattig karl, och förhoppas att h: Hurggref¬ wen af honom inga Expenser "
270,RO_1684-1687,0564_0565,"r redan åth Fisca¬ len uti Injurie Saken emot Magistraten som blef med denne comulerat, hafwer most betala 6 D. S. M:t Expenser. Sahl. Borgmest: Stierkmans Enkia hustru Maria Blix kärande Emot Sahl. Rådman"
271,RO_1684-1687,0565_0566,"war skyldig måtte blifwa hoos honom oför ryckte: Förmenandes Fr: Borgmesterskan, omsamma 100 D wore betalte på obliga- tionen eller Interesse, borde sådant wara på Obligationen annoterat, eller af Sahl. Bo"
272,RO_1684-1687,0565_0566,"af- ter wijdare derom tahlt. 6. hade swaranden esomofftast bedit käranden att taga Tegel- stenar på betalning; sampt 7. H. Mag: Lan- gen ombedit att disponerne käranden, till att taga Fogelstenar till afbe"
273,RO_1684-1687,0568_0569,"t Jacob Lange Kyrckioherde, Jöran Lars LicentInspector och Niclas Weidman Räntmestare anhålla at få betahlning af Berend dobbin Johan fyen beskylles att hafwa uthgifwit koppar Rijkz D:r Johan Krögeremot sin"
274,RO_1684-1687,0568_0569,mot Gulsmeden Andreas graan in D:o de: ti Jacob Böisman anhåller om Jöran Snickares gård att få til betahlning Jochim Höker emot hustru Elisabeth Eldrij in p:to de: ti Jacob Lange Kyrckioherde inlägger een 
275,RO_1692,0006_0006,"Pag: 2. Sröranden urgerar att få sin betalning af Reo, i föllie a dess uthgifwen obligation af d. 15 Octobr 1691 Nembl:n Swaranden tilstår gel"
276,RO_1692,0006_0006,"käranden ett Clavicarium. Sententz: Rätten finner skiäligt, att Oredbyggiaren Abraham förbrich böör betala dhe 43 D:r, som han effter des obliga¬ tions lijdelse är skyldig åth Pottmakare gesällen Bane¬ dip"
277,RO_1692,0006_0006,"ttens resolution af d. 4 Decemb: nästledne, att Nembl= bemte Thomas för des begångne tiufwerij skal betala efter Kongl. Straffordningh dubbelt så myckit som den stulne Silfwerkannan warit wärdt, och giöra "
278,RO_1692,0006_0006,"ed gatu- hopp, effter bem:te Kongl. förordning; Tilseordes altså Delmqventen, om han hade medel att betala medh R. sig icke hafwa in bonis mehra, än som för detta hoos honom är funnes. Dito förordnades Råd"
279,RO_1692,0006_0006,"ligen Swarade: sig i förståne ropat hanss „ man in til sig, til att disponera honom til dess gieldz betalning, men Länssman kört bort till förr¬ skrofstans röör, och gick där in i huset, fölgde alt- så Reu"
280,RO_1692,0006_0006," alt- så Reus tillijka med Skräddaren Thomas effter ho- nom, och begärte, utj höfligheet att få sin betal- ning, för det Reers hänge sedan bärgat för honom hoos Handelssman Claes Larsson, begärandes att Må"
281,RO_1692,0007_0007," hoos Clas Larsson, hwar på ännu re- sterade 36 Dr 16 ö: K:mt, och att Sm:r Thomas fordrar af honom betalning för en klädning, den han doch intet giordt efter Actoris sinne; förmenandes där jempte att Re: "
282,RO_1692,0007_0007,"at före, men Actor wille intet beqwäma sig dertil, sedermehra kräf- de och M:r Thomas Thomasson sin betalning af kä- randen, för en giord klädning, den käranden straxt skelt för hundz etc. och Skalm, hwarp"
283,RO_1692,0007_0007,"tagit af känssmannen Matthias Lindberg des häst på gatan, i mening att wela derigenom komma til sin betalning, för det bemte Länssman warit dem skyldig; Ty dö- med dhe för sådant olagligit pantande till 40"
284,RO_1692,0010_0010,"laga. vid: fol: 11. Skräddaren Mr Elias Prestin Emooth Sr Jochim Bröker H:r Prestin anhåller att få betalning utaf Bröker lijkmätigt Rådstugu Rättens doom och d: 7 Decemb: nästleden, och han därjempte tilh"
285,RO_1692,0012_0012,"f- wen af Mons:r Berendt Dobbin på 48 Dr Km:t, be- warandes Schultzen der öfwer, att han i godo sin betalning eij kan få, eller Debitor sig nu infinnes til swars, fast han Citerader är, eller sitt förfall "
286,RO_1692,0015_0015,"20. hinda Leut: Scha- snus gård. Elias Prestin haf:r betalt Brikers geld. d: 6 Maij 691 är Bruukz Patronen h:r Johan Norwast, för en gields prætension anslage"
287,RO_1692,0015_0015,"as Prestin gaf tilkänna, att han medelst sin Rechning af d: 26 Jan: 692 af 33 D:r 12 öre K:m:t hade betalt Sr Bröker. denne Rechning är af Bröker på Underskrefne sätt betalt 1° med en Obligation som Bröker"
288,RO_1692,0015_0015," 692 af 33 D:r 12 öre K:m:t hade betalt Sr Bröker. denne Rechning är af Bröker på Underskrefne sätt betalt 1° med en Obligation som Bröker haar at Prestin på 20 D:r, der på rester 14 D: 2:ie genom Breskan "
289,RO_1692,0016_0016,"Stewen uplåtas Mr Michel Regeberg närwarande swarade, sig samma Summan Länge sedan hafwa åth Stewen betalt, och då fuller sin obligation åter begärt, men Stewen sagt, sig intet hafwa tijdh den att upsökia,"
290,RO_1692,0017_0017,"24 man Hans Hinrich dobbin effter Obligations Dato af honom Regeberg, des halfwa Tompt kiöpt och betalt; hwilket Stewen icke hade tillåtit, i fall han den tijdar hafft än af honom till prätendera; för d"
291,RO_1692,0017_0017,"Rätta och stå honom til swars, då han honom nog¬ sampt wille til gemöthe föra, huruledes han blif:t betalt henne Saak blef til bem:te Stewens wijdare för¬ klaring uthsått 1. vid: p: 40. Handelssman Berendt"
292,RO_1692,0017_0017,"igen, doch om kärande el:r des hustru wille swäria, det dhe ännu icke fådt den samma, måste han den betala, och stå derföre. käranden påstår, att samma Ting warit af 3 Ducater Swaranden repeterar priöra, s"
293,RO_1692,0018_0018,"Siwonen angde Slagmåhl mitt igenom, bekiandes att Reus mått; derföre ihu- 27 kommas effter Lag, och betala honom des swada och wärk, sampt upfylla des förorsakat skadeståndh. dei Fullmechtig exciperar, att"
294,RO_1692,0019_0019,"gt taxerat, och om han fåår så stor quantum på Tiera, som des wederhäker, wil han dhe öfrige 2 RD:r betala, men intet förr. Reus nekar fuller til sielfwa ordform, som Fiscalis angifwit, men disticulterne l"
295,RO_1692,0019_0019,"sådant falla til efterrättelse, och så frampt dhe icke de resterande peningar wederbörl:n nu straxt betala, framdeles af Tiera handelen sig och intet att hugna./. Stadz Fiscalis Almenius ratione officij Em"
296,RO_1692,0021_0021,"rheims lijf och Saker som nu för tijden finnes här i Staden, måtte förarre¬ steras, in til theß han betalar, des resterande geld til Tro¬ nan, och sådant lijkmätigt hans hög Grefl. Excelli Kongl. Rådetz, F"
297,RO_1692,0024_0024,"ntroleu¬ ren gifwit honom några, öhrfylar, men inga peningar, begärandes altså quarulant att få sin betalning, och at Controleuren för slagzmåhl måtte straffas. Rådstienaren Carl Thomasson, som i går stämb"
298,RO_1692,0024_0024,"adz Sigill att bekräftta och til att notera, att Samptl:de arfwingar än ytterligare sedermehra måst betala 50 D:r K:mt til Capellanen här sammastädes Hr Bengt låfooth, som des quittantz uthwijsar; Supplica"
299,RO_1692,0029_0029,"som bem:te Borgmestaren sendt honom til Controleuren Wälbde Johan Skening til att påminna honom att betala sine Timmerman deras resterande arbetz löhn Nembl:n 10 D:r 4 öre K:m:t, lijkmätigt Under Rättens d"
300,RO_1692,0029_0029,"t, lijkmätigt Under Rättens dombs innehåld af d. 19 inne¬ warande; hwar på Controleuren swarat, iag betalar intet, uthbristandes den och den må taga mig till lijff och Siäl, om iag icke bem:te Timmerman al"
301,RO_1692,0029_0029,"Timmerman allare¬ da haf:r förnöigt, och det samma må öfr gå dem som hafwa giordt det, att iag skal betala det andra gången; säijan i man desse ord igen; hwarpå refl, rent regererat, att Borgmestaren tilsk"
302,RO_1692,0029_0029,"a, att han måtte achta sig för execution som torde wara skimpfligit, men Controleuren swa¬ rat, iag betalar intet, dhe må panta mig såsom dhe wille./. D Handelsman Antoni Miles producerar ett köpebref, för"
303,RO_1692,0032_0032,"en intet hans inwänningar der emoot, der hoos han swurit på den som honom dömbdt desse peningar att betala, och förbannat sig, om han icke allaredo til fö¬ rene desse Timmermän hade deras löhn gifwit; begä"
304,RO_1692,0034_0034,"men doch änckian sedermehra til bem:te Mäns begrafningar en god deel af sine egne mes del på arfwet betalt; Hans Scharthoff och i sin lijfz¬ tijdh 18 D:r, som han warit åth Swaranden skyldig, inne¬ hållit,"
305,RO_1692,0040_0040,Newal effterfölliande wexel¬ Amsterdam 22 April 1692 ö: 330 Cassa Dier Wecken haar sicht geliest te betahles egende ordre van mijn Heer Jürgen Lodde deeseen mynen sola wessel briel ter Somma van drichundert
306,RO_1692,0041_0041,"rest af 164: gälde hollensk: dem han och wore sinnaden 72. att betala, doch med den condition och förbehåll, att be:te Läddes arfwingar måste först bewijsa, att des för"
307,RO_1692,0041_0041," han Ausen fåår sin Satisfaction här uthinnan, kunde han intet myckit mindre denne wexel af 330 gl. betala; Altför¬ den skuld protesterade bem:te Deblef Jochins å sin Pen¬ cipalis wägnar, effter wexel Nous"
308,RO_1692,0041_0041,"s Hinrich dobbin Swarande Skomakaren begärte, att hans Henrich dobbin måste nu blifwa tilhållen att betala platzen, som Mårten Li¬ lig af honom köpt, emedan de före lagde 6ivcker förbij äro. hans"
309,RO_1692,0042_0042,"- nom prætenderar, afläggia; hwar på 8 lts ingick förlijkning med käranden, uthföstandes att we- la betala honom 16 1/2 Dr K:m:tt Contant och 1 Tå råg; Men emot kärandens prætenderade ledder til 2 paar sko"
310,RO_1692,0042_0042,":r Arrendatoren Nils Nees per M:r Almenius hät andraga, huru såssom han åstundar, at komma, til sin betalning, hoos Sal. Muur mestaren Mr Jöran alden torp och des Successor Matrimonij M:r Michel Karmoin, t"
311,RO_1692,0043_0043,"och där hon wille så noga taga medh honom, hade hon af honom myckit mehra till fordra, än han kunde betala, begärandes altså att Amptman, såssom en Löös karl, måtte på¬ läggias, att ställa borgen för sig, "
312,RO_1692,0043_0043,"s gårdh alldeles afstådt, Creditorerne til besta blef swarat, att han skal upsätta, huru myckit han betalt å bem:te des Antecessoris wägnar, och om den¬ en Summan bestyger sig så högt, som gården ähr såldt"
313,RO_1692,0043_0043,"n Summan bestyger sig så högt, som gården ähr såldt före, kunde han framdeles wara frij för wijdare betalningh. Pottmakaren M:r Heino Wagner kärande Emoot Tysko Klockarens Son Simon Erichson Swarande Käran"
314,RO_1692,0045_0045,"onom förnär giordt. //. Hans Hinrichson Hans Hinrichson Hijro pess tilsfästade och låfwade att wela betala dhe 21 mkr Sm:t caverar för Sim Erichsons böter. böter böter, som Tyske klåckarens Son Simon Erich"
315,RO_1692,0046_0046,"stmakaren till; och ehuruwäl han mastwäsende hade härdt, wille han ändå, föruthan särskild Löhn och betalning, sig ingalunda der med befatta, doch hade han sig reda der om med Ran- delsmannen Henrich Luhre"
316,RO_1692,0048_0048,"ärandes bem:te Almenius, att Rätten samma förlijkning wille tillåta, till // biudandes sig att wela betala dhe 4 D:r Sm:tz böter. som Leutnanten för 2ne blodsåår kunna komma att betala til Konungens och St"
317,RO_1692,0048_0048,iudandes sig att wela betala dhe 4 D:r Sm:tz böter. som Leutnanten för 2ne blodsåår kunna komma att betala til Konungens och Stadz deel. /. d: 13 Juny Handelssman Claes Bergh Lät igenom Matthiam Almenium 2
318,RO_1692,0054_0054,"att Lewen sielf tilstådt den obliga- tionen på 100 D:r K:mt han af Skomakaren haft, alla- reda wara betalt, och Skefwens öfriga fordringar finnes illiqvide, sampt han Regeberg sielf af Steckn än något præt"
319,RO_1692,0058_0058,"molesterat och ingen wijdare prætension moot demyrcka; der emot förklarade sig Protestatus att wela betala Probestanten des Månadtlige Sala¬ gium, alt ifrån den tijden han reest ifrän Holland hyt, såssom o"
320,RO_1692,0058_0058,"där sådant blif:r bracht på watnet igen, 6000 gulden dhe uthlåfwat honom derföre att wa- lärichtigt betala, der emoot han dem på det kraftig¬ te försäkrat, att samma Skipp hwarken med bod¬ merij eller någo"
321,RO_1692,0061_0061,"andes der emoot att hafwa kort Låtzman bort ifrå Skippet, effter som han doch lijka fult haf:r måst betala Låtzmans löhn, och altså intet haft orsaak dem att bortdrijfwa. Låtzman Swarade, att de fuller på "
322,RO_1692,0065_0065,", och honom höfligen der¬ före tiltalte, med sådant att innehålla, effter som han sådane glas intet betalte, hade Swa- randen medelacka ord på Käranden uthfarit, sampt sprungit till och slagit alla glasen "
323,RO_1692,0067_0067,"ntroleuren Wälbde Johan Schening för en, förtächt Schås, som producerent skal hafwa förderfwal, att betala 180 D:r K:mt, och sådant effter Kongl. Maij:tz Skrå- Skråordning de A:o 669 och des 10 Art: 31 och"
324,RO_1692,0068_0068,"dan hon den sönderkört och illa med farit, sendt til Appel¬ canten, begärandes den å nyio för samma betalning att upbyggia, hwilket doch Appellanten, emedan han den en gång, föruthan feehl Controleuren i h"
325,RO_1692,0068_0068,"Rätten, effter en af Controleuren uprättat, men än improberat Specification, dömbdt Appellanten att betala 180 D:r oachtat att Schäsen, då Controleuren den emottog, warit föruthan feel bygdt, och af Contro"
326,RO_1692,0068_0068,"t Controleuren måtte på¬ läggias samma Schäs att igentaga, och honom des återstående arbetzlöhn att betala, hwilket alt sielfwa justification med mehra exprime¬ rar. Samma Skrifft med des byfogade Neder¬ R"
