,parent,file,context
327,RO_1692,0071_0071,"ijandes, du haar intet glas köpt, och behöfwer dem intet sönderskå, då haar dem och intet tilförene betalt, som dij söndersla¬ git, och ehuruwäl Mons:t Cortman, som då jämwål mar tilstädes, uhrsächtade Swa"
328,RO_1692,0071_0071,"in lijka fult med wärre smäde ord fortfahrit, seijandes, då haar icke så myc¬ kit medel, att du dem betala kan; hwarigenom Reus blifwit altererat, och sagt: att i skolen see, det iag är man för ett paar gl"
329,RO_1692,0072_0072," fordra; påståendes där jempte sig Bogislaus alz intet äga, och altså intet kunna constringeras att betala sin moders gield, hälst och emedan dess moder wid dess sidsta afreesa, här ifrån til Revel tagit m"
330,RO_1692,0074_0074,"ammerader tingat 100 st: bijlade bal¬ kär à 1 D:r och hwar och en sin portion Nembl: 25 D.r derföre betalt, seijandes Reus, att Käranden in¬ tet förr än nu på någon rest krafft, utan i 5 åhrs tijdh tegat s"
331,RO_1692,0074_0074,t: Bönder betingat 100 st: färdige bylade balkar å 1 D:r Kopp:r mt p. och peningar derföre richtigt betalt; Bem:te Timmerman och än utj 5 åhrs tijdh intet wij- dare fordrat på någon rest; ty blifwer bett B
332,RO_1692,0076_0076,"så wid den Nedrige som denne Instantien förorsakade expenser till 6 RD:r aldraringast beg¬ räcknat, betala, sampt för Kembner Rättens domb ytterligare qwälliande och sydwyrdnat, jämwäl och för des oduglige"
333,RO_1692,0081_0081,"stsatt, sig uthlåtit, att för än hon wille sittia i Corps dequardie, wille han hel:r det bortstulne betala. Augustin Lang¬ man C: Brijta Simonsdotter, ang: stöld. Swaranden tiltaltes derföre, men hon inwän"
334,RO_1692,0082_0082,"terstycke; Tij annuleras här med bem:te bref, såssom otilbörligen stält, och niute Jacob dhe der på betalte 10 D:r Sm:t til goda igen, sampt tillåtes honom innom 4 wekord tijdh att giöra sitt Mästerstycke "
335,RO_1692,0082_0082,"akfält, med där wid hängiande beskedh, det den samma af Nämbden skal förmanas att in- finna sig med betalningen; seijandes be:te Handelssman där jempte, att emedan Abraham Råcka då hwarken för tinget sig i"
336,RO_1692,0082_0082,"då han Jensh, sådant på det sidstone förmärckte och honom igenkände, con- stringerade han honom til betalning af förberde geld, förmenandes dertil hafft skiäl, emedan gelden här wore giordt, framwijsandes "
337,RO_1692,0083_0083,", där hoos då Jemh sagt, sig intet åstunda hästen, utan allenast sökia att komma der igenom til sin betalning. Stadz Barberaren Mr Tobias Elias Brandt, som samma häst jämwäl skal hafwa besedt, upkallades s"
338,RO_1692,0084_0084,"tilstådt, seijandes sig det wela be- tala, hwar på Berendt Dobbin uthbrast, du äst icke en karl att betala ett glas, effter som du intet till- förene betalt det du sönder slagit, då Barberaren regererat, i"
339,RO_1692,0084_0084," Berendt Dobbin uthbrast, du äst icke en karl att betala ett glas, effter som du intet till- förene betalt det du sönder slagit, då Barberaren regererat, iag kan fuller betala fast det wore flere glass, ka"
340,RO_1692,0084_0084,"fter som du intet till- förene betalt det du sönder slagit, då Barberaren regererat, iag kan fuller betala fast det wore flere glass, kastandes derpå sönder ett öhlglas och en toom flaska på bordet; hwar p"
341,RO_1692,0089_0089,"det hon henne med twett och bykände betient, effter hon såßom en fattig änckia eij ägt peningar att betala henne med, och be:te Öfwerdelarne wore Nembln den ena af Hr Capitein Muraths= och den andra af Mon"
342,RO_1692,0091_0091,skan berättar sig hafwa Kyrckioheerskan på afrechning för hennes anwändne omkåstning på denne Saken betalt 1 Carolin och 8 al:r Ryskt lärff å 8 öre aln; tilståendes därjempte att hafwa stulit ett förkläde 
343,RO_1692,0091_0091,"nandes Lodh Silf:r å 3 m Sm:t och Lakan sampt förkläde til 2 D:r Smt. men såssom hon intet äger att betala med, tij plich¬ te hon med kroppen, och stånde sedan Uppenbara Kyrckieplicht, effter Ven: Cleri go"
344,RO_1692,0094_0094,"där jempte då bem:te Jonas Peerson berättat, det han för sitt arbete af Controleuren intet wäl wore betalt, uthan allenast fådt 15 Dr kopp.r mt där doch 18 D:r honom warit låfwade; för hwilket tahl och Con"
345,RO_1692,0095_0095,"en der på anwände Smedz= Sedel¬ makare och Måhlare arbete, sampt des tilbehör, med 180 D:r Km:t att betala, med hwad mehra Parterne twista om afsagdt Nyens Stadz Rådhuuss d: 26 Septemb:r 1692 Ehuruwäl Cont"
346,RO_1692,0095_0095,"med alt som han där på kåstadt, Hiulmakaren Henrich Mårten¬ son påbördar, och 206 D:r 27 öre Km:t i betalning der¬ före prætenderar, begärandes där jempte, att Hiulma karen icke allenast måtte påläggias, d"
347,RO_1692,0095_0095,"en emottagit, och wijdare låtit förfärdiga; Ty pröfwer Rätten skiäligt, att denne Schäsen eller des betalning intet Hiulmakaren kan påtwin¬ gas, uthan effter den bekante Englan: hwad som en gång gillas, se"
348,RO_1692,0097_0097,"Saken skull på Rådstugan, uthan först fråga fougden der om, och där han blifwer Saakfält, wille han betala Saakören derföre; blef altså bem:te Da¬ vid för stembning för sittiande saakfält til 3 m Sm:t, Mat"
349,RO_1692,0097_0097,"Notarien anförer 1mo att Stewen sig icke wijdare kan ursächta, att han twenne gånger enständig sökt betalning för Regebergz honom gifne obligation, der jempte igenom erhållen arrest på Regeberg medel sin b"
350,RO_1692,0097_0097,"lning för Regebergz honom gifne obligation, der jempte igenom erhållen arrest på Regeberg medel sin betalning obtinerat, effter som han och sam¬ ma obligation, Regeberg alldeles owitterligit, i denne Rätte"
351,RO_1692,0098_0098,"deels blifwit öfwertygat i deels sielf måst tilstå, att 186 samma obligation wore betalter, tij förmeenar full¬ mechtigen, att Stewen emot det 2 Cap: circa finem Jedbl. Stl: förbruttit, o"
352,RO_1692,0099_0099,"j stugu Rättens omdöme. vid: 198. domen honom och Hiulmaka¬ ren emellan. att Stewen 2ne gångor sökt betalning för sin Underrätten, alt sådant framställes, under Råd¬ Controleuren Wälb:de Johan Schening, ig"
353,RO_1692,0100_0100,"enderat, den öf:r den lofl. Kämbner Rätten dömbdt, hälst han sielf tilstådt, att Obligationen warit betalter, hwar¬ före icke Rätten der öfwer hade behof judicera uthan allenast heemställa denne Erich E Ma"
354,RO_1692,0100_0100,"nne Erich E Magistra¬ tens, omdöme, hwad S:r Stewen förtient igenom det han för en undandölgder och betalter Obli¬ gation andra gången betalning sökt etc:r 3:tio I fall Samman wore appellabel, där emoot do"
355,RO_1692,0100_0100," hwad S:r Stewen förtient igenom det han för en undandölgder och betalter Obli¬ gation andra gången betalning sökt etc:r 3:tio I fall Samman wore appellabel, där emoot doch Contrarium är bewijst, så hade j"
356,RO_1692,0102_0102," Schalin effter en doom på bemte Fr ernådt, hwar med han för¬ meent Leuf: en kunna både hör och där betahla; men att sådant wore fåfängt, bewijstes 1mo med af Dn Nicolai Limasyy bref til käranden, Da¬ terat"
357,RO_1692,0105_0105,", och med Leut:s största beklaglige skada den sag¬ tilägnat, ty må han blifwa där wid, och taga sin betalning af den, som han bättre än Leut: trodt haf:r, hwarföre och Leut: nu af solennissime pro¬ testera"
358,RO_1692,0106_0106,"et Bröker ho¬ nom öfwerfallit på gatan, för det Notarien med honom intet welat stå för Rätta Bröker betalar sig för meddelt Citation på No¬ tarien, klagandes, det han af den samma blifwit öfwerfallen, och "
359,RO_1692,0108_0108,"ronen det ringaste af samma arrest niutit, ty fölle det af sig sielf, att gården Brukz Patronen til betalningen böör ansklås, som och allareda af Leutnanten sielf honom anslagne wore, och BrukzPatronen för"
360,RO_1692,0111_0111,"nu den samma störte, begärandes altså af bonden sine peningar Nembl. 15 D:r som han på samma hästen betalt, må få igen Reus säijer, att bonden hafft ifrån Wåårtijden hästen hoos sig, och hästen wid köpet i"
361,RO_1692,0112_0112,"nnan, i ty måhl hafwa att giöra, uthan lembnar där emoth käranden, att sökia sin Uthkorade Man, och betahla Käranden uth, som öf:r des bewijslige fordring är, hälst golf¬ den är liqvide och icke illiqvide, "
362,RO_1692,0113_0113,"neral Major skan i Riga att uthsökia, och där med sin geld till en och annan, hälst til Cronan, att betala, han ige- nom kärandens på denne hela fordringen lagde ar¬ rest, blifwit förhindrat att få Executi"
363,RO_1692,0117_0117," 224 effter den 24 puncten i Siö Art: kunnandes M:r Re¬ geberg des föregifwande, att hafwa 2 gånger betalt 100 D:r åth Steren, eij bewijsa, där emoot wore effter¬ tänckeligit, att Mr Regeberg twenne olijka"
364,RO_1692,0117_0117,"l:r Regeberg wid denne Actionen brukat flitile wijdlyfftigheet, el:r om och Steven fordrat 2 gångor betalning af Regeberg för des obligation, hwilket uthur Rechningarne sig lärer finna, förmenandes Stoven "
365,RO_1692,0118_0118,"en hafft hästen ett halfft åhr hoos sig, och icke på köpet klandrat, böör han den samma behålla och betala hwarpå Swaranden sig tilbödh til samma Edh, men den samma gafz honom effter, tilbiudandes sigh Bus"
366,RO_1692,0118_0118," tilbödh til samma Edh, men den samma gafz honom effter, tilbiudandes sigh Busheet, att weta heller betala samma hästen nästkommande Juul; hwar med denne Saken blef uphäfwen. Handelssman Jochim Bröker Kära"
367,RO_1692,0123_0123,"agt, eme¬ dan han ey wiste, hwems tobak det egentel:n warit, men Cordt Dobbin hade honom tingat och betalt ho- nom legolöhn Nembln 8 D:r derföre, men samma Joback blef honom pålastat på Carl Dubbris gårdh;"
368,RO_1692,0126_0126,"äl bekänner, att ort Dobbin honom til samma resan tingat, Tobak honom pålastat och frachten derföre betalt, sampt låfwat att wela sielf komma effter honom; lijkwäl och emedan bem:te Cort reda för ett åhr s"
369,RO_1692,0130_0130,"rande sådant wijdare uthbrachte, och att några af Magistratz personer torde så myckit haf:a för Lax betalt; Emedlertijdh spelte Werner Wulffert med Skomakaren, och sade Käranden, det Skomaka- ren lärer tap"
370,RO_1692,0134_0134,"ntat bonden des häst eller Smör, uthan hwad han honom afhändt, haar han behållit sådant af honom på betalning, såssom af sin rätta De bitor, effter som Råckas nambn wore richtigt uti hans geldbook annotera"
371,RO_1692,0135_0135,"ilstodh sig af Handelssman Hans Jürgen Jemsk hafwa fådt sin häst igen oförderfwadt och för Smö¬ ret betalning, sampt för sin omkåstnad, som för det han sin häst en lång tijdh haar måst ombära, in fulla för"
372,RO_1692,0135_0135,"j a Actor, att Tinka måtte exemplariter för alt detta afstraffas, som och imponeras til Lytzens ett betala 10 RDr och refundera Rättegångz expen- serne, som med mehra och wijdlöfftigare utaf be:te Protocol"
373,RO_1692,0136_0136,"ampt hon icke bewijser, att Swaranden då alldeles warit fuller, wille han 3 dubbelt straff, derföre betala. Swaranden tilstår, att des Låssare änn:r legat wid kipbroen, då Lybeske Skipparen reda gåt til da"
374,RO_1692,0137_0137,"n af honom tilförene fådt 36 D:r på handen, och på en pant 2 D:r, så wore den samma och skyldig att betala 20 D:r S:mt åth Stadstienaren för det hon luppit i denne Saken, så lenge Käranden warit för¬ kimme"
375,RO_1692,0142_0142,"radzSkryfwaren beswärade sig att Mr Johan Druvart för¬ hållit honom sine kläder, ehuruwäl han honom betalning derföre icke allenast sielf sändt, uthan sökt h:r Justitia Borgmest:s assistences, hwilken och "
376,RO_1692,0142_0142,"befallning låtit af föllia til häradzskrijf¬ waran Monss Lars Olof den förfärdigade klädningen emot betalning; dy Saakfälles han för olydno til 3 mkr effter det 2 Cap: Kongl. bl. Stk:, med än wijdare befal"
377,RO_1692,0142_0142,"det 2 Cap: Kongl. bl. Stk:, med än wijdare befallning, att straxt låta honom klädningen emoot fulla betalningen föllia, och sedan sökie honom för det förra giorde arbete lagl:n, då honom skal weder¬ fåras "
378,RO_1692,0143_0143,"Monsr Brod- senius, att Stewens öfogh til sin prætension på Regeborg, och att han andra gången sökt betalning för en obliga¬ tion i Kembners Rätten, nogsampt wara docerat, och begärte altså, att Stewen måt"
379,RO_1692,0144_0144,"adt, Och effter som han tilstådt samma sitt nambn, hade Swa- randen förmeent hafwa skiäl, honom til betal¬ ning"
380,RO_1692,0147_0147,"er emot Jacob Beckmans hustro, angde slägerij och des Löhns innehållande _ „ 16 Elias Prestin haf:r betalt Brökersgeld. – 20 Erich Närman och Peter Anderßon Rätto förordnas til Förmyndare för Påål Koposes "
381,RO_1697,0004_0005," Engen- Lagens Saak. honom pålagt Handellssmannens i Lö- beck S:r Engenhagen förmeente fordring att betala, emedan nu han förspordt det Organisten Peter Wolfgang Moder, hwil- ken han befullmechtigat emoot "
382,RO_1697,0008_0009,"ll; dy anhål- ler fullmechtigen, att Johan måtte till- hållas den stulne Rågen Specificera och åter betala, sampt för brutt sitt effter Lag plichta. Beskylte Johan Bertillson nekar högel, sig någon Råg uth"
383,RO_1697,0013_0014," Kröger för een Caution för Licent mestn Lindman häfftar, eller och dess Creditorer frambdeles till betalning blefwe anslagit. Schmitten swagade der opå, att Rätten befalt oplåta Krögers Gård åth Collegen "
384,RO_1697,0014_0015,"Besö karen saknädt; Altså anhåller han, Rätten täcktes tillhålla Annicka, att restituera till eller betala desse och alla förberde saker jembwäl androm till Exempel ansee henne med laga straff. Annicka Mat"
385,RO_1697,0017_0018," honom och Liefnsmest:n Wälbde Oloff Lindman emellan afsagd, som påläg- ger honom /: Martens :/ att betala till Lin- centmest:n 117 RD: 24½ /: Sm:t med 5: pro Cen- to interesse å Lempore mörde, appellerat "
386,RO_1697,0019_0020,"er, som honom dessuthan ålegat att i acht taga, så begiärte Fullmechtigen det måtte Jacob påläggias betala tillbaka hwad han dess löhn allareda kan hafwa opbuhrit, böta fulla åhrs Löhnen och resti tuera dh"
387,RO_1697,0021_0022,"af Kongl. Maijtz Placat angde Tiänstefolck och lego- hon hion de A:o 1686, och dess 5te punct, åter betala dhe 4 D: 8 ö: Km:t han sielf tillstår sig opå sin löhn allareda hafwa opburit och böta till Rector"
388,RO_1697,0032_0033," ansees u than och påläggias bem.te Saker med Ex- penserne och Bardberare löhn att refun- dera, och betala, inläggiandes sluteln"
389,RO_1697,0040_0041,"sijs Tröija, hwilken han hafft i pant för 10 wistl. låtit förkomma begärandes dy, han måtte Tröijan betala Roman inwende, att Tröijan stådt hoos honom i pant för 6 mkr. Kmt och enär han skulle resa här ifr"
390,RO_1697,0041_0042,ålägges Roman här med effter det 11 Cap: §. 1. Kiöpmbl. St:ll. att skaffa igen panten eller derföre betala till Bryta Hartwigsd:r 6 D: Kmt; doch kan han där emoot decourtera dhe 6 m:r Km:t Brijta opå samma
391,RO_1697,0041_0042," den tijden dhe honom tillerkiände blifwit han då så myckit kunnat förtiena, att hans giäld blifwit betalter, hwilket så som dess Cautionister skola förhindrat, så prætenderar han af dem skadeståndet, och "
392,RO_1697,0041_0042," beswär emoot des Cautionister någre af Cautionisterne skall hafwa Räckning och således dem der med betala kunna, begä- randes fördenskull att hans Peng:r om icke alla, dock så mycket der af till honom må "
393,RO_1697,0042_0043," af Roman 2 L℔ reen borstat Lijn och een Befwerskins kraga elr Bräm, men dem icke skall wela i godo betala, hwarföre han anhåller att Rätten täcktes förhiel- pa honom till sitt igen. Johan Kjänder inwende,"
394,RO_1697,0042_0043,"ill kjander, sedan dhe slutit Räkning. Kjander regerade, det han med witnen wille bewijsa sig hafwa betalt lij- net åth Roman, effter som han det icke uth sigh sielf, uthan åth Sahl. Snickarens Hin- drich "
395,RO_1697,0048_0049,"ifft intet hafwa att swara. Men omsijder för- lyktes desse Parter således: Att Hebenstrijdt låfwade betala Bardberare Löhnen, jemwäl särdeles erläggia för Poikens Anders Sommars Sweda och wärck 6 D:r Kmt:,"
396,RO_1697,0052_0053,tillhållas att restituera Sölfret in natura eller och betala des wärde med 90 D: Kmt: sampt Fältskiärens Expenser med 27 D. Dito m:t lijkmätigt dess deröfwer f
397,RO_1697,0052_0053,"inner Rätten skiäligit att Gullsmeden antingen böör restituera Sölfret in na¬ tura stura, eller och betala för hwarie Lodh Sölfwer till Durchman 2 Dr 16 /: som giör 75 D:r Kopp:r m:t. och sådant i föllie a"
398,RO_1697,0059_0060,"nhåller, hennes pant kunde blifwa opbudin och wärderat, sampt hon således någorlunda komma till sin betahl- ning; hwilket Rätten bewilliade, och wardt dy ber:de pantt förste gången op budne, jämwähl Skrädda"
399,RO_1697,0063_0064,"et för Ju- dens Räckning igenom Mäklaren Sal. Bogis laus Röling låta sällia, sampt giöra sig där af betalt så långt det tillräckt, effter som han Tobaket allareda i Holland betalt. Fiscalen berättar det Ju"
400,RO_1697,0063_0064,"ia, sampt giöra sig där af betalt så långt det tillräckt, effter som han Tobaket allareda i Holland betalt. Fiscalen berättar det Judenspels för Ciembner Rätten skall tillstådt, att han låtit Tobaket sälli"
401,RO_1697,0070_0071,"96, hwar- af sees att Handelssmannen Werner Wulffert sig åtagit för dess Fader Råd. mannen Wulffert betala till Brodzen 9 1000 D:r Kmt och 830 mkr Tobak, med meh, ra som Prot: uthwijsar. Handelssman nen Wu"
402,RO_1697,0073_0074," st:n Brödh å 8 ö: stycket, jämbwäl under före rändning af byte tagit af Anders een Pälss, men icke betalt honom dhe i mel- lan gåfwa uthfäste 5 mkr Kmt och yxen, Och emedan Anders Danielson der effter opå"
403,RO_1697,0073_0074,"anhållit, det Jacob Michelßon måtte påläggias aff restitu- era Pielßon och Säcken med Brödet, sampt betala Expenserne och för dess brutt lagl. plichta, med mehra som Ransak- ningen om Hoppmannens korssens "
404,RO_1697,0074_0075,"a då han intet bättre fahrit, än här åfwan till förmählt är, påståendes fördenskull att Jacob måtte betala, hwad han låfwat till mellan gåfwa, eller restituera pälssen och Säcken med Brödet, sampt dess Exp"
405,RO_1697,0074_0075," mellan gåfwa, eller restituera pälssen och Säcken med Brödet, sampt dess Expen- ser med 2 D:r Sm:t betala, helst han för denne Saken 2ne resor måst komma till Staden. Rätten tillsporde Kiäranderne hwar me"
406,RO_1697,0074_0075,"f framl:ne Anders Danielson dess Säck med ett brödh, jembwähl bydt ifrån honom dess pälss, men icke betalt hwad han honom i mellan gåfwa låfwat, och således på berde sätt ifrån honom dess Brödsäck med Päl-"
407,RO_1697,0075_0076,"D, jämwäl samma gång fådt ett halfft L℔ à 1 D. 8 ⁒ mkr, som han alt som Juul näst der effter låfwar betala Tarken frågade om han något Tobak be- kommit, påståendes där hoos att han icke wore till Bergen nå"
408,RO_1697,0079_0080,"en slachtadt kalff, som wägat 22 mkr à 2 D 24 Á� 30 mkr Oxkiött, hwarföre han sielf till Slachtaren betalt 3 D. 24 /: Tijo tappar Råg miöhl a 6 D: 8 ö�:, een Cap:a korn gryn à 1 D: 8 öf:r een Cap:a ärter 1"
409,RO_1697,0083_0084,"lle nast det han sielf dem icke emottagit, tillbiudandes sig der hoos, att heller wela berde saaker betala. Fullmech- tigen bad, att effter som igenom Ryri las nekande denne Saak så länge blif- wit uppehål"
410,RO_1697,0084_0085,"en intet det han icke wiste dess Broder dem kiöpt hafwa, tillbiu¬ dandes sig heller samma Saaker at betala; dy pröfwer Rådstugu Rätten skiäligit, ett, Pyrila bör restituera mehrber:de Saker eller och af Pe"
411,RO_1697,0084_0085,"skiäligit, ett, Pyrila bör restituera mehrber:de Saker eller och af Petruskas dehl uti boolaget dem betala med 17 D: 8 ö: Km:t, sampt böte dess uthan för een sådan olaga och hemlig handel, sine 3 mk. S:m:t"
412,RO_1697,0085_0086," sig öfwer Hampspinnaren Claes Ber, som kiöpt bem:te Nopiains Gårdh, och deropå till honom än intet betalt. Hampwinna ren Sver inwende, att han något till den andre Förmyndaren Borgaren Michel skiliander, "
413,RO_1697,0085_0086,"r, och emoot 83 D: Kop:r m:tz wärde uti Pertzeler och annat till Nopiains En kia å detta huusswärde betalt, willian des och medh Casten effter möijeligheeten sig infinna. Handelssmannen Sunj re- gererade S"
414,RO_1697,0091_0092," piainen och hans hustro tillhoopa böra re stituera mehrberde Koppar kittill och 35½ mt: Ull, eller betala dheras wärde med 17 D: 24 ö: Km:t till äganden, sampt böte sedan så Johan Lupiainen som dess hustr"
415,RO_1697,0091_0092,"a bekommit och han aldeles ne- kar till, måste Tiufwarne sielfwe jempte Saltfisken återskaffa eller betala dess wär de 14 D: Km:t sampt böta 3 gång:r så myckit Nembl. 14 D: Smt:, och detta alt lijkmä- tigt"
416,RO_1697,0092_0093,"s hustro med henne förtärdt kiöttet och fretet af 1 D. 16 ⁒ Km:t wärde; altså skola dhe tillsammans betala det till ägaren och böta 3 dubbelt så myckit Nl. 1 D: 16 ⁒ Sm:t, halfparten hwardera, tillärskipte"
417,RO_1697,0092_0093,"dömbder dess sielf tillståndne gield af 83 D. 15 ⁒ Km:t medh 2 D: dito mynt Expenser till Nyman att betala, och bewijste Rådmannen derjempte af d. 16. Novemb: 695 och d. 7 Januarij 696. att han innehållet "
418,RO_1697,0092_0093,"96, attestera, sig wär- derat ber:de gård för 200 D: Kmt: Förden- skull Jacob Böis- Jacob Böis- man betalar Ber till Pappmens geld H Johan Nyman. med Nymans der hoos fogade quitancer"
419,RO_1697,0093_0094," immission der uti kunde bewillias helst Papunen opå dhe här tills honom för under dilationer intet betalt dess uthlag de penningar, inläggiandes Rådman, nen nu jämwäl 120 D: Kmt till fyllnas af det som ef"
420,RO_1697,0093_0094,"nne, att Justitiӕ Borg- mest:n d. 15 innewarande Aprilis ännu gifwit Papunen 8: dagars dilation att betala Rådmannen Böisman, eller i wijdrigit fall afstå Gården; Så pröfwa- de lijkwist Rätten skiäligit, a"
421,RO_1697,0095_0096,"s att intet kunna någon Risditor eller annan for- dring af Schumachers Sterbhuus eller dheras massa betala, mindre något för skått för boolaget, wijdare än härtills skall skiedt, undergå, för än Johan Schu"
422,RO_1697,0096_0097,"tädes förme nandes Welsh sig icke förminskat Stadzens Inkombster, uthan alt wäga låtit och der före betalt; det öfrige anbelangande, som Fiscalen berättar, att Weloh skulle hafft To- back i Rådman Luhrens "
423,RO_1697,0098_0099," den skada Mårten giordt Handelssmannen Wulffers i dess Boda annan 4 Månader ifrån Rever- sens Dato betala 40 RD:r, panttsättiandes dhe till den ändan dheras Sahl. Mans och faders Wåhnhuuss här i Staden oc"
424,RO_1697,0102_0103,"dare om Confiscation anhåller, helst Welst intet fulla wåg penningarne uthan för- slag wijs derföre betalt, sampt således Stadz Inkom- Inkombster gemofseijeln försnillat, föruthan det Toback, som i Rådmann"
425,RO_1697,0103_0104,"äl Rådmannen Jacob Böks man, att effter som Pappinen allareda så många terminer försuttit, och icke betalt honom effter Ciembnär Rättens doom, som han af Johan Nyman inlöst, han nu måt te imponeras att aff"
426,RO_1697,0105_0106,"hyra, som han warit skyldig och igenom Ciembnen Rättens Resolut blifwit pålagt till Tuckiefruun att betahla hwarföre och emedan lagläsaren derföra seder- mehra caverat, förmeente han sig hafft fogh att låta"
427,RO_1697,0105_0106,"där till, så wijda han ännu skall hoos sig hafwa Wal- ters Tappa och der af kunde giöra Huusshe ran betalt. hwaremoot Fiscalen inwände att Lorentz Brod Zenig C: Grotth: wedmanna: arresterade. peng:r 203. a"
428,RO_1697,0105_0106,"de Lagläsaren Brodzenius Råd- stugu Rättens doom af d. 15 Maij 1693 dessmedelst Walter pålägges att betala för Cortmans Cappa 80 D:r och Rättegångz Expen- ser 24 D: alt Kmt, som giör tillsammans 104 D., fr"
429,RO_1697,0109_0110,", hwar emot 2: Gran högel. nekar, att hwarken han eller hans Broder Mårten Grän för Langen uthfäst, betala Krögers giäld och hålla von der Hardt skadelöös, med föregifwande, att som von der Hardt så wäl La"
430,RO_1697,0110_0111," 56 mC: 8 ß. lübska, dem Ciembnär Rätten uti dess doom af d. 13. Novemb: sidstl:ne honom pålagt att betala till Handelss mannen Richardt von der Hardt, här med att befrija, och kan bemte von der Hardt alt-"
431,RO_1697,0110_0111,"s mannen Richardt von der Hardt, här med att befrija, och kan bemte von der Hardt alt- så sökia sin betahlning af Krögers Qwar låtenskap, det bästa han kan och gitter. Blif- wandes och dhe å denne Saak anwe"
432,RO_1697,0113_0114,"med arrest belagd, och fort- man sedan på Fiscalen transporterat efftersom han icke kunnat obtinera betal- ning för Walters undanhållande, det han samma Dato för Protocollet icke skallne- kat; hwilket opbå"
433,RO_1697,0114_0115,"fter som Portman dess uthan för een Caution till Borgaren Frantz Johan. son för Walters skull skall betahlt 213 D: Kmt: Elliest anförer Fiscalen, att om Walter hafft fogh att tahla på denne Cappan, som han "
434,RO_1697,0115_0116,"er wärderat den tijden enär domen föll i Ciembnen Rätten A:o 694. in Junio, uti hwilken doom Walter betalt Portman dess fordran effter Rådstugu domen, och således Cortman blifwit 2ne gångor be- talt, Nembl"
435,RO_1697,0115_0116," Ciemb- ner Rättens doom, och een gång igenom Cappan, hwarföre han ju med skiähl för- drade den ena betahlningen tillbaka, och der Wedman förmeente Ciembnier Rätten hafwa giordt honom förnär, så måtte han h"
