,parent,file,context
0,RO_1684-1687,0014_0014," wid- löffrighet lärer afhielpas, effter som hans prætension grun- dar sig på Sahl: Bricktens klara obligation; Rådztienaren Johan berättadhe, at änkian i går uppå utgångne Citation hafwer swarat, hon måste nu"
1,RO_1684-1687,0014_0014,"ndhe och hustru Elisabeth Törner Swarandhe, blifwen ef- ter inkombne Acter skriffter och producerat obligation, gifwer af Swarandhes Sahl: man, sampt hwadh Neder Rätten har samma stadhes d: 13 Decemb: 1677 der"
2,RO_1684-1687,0014_0014,"fwer dömbl hafwer, har medh för rätt ehrkiändt. Swaranden åhr skyldig i föllie af hennes sahl: mans obligation och bem:te neder rättens doom at betala åth kiärandhen, som af Sahl: Clas Wargen redha fådt 27 rD:"
3,RO_1684-1687,0034_0034," anhålla, at blifwa befrijadhe från sådhant till tal, ty dhe hafwa kiärandhen lefwererat rich- tige obligationer, hwarföre till en deel ståår pant, men nu mehra kunna antingen kiäran- dhen eller dhe förmyndare"
4,RO_1684-1687,0039_0039,"rætendera af swaranden en Rest uthi Capital och Interesse - 597 D: som sig grundar på Sahl: Wargens obligation på 1200 D: Kopp:r m:t Swarandhen bybringer saopiendo, at samma Capi- tal woro tagit till Låns föru"
5,RO_1684-1687,0040_0040,"es Sohn Johan Wargen in p:to doti, erkännes effter inkomne Räckningar och producerade sahl: Wargens obligation, här medh defi- netive för rätt; Ehuruwäl uthi Sahl: Wargens ob- bigation af d: 13 Janu: 1680 inte"
6,RO_1684-1687,0070_0070,"n Wachtknecht, frågandes honom om han kun- de wijsa honom någon godh wän som honom emoth pant eller obligation medh någre pennin- gar kunde bijspringa, Jören swarat det werth iagh icke, men om du will sielf se"
7,RO_1684-1687,0074_0074,"fwit krafder igenom någon som här i Staden pläga drifwa han. dell medh be:de Michael 8 Begiärar att obligation må upwijsas af fullmechtigen Mosmacher, Resolutio. Rätten pröfwar skiähligt wara att handelsman ne"
8,RO_1684-1687,0115_0115,"ch Ränttemästaren Wälbetrodde Anders Utter, framwijsandes Handelsman Wäl:tz Anders Gynter fors 2:ne obligationer, den ena på 4815 D: och den andra på 600 D: Kopp:r m:t som dhe honom för en tijdh sedan försträc"
9,RO_1684-1687,0115_0115,"ga Rådstugu dag närwarande Förekom Herman Meddendorph ifrån Räfwall p upwijsandes Anders Gynterfors Obligation på 180 Rixdahl.r som han för honom Caverat hoos Berent Nootbäck utj Räfwell, begiärandes af Rätten"
10,RO_1684-1687,0116_0116,142 Förekom Jochim Haßbärgh ifrån Räfwell up¬ wijsade i lijka måtto gynderfors obligation som han honom skall skyldigh wara på 1400 D:r Kåpp:r m:t hwilket han skyldigh blifwit förkramghooß
11,RO_1684-1687,0116_0116,"- för alle andre Creditorer, det och han hwilken aff Johan Fluck skall wara blifwit öfwerdragen. en obligation på 167 Rix dahl:r och 42 /: Sölf.r måge blifwa hullpen till och att bem:te Buck 114 143. kunde til"
12,RO_1684-1687,0210_0211,"ande Rådhstugdagh. vis: p: 40. Fiscalis Mons: Matthias Almenius. Framwijste uthi RättenCopia af een obligation uthaf h: Berent Fobin på 250 gyldhen, dhem han gifwit ien kiöpman i Amsterdam Rolof Brasch d: 1 oc"
13,RO_1684-1687,0210_0211," egendom, än at dhes huus och gårdh kulle således förtecknas; förmälte dherjämpte, at uthi original obligation hadhe een Man uthi Hollandh för honom Caverat, thet han icke fan wara i dhen inlefwereradhe Copia "
14,RO_1684-1687,0210_0211,dhen inlefwereradhe Copia afskrifwit. 208. Fiscalen producerade sammaledes bem:te S: Berendt Tobins Obligation af d: 12 Martij A:o 1685 dhen
15,RO_1684-1687,0264_0265,n H:r Ranckenhagen igenom Fullmächtigh Cort Tunder Swarandhe. Kärandens Fullmächtig producerade een Obligation af Swarandenchenhagen d: 21: Februarij 1681: på 132 RD:r å 64: öre Sm:t gifwen åth Rådman Narfwen 
16,RO_1684-1687,0264_0265,": öre Sm:t gifwen åth Rådman Narfwen H:r Berend Eric; som och den 2: Sept: 681. Transporterat samma Obligation åth Engelsk kiöpman Wilhelm Walker, ingifwandes derjämte Full- mächtigen Wilhelm Walkers Räkning a"
17,RO_1684-1687,0264_0265,"r af Swaranden uthi Capital och intresse-65 RD:r 1/3 Å� Swarandens Fullmächtig begiärar at Copie af Obligation och Räkning må honom Extraderas, så wille han swara der på. Guarnisons Feltsker M:r Ebbe Falck Ble"
18,RO_1684-1687,0278_0279,"m Fiscalen Almenius anhålla, at få sin befhekningh af borgaren Berend Dobbin; effter dhes uth gifne obligation till kiöpman i Amsterdam Olof Braset å 250 gylden Capital, fordrandes i så antalet måtte samt uplä"
19,RO_1684-1687,0279_0280,176 Probsten hörsammastädes H:r Magister Jacob Lange effter sin uthgifwen Obligation af d: 1. Octob: 168 4. till kiöpmannen Roloff Brasck i Amsterdam; uthstättades än ytterligare sena
20,RO_1684-1687,0333_0334,"örlig heeter; A Stadz Fiscalen Alminius å Inspectoren Jacob Håppen Stångens wägnar, Protucerade een Obligation Sib dato Noen d. 4. Juny 1685 gifwen af handelsmannen Berend Debbin åth bem:te Inspectoren för upl"
21,RO_1684-1687,0373_0374,"niel Cononoff S stelte för sigh till Cautionisten, Ryßen Ridita Jacoboff Baschanoff, som igenom des Obligation under des egen handh förlichter sigh, at weela bethala hwar Twå Månadh för Daniel Conanoff 60: D:r"
22,RO_1684-1687,0405_0406,", så ähr det och meent. Ad 11. R. lijka såsom ad Art: 4. Ald 12. Rp. Tunder swarade, i skulle ingen Obligation hafwa gifwit ifrån eder. Ao 13 R. Bröker swarade, det må iag tacka H. Her- bers före som mig hafwe"
23,RO_1684-1687,0419_0420,"ker at förföllia honom som han och i dhetta måhl giör, och om han, Bröker, får see Panten eller sin obligation, wille hon swa¬ ra dertill. Upbudet blef första gången förtecknadt. vid. N: 66. S.r Jochim Bröker "
24,RO_1684-1687,0441_0442,"erte, att gullsmeden M:r Anders Graan må betala dhe 352 D 12 öre K.M:t som han effter sin uthgifwen obligation af den 5 Julij 1686. åth Inspectoren ähr skyldig, eller och att dess gård som redan d. 19 Jan: 168"
25,RO_1684-1687,0462_0463,lsman h:r Hans Pölke kärande Emot handelsman Berendt hafuer Swarande Käranden producerar Swarandens Obligation af d. 7 Nov: 1685. jempte een Räkning att Swaranden honom ähr ännu skyldig 1326 D 2 öre K: M:t sed
26,RO_1684-1687,0462_0463,"d wid sin obli¬ gation och klare fordran. Och emedan Swaranden re¬ cognoscerade sin hand under dess Obligation, jempte och tilstår att Pölkens Räkning som han muin¬ gifwer, ähr aldeles richtig, allenast att ha"
27,RO_1684-1687,0462_0463,"ölliande Resolut: Emedan handelsman Berendt hafuer intet hafwer till säija emot dhes uthgifne klare Obligation till handelsman Hans Pölken, eij heller emot be:te Pölkens Räkning, uthan erkenner den för aldeles"
28,RO_1684-1687,0548_0549," förskrifwas till säkerheet och undergant, för den gielden som bem:te Timmerman effter deß uthrifne Obligationers lydelse af Sahl. Borgmester Hiernman hafwer lånt, och Sahl. Timmermans Enkia alt här till intet"
29,RO_1684-1687,0548_0549,"r till intet welat betahla; produ- cerandes til den ända bem:te Blix vidimerade Co- gier af sielfwa Obligationer, Nembl. den ena af d. 12 Aug: 1685. på 270 D. K. m:t med 6 pro ento, den andra af den 11 Sept: 1"
30,RO_1684-1687,0564_0565,"uramento Supplatorio sin Sahl. Mans gieldbook bestyrcker, helst emedan hennes Sahl. Man gifwit sine Obligationer åth Sahl. Borgmestaren, hwaraf præsumeras att Sahl. Rådman af förgiälenheet sin Räkning i bo- 56"
31,RO_1684-1687,0565_0566,". Borgmestaren att få dem till sin näring fortsättiande, och att Interesse Penningar som han på sin Obligation war skyldig måtte blifwa hoos honom oför ryckte: Förmenandes Fr: Borgmesterskan, omsamma 100 D wor"
32,RO_1684-1687,0565_0566," Borgmesterskan, omsamma 100 D wore betalte på obliga- tionen eller Interesse, borde sådant wara på Obligationen annoterat, eller af Sahl. Borgn mestare äpart quitterat, som ingendera finnes 3 hade Sahl. Rådma"
33,RO_1697,0047_0048,for- dra af Borgaren och Handelssmannen härsammastädes Sr Robert Cummingh effter dess egen uthgifne Obligation een Summa af 193 RD:r 34 ß. med begäran att som bem.te Coming hoos Hr Justitiæ Borgmestaren Hinnel
34,RO_1697,0075_0076,"us, då han med dess Exception böör inkomma./. vid: 155. Handelssmannen Claes Berg pro- Furerade een Obligation af d. 28 Septembr durcha 196, dessmedelst Ryttaren Anders Nielson tecke tillstår, att hafwa bekomm"
35,RO_1697,0075_0076,"t bemte Förrijare sig emoot Juultijden infin- na skulle, men wijdare icke caverat Omsijder och enär Obligationen wijtes åth Tecken, tillstod han sig hafwa skrifwit dess Boomercke der under; Men så ha de han ic"
36,RO_1697,0118_0119,"smannens härsammastädes Andreas Bomgardts till Handelssmannen i Hamburg Hinrich Sparing extraderade Obligation opå 625 RD:r 26 ß. Lönska, Daterat Hamburg d. 13 Septem blis A:o 1693, sammaledes een Copia af bem"
37,RO_1697,0118_0119,"n icke heller der med kunde wara nöigder, så anhölt han att effter lagh honom Exe- cution opå denne obligationen måtte Afskrift bewillias, jämbwäl Handelssmannen Ber¬ gardt dess förinnan wed wijte förbiudas at"
38,RO_1697,0119_0120, hwarcken skulle siunka eller brinna. Lembnandes han jembwäl till dess Swärfaders behagh denne hans obligation då eller enär han funne det nödigt att låta lagl. förtekna som obligationen Copialiter ad acta lag
39,RO_1697,0119_0120,"rfaders behagh denne hans obligation då eller enär han funne det nödigt att låta lagl. förtekna som obligationen Copialiter ad acta lagd sådant alt wijdlyffel.n föreställer, andragan des Borgmestaren hado derj"
40,RO_1697,0125_0126,"431 D:r Km:t, och uthfästa ber:de Summa Påsktijden, näst der effter att betala på sätt och wijs som obligationen, hwilken Rådman igen till sigh togh, wijdare förmäh- Sig ler. Rätten bewilliade att föregående R"
41,RO_1697,0130_0131,"kiöpman nen Sr Berendt Heidtwinckell, att han ke allenast försåldt till Capitenen Rosen- Lindt 253. Obligation til Jacob Hubens Fiscalis Berent Hejd Wilkel anna: olofl. handell."
42,RO_1697,0156_0157,"at Narven- Otto Reinholt Bock C: Be- rendt Dobbin ang: geld. d: 10, Julii 1696, sampt bem:te Debins Obligation, af d. 16 Martij nästl:ne opå 100 RD:r, begärandes Amptmannen, att Handelssmannen Debia måtte förm"
43,RO_1697,0159_0160,"Spi- Sölfl. ring wägnar :/ emoot Handelssman i Nyen S:r Andreas Bomgardt, angående een Räckning och obligation af d: 13 Septemb: 693, à 710 RD:r såsom och Expenser 16 RD:r, emoot hwilken doom han intra fatalia"
44,RO_1697,0159_0160," doom inläggia jempte acterne; han swarade, sig intet annat hafwa emoot domen, än han förblefwe wed Obligationen som S:r Bom gardt Spiring gifwit, sampt sin ungifne Räck- ning som sig funderade på Obligationen"
45,RO_1697,0159_0160,"ed Obligationen som S:r Bom gardt Spiring gifwit, sampt sin ungifne Räck- ning som sig funderade på Obligationen, sampt dhe begärte Expenser som honom äro ifrån 311 p"
46,RO_1697,0165_0166,". Bomgardts d: 31 Julij nehagde gravamina intet wijdare wille swara, uthan alle- nast förblifwa wed Obligationen, som expresse skall innehålla, att Bomgardt u- than geensagu wille betala den der uti ben:te Sum"
47,RO_1697,0166_0167,"ra comparera, och Rättens resolution förwänta. / vid: 325. Juden Levi Assert Welss producera de een Obligation, som framl:ne Skiepparen där sammastädes Jochim Danman d: 8, Septembris 1695 i Amsterdam uthändiga"
48,RO_1697,0166_0167,"fl. honom af Danmans Sterb Råd huus quarlåtenskap kunde blifwa till- stälte, och i medlertijd denne Obligation till wederbörandernes säkerheet inproto- collerat; hwilket Rätten in qvantum Ju- ris bewilljade, l"
49,RO_1697,0167_0168,"i nästl:n i Söst låtit inprotocollera dess Swärsons Han- delssmannens Andreas Bomgardts honom gifne Obligation af d. 2 May 1694 på 600 RDr Capital, som han af Borgmesta- rens omyndige Barns af förra giffte å d"
50,RO_1697,0168_0169,"328 Resolutioner äre privilegerade till, helst e- medan han bem:te Obligation fram för nå- gon annan af Bomgardtens Creditorer Lagl. låtit intekna; ty anhåller Borgme- staren, "
51,RO_1697,0257_0258,"hn gaf Rättenom tillkänna, huru såssom han å bem:te Mahns wägnar i krafft af en klar¬ och ostrijdig obligation erhållit Execution opå Handelssmannens här sammastädes Berendt Dobains löösa ägendom, som jembwäl "
52,RO_1697,0257_0258,"e Fullmacht och producerade i föllie der af Handelss mannens här sammastädes Mårten Hinrich Zlliäks Obligation Dat: d: 18, Decemb: A:o 1696, lydande opå 996 D:r 15 Á� Km:t, som honom Ao 693 och 695. dehls i wa"
53,RO_1697,0258_0259,"506. mechtigen, att denne obligation till Han- delssman Frisu säkerheet kunde inpro¬ tocolleras, sampt honom i så måtte præ¬ ferencen t"
54,RO_1697,0258_0259,"es. /. Än opwijste Fiscalen Matthias Wed man i Fullmart af Handelssmannen Johan Hinrich Frissius en Obligation som Borgaren Berendt Höfner till honom d: 10. Decemb: 696, uthändigat oppå 820 Dr 25 ö: km:t, den "
55,RO_1697,0258_0259,"enom Fiscalen Matz thias Wedman Handelssmannens Berends Dobbins d: 1 Decemb: Ao: 1696 honom gif- ne obligation, dessmedelst han tillstår sig effter sluten liqvidation blifwit skyldig till Handelssman Frisius 1"
56,RO_1697,0259_0260," gårdar belägen, till underpons för ber:de fordran, med dhe wilkohr och Condi¬ tioner, sone sielfwa obligationen wijdlyfft gare upprimerar; hwarföre Fullmechten gen anhölt dett måtte till Creditorens säkerheet"
57,RO_1697,0259_0260,"dlyfft gare upprimerar; hwarföre Fullmechten gen anhölt dett måtte till Creditorens säkerheet denne Obligation Protocollo in¬ sereras, med förbehåld att han fram för alla andra Dobbins Creditorer må wa¬ ra til"
58,RO_1697,0259_0260,notam. //. Wijdare producerade Rådman Wällt Hinrich Luhr Borgarens och Handelssmans Berendt Dobbins Obligation opå 1511 D:r 17 /: Kmt: dem Dobbin effter ett åhrs förlopp till Rådman låfwor betala för¬ uthan in
59,RO_1697,0259_0260,". Sahl Borgmest:ns Hertzens och Handelssons Arfwed Gowinii gårdar, med dhe Condito¬ ner som sielfwa Obligationen af d: 30. Julij 1696, uthförligare wed handen gifwer bediandes Rådman att denne hans klaga fordr"
60,RO_1697,0263_0264,ilation_ 229. emellan ang:de dilation _ 229. Balthasar ochodo låter inprotocollera And: Bom¬ gärdts Obligation Berendt Doboin prod:r Samptl Sahl. Hinrich Rysters Dito 230. Erf:r med dess Enckia hust: Anna Hedw
61,RO_1697,0265_0266,"uda Anders Kur¬ i Kos Saker —— 201. Jacob Böisman låter inprotocollera Ritters och Joh: Schumackers Obligation Jacob dagieson excuserar Gustaf Kettuns ute¬ 242. blif:de emot Abraham Brise ang:de slagmåhl, 204 "
62,RO_1697,0266_0267,rtekna dess for¬ C dran till Mårten Henrich Ziliax _ 505. Dito låter inprotocollera Berendt Höfners obligation 507. Dito låter inprotocollera Berendt Debins ro- Obligation __ 307. Q Liessbeta Jöranßdr angifwes
63,RO_1697,0266_0267,o låter inprotocollera Berendt Höfners obligation 507. Dito låter inprotocollera Berendt Debins ro- Obligation __ 307. Q Liessbeta Jöranßdr angifwes för Barnemord - 60. 523 Lorentz Brodzenius C. Jöran Wulffert
64,RO_1697,0266_0267,an gifwit åth Königstedtz Skutfolll 298. Levi Assert Welff låter inprotocollera Sal. Jochim Danmans Obligation — 324. Danmans Obligation — 324. Danmans Obligation — 324. Dito låter intekna sin fordran hoos Sal
65,RO_1697,0266_0267,Skutfolll 298. Levi Assert Welff låter inprotocollera Sal. Jochim Danmans Obligation — 324. Danmans Obligation — 324. Danmans Obligation — 324. Dito låter intekna sin fordran hoos Sal. Bo- gislaus Röling 394. 
66,RO_1697,0266_0267, Welff låter inprotocollera Sal. Jochim Danmans Obligation — 324. Danmans Obligation — 324. Danmans Obligation — 324. Dito låter intekna sin fordran hoos Sal. Bo- gislaus Röling 394. Lars Malm och Hinrich Zuhr
