,parent,file,context
0,RO_1697,0011_0012,"stod sig med åthskillige Bön- der, där så nödigt wore, kunna bewijsa, att dess Broderson wore uthan skuld, och denne. denne skadan intet wetat förekomma, effter som Broen warit så elacker, förmenan- des ha"
1,RO_1697,0050_0051,"thinnan intet giöra, uthan wart för åf:n nembde af Soldaten Anders Mur- mestare på beropade witnetz skuld, den- ne Saak opskutzen. /: Vid: 307. D:o 1697 d: 20 Februarij höltz laga Rådstugu dag närwarande B"
2,RO_1697,0122_0123,"editor skall hafwa macht Erfwingarne tilltala för den Summa hon dem tillsagt, uthan all Sterbhusetz skuld böör af henne och hennes ägen doom fullgiöras; hwarföre och ingen af Erfwingarne sig i någon måtto "
3,RO_1697,0124_0125,"gerat och förlijcktz, det han /: Bomgardt :/ sig åtagit effter 4: Månader if:n ber:de Dato på samma skuld att betala 294 RD: 14½ ß. el- ler 882. vd. 14 ½ D. och resten af 637. A. 4 ß. lübska 5 Månader der "
4,RO_1697,0130_0131," lyffel:n exciperar emoot Heidtwinckets an- sökiande, påståendes för dhe andragne skiäl och motiver skuldh, att den af Ciembnen Rät- ten bewilliade Dilationen på 4: wekor kun- de protongeras, sampt Heidssoi"
5,RO_1697,0222_0223,"en Blan- kenhagen, det Cautionisterne som sig åta git för denne fordran såssom deras pro¬ S. D. pre skuld att stå, Lijkmätigt deras egen förskrifning af d: 11 Julij 694. som han nu Sopialiter inlade, måtte"
