,file,context
0,0132_0134,"onom i betzlet, cch wille taga honom bort, hwar på Sallme Johan hafwer nappat till och slaget henne huden full medh huga, och rifwit henne blodigh i ahnsichtet; hwarom 1:de hustru Rät- tens byståndh ahnm"
1,0270_0272,"l hår draget; här Christer begierte han wille giöra si Eedh der på att han henne intet sparkade och hudrog, hwis tillbödh sig sådant att göra och aflade der opå sin Eedh att han intet hade honom sparkat "
2,0380_0382,"inhängnat een ängh, som Rätten hafwer tilldeelt bem:te Bonde; Och ehuruwähl Borgmästaren hafwer för hudit be:te Rothinen oppå deße Åhren icke allenast medh till skickadhe Rådhman och Stadztiänaren, at ha"
3,0384_0386," skulle wachten något giordt förnäär, så måtte och wachten wäll kunnat honom ankasta. Än förestälte huden, eet annat witne nembl: en fohrman ifrån Klyen, Jöran Matzson benembd hwilcken i Eedstad be- kiän"
4,0458_0460,"till Stocholm öfrföhra, och der till Blankenhagenhetens bästa försällia, sättiandes intet wärde opå hudenne el:r hwilken uthan badh honom dem försällja, åsom han bäst kunde, gifwandes honom ifradht 4 D:r"
5,0458_0460," åsom han bäst kunde, gifwandes honom ifradht 4 D:r Knt: Begierandes han wille för dee pgr: han för hudarne och dwilken kunde bekomma, och köpa derföre Salt; Ahnhållandes nu att kommit sin sin betallning"
6,0459_0461,"ch intet längre oppskof weeta; uthan frågade hwarföre Eskilt icke länge sådan hade betalt honom dee hudar och drälken som Norr obrände Eskall Pirrsoinen replicerade, att han war in- gens dräng, att lööpa"
7,0459_0461,"nu hade inste Syne witnen, som kunde intyga huruledes den Olycken wore till gången. och om så månge hudar wore i branden fördärfwade, som han ahngifwit hafr och huruledes den wådan wore tillkommit som ha"
8,0459_0461,"illige saker för andre Pärsoner, som sitt godh hafr hafft opå lådian, hwar under Blankenhagen 80 st hudar äro införde. Men finnes uthi Specifi: cationen wara förmält igenom Styrmans Eskill Tuskias och Bå"
9,0459_0461,"försällja, à 4 D Km:t st: och dito dher 138 al:r Swälk å 12 öre Knt:t alnen; Men dher öfrige 80 st: hudar äro med lådian i hemreesan i Pälinge oppbrände wed Be- Stodh effter han på intet södh kunde dem i"
10,0459_0461,"2 Swaranden Hinrich Kirhoises Son, Eskill Pirhoinen gaf tillkenna huruledes han af dhe 99 st: hudar allenast 3 st hade i Stockholm fått försällja, à 4 D Km:t st: och dito dher 138 al:r Swälk å 12 ö"
11,0461_0463,"lenast uthbekomma Wälb:ne H: Landzhöfdingens Cussert och en bränne wijns panna, och blef altså alle hudarne för- brände föruthan 15 st: hudar som lågo opå Saltet, och dher 3 sm: Stockholm försåldes frick"
12,0461_0463,"fdingens Cussert och en bränne wijns panna, och blef altså alle hudarne för- brände föruthan 15 st: hudar som lågo opå Saltet, och dher 3 sm: Stockholm försåldes fricke, sädan han dem uthi boden, under s"
13,0463_0465,"ffter aff se lagdom Edh intygade; Att Eskall Persone intet fick försällja Rådmannens Blänken hogens hudar i Stockholm, uthan allenast någre; Och när dhe kommo till Pälinge Prööß lådian fast, så att dher "
14,0463_0465,"tt som löst Salt war, men dett som låg i halftunnor inpackat lätt han liggia qwar med Blankenhagens huder, wiste och intet huru månge hudar han der af tog och hade under Saltet; Och begynte Eskill sådan "
15,0463_0465," låg i halftunnor inpackat lätt han liggia qwar med Blankenhagens huder, wiste och intet huru månge hudar han der af tog och hade under Saltet; Och begynte Eskill sådan uthaf Biörköös Skutan opp föhra si"
16,0470_0472,"y han wille åthskillige gångor hängia sig sielf med hand- klåfrarne, såsom wachten wäll wiste; Gudh hudh att han wore nu bättre och Önskade sig till ödstunden der wed förblifwa. Om han nu klagar på Gloßw"
17,0477_0479," Ändskap i saken med Borgaren Hinrich Piersonen och hans Son Eskill Piersonen; asun der der Backade hudar som Erkian Pirhoin hade åtit förbränna för Rådmannen i Kyra Hin- Blankenhagen, effter nu terminen"
18,0484_0486,"nders effterkomma. 2: hafr och Eskill emottagit af Hr Hinrich Blankenhagen och Christian Hurk, dhee hudar som blefwo uppbrände, uthan Interessentens, Johan Pier hästes eller hans Sons weetskap; brukandes"
19,0487_0489,"jsen, att blifwa fruser Säger sig hinrich Prichoinen ingen Profyt hafwa ett af dher Nyanske köpmans hudar hans n Erkia öfr förde, uthan der Johan will söka dem någon Profijt, så står honom frijdt bringa "
20,0505_0507, stycket giör 495 D:r Koppm:t sampt 138 al:r blår derält i 12 öre al.r giör 5 :/ 24 öre; för brilke hudar han 2 reesor giort till Kiecholm berar uppå han kåttat 48 D:r Kopp:mt Interesse å 6 pro cento ifr
21,0505_0507,ade. Rådmannen Hindrich Polankenhagen tillsporde Eskill om han åke hade befalt honom upläggia samma hudar i Stockholm es en kiöpman Johan prot Johan bew:d dher han icke skulle dem fåförsan Rp: Att Blanke
22,0506_0508,"rde på hudarne; effter sådant intet war om om befalt, Sadhe och att skill hade icke öfwer 3 eller 4 hudor i boden opfördt, uthan alle dhe andre wore i Lådian. Rådmannen begierte i denne saaken ähnnu någo"
23,0506_0508,"hon läkte öfwermåttan i om Luckelain hade sedt, om nå¬ gra kiärmän wore i Stockholm som wille kiöpa hudarne? Rp. att nog sågh han att dher wore dhe som wille kiöpa, men intet wiste han något kiöp eller w"
24,0506_0508,". att nog sågh han att dher wore dhe som wille kiöpa, men intet wiste han något kiöp eller wärde på hudarne; effter sådant intet war om om befalt, Sadhe och att skill hade icke öfwer 3 eller 4 hudor i bo"
25,0506_0508, skrifft i behåll utha hans Farbroder Rådmannen tillsporde skill hwarföre han icke uthto dhe 81 st. hudar när han dhe 15 uthtog effter härdarna lågo upp faltet? R: att dhe wore alle uthi en Poaka lagda b
26,0506_0508,"re till Eskill, då den skrifften skall dem åthskillit Blankenhagen intet gifwit honom ordre at föra hudarna tillbaka Eskill swarade sigh intet hafwa samma skrifft i behåll utha hans Farbroder Rådmannen t"
27,0506_0508,"os Eskill Pirhonen begiärt och inståt, at dhe måtte få upföra, alla dhe waror som war på låder både hudarne, så wäll som alt annat, men Eskill Pielonen inte tillåtit, uthan fördt dhem till arbete uppå Hi"
28,0508_0510,"Eskill hade lagdt 15 st: huus underdå saltat som han i fällinge håll upläggia, och tillförende hade huden legat uppå saltet i lådian effter öfwerloppet läckte, Intygade Påwel Luckeläen, att denne Jöran P"
29,0509_0511,"t försällia till sin profet, uthan giöra Blansen¬ hagen wänskap dher med; hafuer och skill af desse huden in¬ den nytta uthan sade hafft, hwarföre han och dherförr aldeles befrijas. Den 21 Febr: werord: "
30,0510_0512,"erson, Eskill Pirhonen at Hindrich Pirho¬ nen för 5 åhr sedan skall olofwandes tagit ett ankare tog hudragit ett urack som låg i Stadz hambnen och lembnat ledan ankartåget i Stranden, dher dhet hela Somm"
31,0609_0612,"op:r mz innan een Måna dem förnöija medh min dre kåssma eij till ögenwatnet kan förmå och Christian Hudh, delation som han här för Råd ta anhållit och Hölingen uthom sin princip tillståndh eij kan honom "
32,0634_0637,ill Kyrkioplicht och affbedia Församblingen. Och effter hon intet hade att böta med; Altså blef hon hudstryken. Emedan 5. Emedan såßom Samuel Silwist med Eedh betygadhe sigh förlede wåras ey befattat sig
33,0650_0653,m:t böter Och hon till 80 D:r Sm:tt Och såsom hon intet haar att böta medh; altså skall hon blag wa hudstruken Och begge till Kyrckioplichtz uthståendhe ad ven: Clerum remitteres. Emedan Staffan Meroin e
34,0740_0743,"4. allnar Grön Rask. 2 paar klippings handskar 6 st. nya Carlar 21. dito gambla ½ plucht ½. burckat hud 15. hudh 1. tom Wijn Åhm, Lijn öf.r 1. Lisspund 8 Dr Ull, Gull speter som warit tillförne på hennes"
35,0740_0743,"r Grön Rask. 2 paar klippings handskar 6 st. nya Carlar 21. dito gambla ½ plucht ½. burckat hud 15. hudh 1. tom Wijn Åhm, Lijn öf.r 1. Lisspund 8 Dr Ull, Gull speter som warit tillförne på hennes Myßa, 5"
