,parent,file,context
333,Kexholm,0568_0570,", warandes fördenskuldh mißtänckt om flychten; begge parterne, tillstodh at offtabe:te häst blifwit kiöpt, och warit 28 D:r Kmt. wärdh. 30. R:  Alldenstundh Smedhen Eskill Ikoin 1.o är widh denne tijden a"
334,Kexholm,0575_0577,"woska Wasill Kyykä. Berndt Kaasoinen. Emädan Anders Erichßon siälf tillståår sigh för et åhr sedhan kiöpt een häst af Bertill Zachrisson för – „ 26 Dr kunde Der på han – „ 8 Dr 24 ⁒ betalt hafwer, bekänne"
335,Kexholm,0576_0578,"ewijsa samma Tröija effter branden blefwit behållen. Detta i krafft af dett – „ 5. och 6. Capitel i Kiöpmåla B. St: L: Angaff Rådhmannes Wasill Kyykä, huruledes han för 3. wek sedan hadhe af hastige modhe"
336,Kexholm,0582_0584,"för 2 åhr sedhan å hans Modhers wägnar ingåth et kiöp medh Rådh- mannen Wasill Kyykä, om nedre halfwa deelen af den gårdh, som effter borgaren Sillmä Gre"
337,Kexholm,0582_0584,"ill krydi 6. st:n 6 Drs Plåtar, som giör - „ 36 Dr hwilket Wasill sedan eij weet hålla, uthan samma kiöp weder sagt; begiärande Meroin om Rättens Assistence uthi saaken. I förstone Nekadhe Wasill sigh ing"
338,Kexholm,0582_0584,"gh ingåth detta gårdzkiöp medh Krydi och låtzsson i sedan bekände han sigh burit till krydi å samma kiöp, 6 6 Drs Plåtar, huilka legat hoos honom, 2. dagar och 1 Natt Men effter han då strax eij blefwit i"
339,Kexholm,0582_0584,"förrymbdt, Och Hindrich lotzsson warit af dess Cautionist, derföre han hindrich jempte Krydi slutit kiöp medh Wasill. Staffan swarade På det Wasill må betagas all fåfäng skåttmåhl, angående handelen medh "
340,Kexholm,0582_0584,"äng skåttmåhl, angående handelen medh Huppuin, så will han decourtera dhe 13 Dr som huppuin å samma kiöp blifwit skyldigh till Staffans Modher, af ofuanber:de 50 Dr Cederar der till ännu 1 Dr, så att Wasi"
341,Kexholm,0582_0584,"gårdh, urgerandes der å att Wasill förmedelst Justitiens twång måtte obligeras at hålla sitt slutne kiöp, effter som och Wasill ey hafwer att framthee någre giltige Skiäll, hwar medh han samma kiöp återbr"
342,Kexholm,0582_0584,"slutne kiöp, effter som och Wasill ey hafwer att framthee någre giltige Skiäll, hwar medh han samma kiöp återbryta kan, uthan meera Staffans Modher honom ber:de halfua gård hemula kan; Enär alt detta hono"
343,Kexholm,0594_0596, till 40 m:r Silf:r mte. medan såssom den tuijst som emellan Studenten Mons:r Samuelem Talenium och köpswennen Johan Röling warit angående dett Rölingh i dryckes medh har Ta- enium frånwarande medh öckna
344,Kexholm,0595_0597,ndrich Michelsson Anders Johansson Pirhoin och Petter hen- drichsson Pirhoin beskylles i Nyen hafwa köpst af Sergianten Johan Kim; och aflade der i förståne de- ras Eedh och bekende att der alldrig medh 
345,Kexholm,0595_0597,kende att der alldrig medh kende ö¬ gen samma Sergeant sedt mindre någonsin Cronones Kruut af honom kiöpt hafwa. Abraham Kitunens Sonn Olof ifrån Ostamo stämbde mot Borgaren Carl Gustafson angående Slagmå
346,Kexholm,0596_0598," skylldigh hafwandes han honom gå den för 200 D:r Kop:r m:tz opdragit, och anhölte att det fa deras köp måtte blifwa lagligen annoterat. Anders Pirhoin protesterade här met att han äh- närmast till att i"
347,Kexholm,0597_0599,"Moder och broder owetande skedt ähr; warandes Söfrin-  gen så mycket mindre befogat hwarcken sluuta köp medh bem:te Pölcke, mindre den å hans moders wä- gnar betala och ehrläggia, som han intet ähr hans "
348,Kexholm,0598_0600,"till handelsmans i Nyen Didrich Bloms betiente här i hamman, hwilket han förebär sigh af een Såldat köpte hafwa alt så fälles han effter dett 17 Capit: i Konung: B: St: L: till saak 40 mk:r Silf:r mynt. "
349,Kexholm,0602_0604,nnehåldh att såssom han har försträcht Borgaren Erich Cosma åthskillit ge tijder uthi Penningar och Köpmans waror 289 D:r döhre Kopp:r m:t och Cosma förmans eij war Sufficient att förnöije den Credit han
350,Kexholm,0612_0615,ådstugu dag närwarande Borgmästare och Rådh Johan Rölingh fordrade af Hinrich Pirhoin för undfångne köpmans waror effter inlefwe- reradh Rächningh 252 D:r kop:r mtz Pirhoin sade dett hans Son Petter och 
351,Kexholm,0614_0617,"effter hwil- kens Borgares dödh denne nu klagande Matz ollkonen 682 haar gärdzlegårdarne af Enckian köpt, återan gödt och opbrutat, då han och ha- de bort af då warande Borgmästaren Hinnel om ordentelig "
352,Kexholm,0617_0620,"f hållet ordinarie Rådstugudag, närwarande Borgmästare och Rådh Inlefwererade Rådman Berut Casalain köp- salennens ifrån Nyen Mons:r Johan Röling skrift- liga original skrifft uthan dato hwilken han för "
353,Kexholm,0620_0623,h mestedels sielf och för 14 dagar sedan he hon bekommit 1 D:r 16 öre för hwilka han och genast har köpt sig et par skoor. Till öfwer- klädh berättade Constapeln att hon har tus bast sin Syster een barnf
354,Kexholm,0628_0631,"pten han bodde på, doch huusen under tagade hwilka han bodde uthi. Altså dömmes Jacob Hyvackö samma köp wärckeligen till godo åth- niuta och hela det gårdstället Jöran Sichvo mar- hafft sig till godo nyt"
355,Kexholm,0632_0635,rdzligårdar hwilka Johan Lippä till detta innehaff för 50 D. Km:t o anhölte att Rätten måtte dhetta Kiöp lagl. stadfästa hwilket Rättan och här med confirmerade med dhe conditioner och wilckor att bem:te 
356,Kexholm,0635_0638," ännu resterar. Handelsmar Victor Gröön läst förstagången, upbiuda den gårdh sin aff Cnuth Jöranßon kiöpt hafwer för 45 D:r Km:t, 6 kylä och skedde här intet klander. A:o 686. d: 4 Junij blef hållet extra"
357,Kexholm,0640_0643,"ekommit, som och Hendrich berättadhe, att och Johan ei Sahl. Lars hwilcka Erfwat tillhopa tagit och kiöpslaget hafwa Contagen 680 D Km:t och 25 tunnor Salt för 10 åhr södan uppå reesan, Stock holm bekommi"
358,Kexholm,0644_0647,e wittnesmåhl begge parterne sigh på berpa. Bertill Pallj gaf tillkenna dhet han aff Hendrich Ojala köpt dhen åker
359,Kexholm,0645_0648," Åker han inne hafft till Dato här wedh Staden och låfwat honom 36 D:r Km:t och anhölte att dheras kiöpmåtte blifwa stadh stat, Så emedan Henrich Ojala dhet samma tillstodh; altså gifwer Rätten här medh "
360,Kexholm,0650_0653,r hwilcka medh ogifta Personer för de gon tijdh sedan barn aflat. Och såsom dher iblandh een ogifft Köppa Sall Claus Herman Brasche angifwas att hafwa medh een gift. Såldat hustro Carin Haltonen aflat ba
361,Kexholm,0650_0653,"ä nekadhe aldeles sigh något Salt betingat och dher öfwer högeligen bedyradhe sigh aldrigh så¬ dant köp slutit. Parterne tillfrågades om någon dheras köp åhört hafwer, då Grön förmante sigh kunna skaffa "
362,Kexholm,0650_0653,"r öfwer högeligen bedyradhe sigh aldrigh så¬ dant köp slutit. Parterne tillfrågades om någon dheras köp åhört hafwer, då Grön förmante sigh kunna skaffa Wittnen och anhölte till fram bättre dilation i Sa"
363,Kexholm,0653_0656, alt hon aldrigh tahlt hwarcken om Lijsen eller stoor Cappa uthan Bönder från Woisniemj afwijst att köpa dhen Salt huarest dhe kun¬ 12. na få för mindra men ringare ähn 16 öre Km:t för Cappan kan hon eij
364,Kexholm,0664_0667,agh häradzskrifwaren uthi Kexholms Lähn Wählbde Olof 19. Leistenius dhet han haar ett fullkombligit kiöpslutit medh Fordom Postmestarens sahl. Jochims Freses effterlåtne Enkia gudfruchtige hustro Elisabet
365,Kexholm,0664_0667,"arder, om dhen gårdh hon inom befästningen äger och innehafwer för 360 D:r K:mts och på dhet bem:te kiöp skulle så myckit säkrare uthan något wijdare Klander gåå för sigh så hafwa hennes Söner i Wijborgh "
366,Kexholm,0664_0667,Herman och Jacob Frehl förmedelst fwersend skrifwelsse Daterat Wijborgh d. 19 nästledne Maij bem:te Kiöp aldeles approberat och gillat ock i så måtto gårdens wijdare lösn aldeles ifrå sigh afsagt huarifrå
367,Kexholm,0664_0667,gh och nu här För rätta aldeles afseger och äfwen som dhe ofwanbem:te Hans bruder emot samma slutne kiöp uthi ingen måtte haar att säija; Så emedan bem:te Bostmest:r Enkia ett fullkombli- git frijwilligt 
368,Kexholm,0664_0667, uthi ingen måtte haar att säija; Så emedan bem:te Bostmest:r Enkia ett fullkombli- git frijwilligt kiöp som åfwan förmäles om bemte sin gård medh bem:te häradzskrifware med samptl. hennes myndige Barns m
369,Kexholm,0664_0667,yndige Barns mogna Rådh och samtyckio ingått; altså blifwer heradhz¬ skrifwaren i förmågo af bem:te kiöp samma gårdh honom alde- les inrymbt att för sigh och sina Erfwingar innehafwa och nyttia såsom sitt
370,Kexholm,0668_0671,ssignationen intet bekommit och fördenskuldh måste gifwa Cumin 1 D:r högre på huart lb: effter dhet kiöp som Cum medh handelsm:te Liksr slutet af hwilcken Carin 25 lb: Smör uthi dhen af Hupen försåldhe Sm
371,Kexholm,0668_0671,te Liksr slutet af hwilcken Carin 25 lb: Smör uthi dhen af Hupen försåldhe Smöretz ställe för 5 D:r Kiöpt haf¬ rer; altså erkänner Rätten Grön Skyldig samma 25 D:r opfylla och till Stupen ehrläggia och be
372,Kexholm,0678_0681,"Johanß det hon eij well inrymma honom den gårdh hon af honom sig tillhandlat, utan will ryggia sitt köp och anhölte fördenskuld att han wid köpet måtte maintineras 9. och Linwäfwaren tillhållas att flytt"
373,Kexholm,0678_0681,"n gårdh hon af honom sig tillhandlat, utan will ryggia sitt köp och anhölte fördenskuld att han wid köpet måtte maintineras 9. och Linwäfwaren tillhållas att flyttra i frå gården Linwäfkaren sade sig eij"
374,Kexholm,0702_0705,are Anders Johanson Pirhoin och Erich Casalain och gåfwo Rätten tillkänna det dee hafwa tillsammans köpt een gårdh här i Förstaden af Borgaren Jöran Packarij bestående af een stugu och Cammare 14 Cammare
375,Kexholm,0705_0708,"kickat dhe opå hunden lefwererade 5. Tolförestln tillbaka och anhölt aff Rätten det han måtte samma kööp hålla, och sitt arbete förfärdiga; Con- terfejaren nekade till Köpet och sade att allenast dörarne "
376,Kexholm,0705_0708," aff Rätten det han måtte samma kööp hålla, och sitt arbete förfärdiga; Con- terfejaren nekade till Köpet och sade att allenast dörarne wore inslutne i samma koop men inga foderbräder och offererade Feld"
377,Kexholm,0705_0708,"rne wore inslutne i samma koop men inga foderbräder och offererade Feldt Jären Edhen om han i samma kiöp- armarnes målande betingat, dett och Feldskären giorde, altså dömbdes Conter fejaren samma sitt uth"
378,Kexholm,0714_0717,ns Behm det han den 4de Septbr. haar uti hans krogh opå Sijkaniemi komit kl. 7. om affta och begärt köpa öhl då han berättat at samma krogh eij wore någon ärlig karls utan een såled krogh anhållandes att
379,Kexholm,0724_0727,"tt _ 56 Anders Pirhoin och Erich Casalain före draga det dee een gårdh uth deras inqwartering folck köpt _ _ 13. Anders Nattri meddeles bewijk om sitt hemmans befruuk, 14. Anders Pirhoin emoth Johan Stre"
380,Kexholm,0724_0727, 5. Johan Skröder förunnes Burskaph _ _ 5. Johan Johan Skröder opbiuder 1sta gången een gårdden han köpt 6 Johan Skröder opbiuder andra gången sin köpste gårdh 14 Möllnare Jacob Hamunens och Anders Mårte
381,Kexholm,0724_0727,n Johan Skröder opbiuder 1sta gången een gårdden han köpt 6 Johan Skröder opbiuder andra gången sin köpste gårdh 14 Möllnare Jacob Hamunens och Anders Mårtensons betygan om Cronans qwarn Tull 15 Jacob Gr
382,Kexholm,0728_0731,"Wijdare sade For- mann att hon fåldt Under deras Frijern sin 3. sin kettel, kläder och ibland sielf köpt öhl och ibland gifwit honom pennin- gar till Öhlköpande Anna till- stodh att hon ibland köpt öhl o"
383,Kexholm,0728_0731, sielf köpt öhl och ibland gifwit honom pennin- gar till Öhlköpande Anna till- stodh att hon ibland köpt öhl och brann wijn. Och huru han tänckte besinna sigh /: sade han :/ sedan dottrens bref kom att ö
384,Kexholm,0731_0734,12 öre Sm:t Rättegångs Expenser Peter Pirhoin berättade sigh af handelsman i Nyen Wähl:t hans Polke köpt till sin mors booställe hans gårdh opå Sijkaniemij som Cnut Hannukain för gäld honom lagl. opdragi
385,Kexholm,0731_0734,"ander måtte een annan i stället opbyggia eller medh peningar dess wärde förnöija Nylander sade sigh köpt af hamukain samma Cammare, Men som Peter medh Hendrich Silwoses och Jörans Ruckolais edelige intyg"
386,Kexholm,0758_0761,"nar inlagdt hafwer, som sielfwa Contractet der öf:r fattat wijdlyfftigare förmäler. Och såsom bemte kööp är 3 gångor lagl: oplijst och sedermera öf.r Lagens determinerande tijd stådt oklandrat. Så anhölte"
387,Kexholm,0758_0761,dermera öf.r Lagens determinerande tijd stådt oklandrat. Så anhölte bemte Frantz Johanson att detta kööp medh laga Skötning och fasta måtte Erfwingarne framdeles till effter 33. till effterrättelse blifwa
388,Kexholm,0758_0761,måtte Erfwingarne framdeles till effter 33. till effterrättelse blifwa Confirmerat; Så emedan samma kööp är första gången opbudit d 16: Junij andra gången den 30. dito och 3die gånnen den 7: Julij och nu 
389,Kexholm,0758_0761,"ens ehnhälle- lige samtyckio bewillies och gifwes härmedh Handelsman Frantz Johanson effter sielfwa köpebrefwetz, och det 6. Cap:l Jord B. Stth. inne- håld härå Laga Fasta och Skötning således att ofwanb"
390,Kexholm,0763_0766,"l Feldskären Palmgröön 34. 37. F Handelsman Frantz Johanson anhåller om stadfästelse öf:r ett gårde kiöp, som honom meddeles _ _ 32 H el. Hindrich Michelsons Erfwingar om arf emoot hwar andra - - - ~ - - "
391,Kexholm,0769_0772,"hristal glaset, hwarest och Förekonen blifwit öf:r natten med sin häst och warit eense om ett Moras köp för 9 D:r Kmt: och sade hon att dhe om dagen tillförenne hafwa fört den 1/2 Tå korn sampt Malt som "
392,Kexholm,0769_0772," förkönen med hans häst då och annicka fölgdt medh på Sijka- niemi på slädan, som hoon berättar att köpa ligg och samma affton äre dhe komne tillsammans tillbaka i staden då Horkonen som förr sagdt är bl"
393,Kexholm,0771_0774,"t afföra dee gamble huus opå Staffan Mervins tompt stå bygde, emedan Christer, eij kan bewijssa sig köpt kompten af henwi, som han berättar. Brusius Mattsson pålades att skaffa Unu- kåski Smeden till Sol"
394,Kexholm,0773_0776, Pirhoin fälles för Snattare boot till 6 öre Smt: och Skinnaren Lars Sallinen hwilcken samma Swartz köpt för 6 öre och hafft i behåll erkiennes för någon beskyllning om Tiufnadz dölliande frij emedan Sål
395,Kexholm,0783_0786,er Jäskeläin nar uti Rijka hambnen för 4. åhr sedan berättat för honom att han fick för ringa wärde köpa opå Sijkaniemi gatan een godh myssa af Sammet och Sabelains swantzar Nembl:n för 1. Lisspund Smör¬
396,Kexholm,0786_0789,"deles på det enahanda Wilkt må hoos war och een blifwa befordrat, och rarnehanda flärd och irring i kiöp och alliande sålunda hindras och aftrytas. Ao 1693. d 26 Juny blef hållit Ordinarie Rådstugudagh, N"
397,Kexholm,0788_0791,nteressenter hwilcka wellat Stadzsens boskaph på Manderennie- my sijdan skola för det dee släpt bo- köpen å Klåckarens Engh ehuruwähl den war wähl igenstängd och medh uggill gärdzlegårdh hägnadt. och den
398,Kexholm,0796_0799,oböter 14. L. Lars Sallinen C. Cnut Hamundain om åkerdrogh 11. Lars Sallinens Confirmation om Moras Kiöp _ _ _ 14.
399,Kexholm,0815_0818,"ra tager sin häst igen, emedan bonden Bertil Parti effter aflagdh Edh betygade dhe Conditioner wedh kiöpet wara dem både förbehåldne att dher dhe finna något feel å någondera sijdan skulle byte åthergå hw"
400,Kexholm,0817_0820,äggia Slachtaren sitt igen laga Slachtan sade sade sigh eij weta om något feel wilcken han af Simon köpt. Ruini erbödz Eeden
401,Kexholm,0818_0821,"stro att hon berättadt för honom det samma qwijga huar hafft det folat enär Slachta ren af Ruin den köpt, blifwer altså detta ähr det till bem:te Pantanas hustros ankomst nå¬ kommande nästkomande Måndågh"
402,Kexholm,0818_0821,"al. Baggen Enckia dygdesmma Catharina Reijer för 230 d.r Kmt: Och emedhan hon dhe i deras oprättade Köpebreef föresatte betalningz terminer eij fullgiordt, utan med förnöijande inne hållit Enckian och ei"
403,Kexholm,0819_0822,n hans Åker widh Sikaniemi belägen för 40 D:r Km:t och anhölte det Rätten till detta deras ingångne kööp wille sitt samtyckio dertil gifwa och köpet Lagl. Confirmera; Så emedan Smte Ollkonen eij kan Stadz
404,Kexholm,0819_0822,:r Km:t och anhölte det Rätten till detta deras ingångne kööp wille sitt samtyckio dertil gifwa och köpet Lagl. Confirmera; Så emedan Smte Ollkonen eij kan Stadzens Rätt för bemte åker oppehålla som af t
405,Kexholm,0834_0837,tte Sölfkanna och 2. Gullringar an Lagbundne och jembwähl Engståndne hafwandes han i så måtte den i Köpm. B:n St:l. 7. Cap. De terminerade tijdh till bem:te Panters inlösa för- hunnet ehuruwähl honom är 
406,Kexholm,0835_0838,"ieur wore aldeles härutinnan osyldigh emedhan han Koppar Ringen af een annan uthi sin af Gromolieur köpte Gullring omröplade af Wälb. Jungfru Helena Gyllenspångh bekommit, som han sedermehra fådt förnimm"
407,Kexholm,0838_0841,rudh wista emoth Jacob Jacob¬ som åjala om slagzmåhl 4.  J. Johan Meroin opsäijer sitt giorde Gårde Kiöps medh Catharina Reyer 3.  Johan Muhonen aflägger sin borgare Eedh 4.  Jonas Sigfredsons angifwde om
408,Kexholm,0844_0847,"in Rådstugudag Närwarande Wahnl. Borgmestare och Rådh. Handelsman Wähltt Frantz Johan sin inlade ej Köpebref emellan honom och S:r Jacob Gröön de 24 Febr: nästledne grättat, hwar uthinnan be- Gröön opdra"
409,Kexholm,0844_0847,"ningar han och allaredo till fullo nöije bekommit och fördhenskuldh anhölt att detta deras ingångne köpmåtte blifwa ad acta publica annoterat hwilcket och effter begäran skedde, Och blef bem:te Köp 1sta "
410,Kexholm,0844_0847,"ångne köpmåtte blifwa ad acta publica annoterat hwilcket och effter begäran skedde, Och blef bem:te Köp 1sta gången opbudet hwaremoot, eij skedde något klander eller insprååk. Handels man Wähl:t Frantz J"
411,Kexholm,0844_0847,"wast måtte obligeras hästen igentaga; Silwast hade hästen wara godh och att heutonen frij wil- ligt kööp medh honom ingått, och emedan Rätten wedh närmare undersökiande befinner det Silwast af heatanens d"
412,Kexholm,0844_0847,"ärmare undersökiande befinner det Silwast af heatanens dryckesmodh tagit tillfälle honom till detta kööp förleda, hwil¬ t så myckit skäligare böör åthergånga som han hästen emoot sitt bättre wetande för y"
413,Kexholm,0844_0847,st¬ marcknader honom bedragit och förfördelat dij dömmes Silwast hästen igentaga och heutonen dhe å köpet undfångne 12 D:r Km:t restituerer jemwähl och dhe lijkmätigt Kongl. Taxa anwände Rättegångz expen
414,Kexholm,0846_0849,l Kparnes prätt hållande någon handel begynna och fortsättia warandes sålunda handelen ingången uti köpande och hälliande till tryck och förfång hoos någre fun allenast in dij haar Rätten funnit saligt p
415,Kexholm,0847_0850,e:) till den tompt han nu besitter och derföre till fullo nöije erlagdt 477 D 16 /: Kmt som sielfwa Kiöpebrefwet Daterat Kexholm den 24. nästledne Febr. det wijdlyfftigare förmäler och såsom bem:te Croen 
416,Kexholm,0847_0850,handelsman att detta krog medh laga skötn sig och fasta måtte con- firmeras. Altså och emedan detta kööp är tillföllie af det 1. Cap: i Jorde: Bn St. blefwet första gången lagbuds den 7. nästledne Martij 
417,Kexholm,0850_0853,", Närwarande Wehnl: Borgmestare och Rådh. Häradzskrifwaren Wälbem:de Carl Helenius inlefwererade tt köpe breef Daterat Kexholm den 27 July näst¬ ledne oprättat emellan honom och Borgaren Olof Huvinen ang"
418,Kexholm,0850_0853," hwilcka ningar han allareda opburit och annamat och fördenskuldh anhölte det bem:te deras ingångne kiöp måtte blifwa lagl. Annoterat, hwilcket och här medh edde och wedh första opbudet hans ingen som här"
419,Kexholm,0852_0855,die resan opbudit häradzskrifwarens Wälbetde Carl Helenij medh borgaren Olof Auvinen ingångne gårdz kööp och skedde här emoot ey något klandera Rådhman 12. Rådhmannen Anders Pirhoin beswärade sigh öfwer b
420,Kexholm,0853_0856,af det 6. Cap. Jorda B:n Sölf innehåld gifwes å bem:te gård här medh Laga Skötningh och fasta så at köparen bem:te Hr Erich med sin hustro och Erfwingar bem:te gård såsom deras rätta flinge och wählfångn
421,Kexholm,0855_0858,Och emedan bem:te Arrendator förmedelst sitt ingångne kiöp emoot dhe allaredo opburne 100de En km:t hwar sigh och sine Erfwingar bem:te gårdt aldeles afhändt 
422,Kexholm,0855_0858,at; Och emedan betalning terminerne äre längst skredne till ända. dömmes Cautionisterne arg: Cap: i köpm B. Sal. bemte 30. Dr. Kmt förnöija; och söka dhe bonden på wederbörligh orth och ställe igen som b
423,Kexholm,0855_0858,f- betalning opdragit hafwandes dhe blifwit eense p ården för 42. Dr Kmt. Och anhölte att detta was kööp måtte blifwa lagl. annsterat hwil- ket och effter begäran skedde. Rådhman Bertill Bollijn beswärade
424,Kexholm,0856_0859,som han å 3 1/2. RDr in specie af Köpman La Croij 692 om hösten sigh tillhandlat och gifwit bemte handz man i nästwärdning att låta repar
425,Kexholm,0859_0862, E. der Jordawallaboor om bortkomen Sp: 7: 8. 9. Carl Helenius låter inprotocollera ett giort gårde kiöp medh Olof Aufwinen _ _ _ 10. 11 Carl Printz E. Johan Artlander om skuldh - - - 16. E. Erich Hiquinu
426,Kexholm,0859_0862,ntz E. Johan Artlander om skuldh - - - 16. E. Erich Hiquinus meddeles Confirmation öf:bbr ett gärde Kiöp _ 13 Erich Anderson E. Lars Gustafsson om 1 t:a Rågh _ _ 15. H. Erich Stiguinus L. Lars Gustafson o
427,Kexholm,0859_0862, Jacob Gröön dömes stadig och fast 6 M:r Fredrich Pulsboop medgäles Confirmation opå at giordt gård kiöpe 14 Capit Fabian F: Gyllen Spång L. Hans Sutthoff om een Peruque _ _ 15 H. Sal. h. Hendrich Boisman
428,Kexholm,0859_0862, - 1: 2: Ingredh Sichvonen dömes för Barnemord _ _ _ 2 - Jacob heutonen E. Samuel Silfwast om häste köp - - 4. Johan Pasanen erkennes ledigh och fri för gäldh - - 5: Johan Antikain bewillies een gårdz wä
429,Kexholm,0901_0904,"r och Emedan Jonas eij hade något kähligdt at inwända, dij dömbdes Jonas Lyt¬ mätigdt sitt ingångne kööp förnöija huchta 12 D:r Km:t medh 5 D.r 21 ö: Dito myntt anwände Rättegångs Expenser./. Fälltwählens"
430,Kexholm,0903_0906,"e rättigheet uti hemmanet Joensuu försåldt :/ effter wälbem:te skriftel. immission till hans effter kiöp och arf, rätt tilförande possession uti hemmanet, det han och hans förfäder i åthskillige åhr ordba"
431,Kexholm,0904_0907,"der nyttiat och brukat; Men såsom danska nu icke kunde, detta sitt angifwande, at hem:t skall genom kiöp wara i förståne hans förfäder tillfallit, med witnen bewijsa, utan låfwade till näste Rådstugu dag "
432,Kexholm,0904_0907," till berörde hem:r af krom- ledne Henrich douskas Swärfader skall 3. Aug: A. 1697. i förståne wara kiöpt af een Mårten ""Mår- wo ben:d för 1 koo, ½ tun:a Råg, ½ tumå hafwa, 2 st. fåhr och Ett Swijn, hwilk"
433,Kexholm,0905_0908,"hafwer förmådt sigh Högachtat H:r Häradzhöfdingens inrymningz Skriff till Salo heckis Söners effter kiöp och arfwäll tilhörande Rättigheet utj hemmanet i Salo Pu¬ steis belägit, effter druskas Söner wore "
434,Kexholm,0906_0909,"afhändas, eller på något sätt förderfwas, ty förkla rar Rätten det böör Lewoska, effter dett 5 Cap: Köpmtß Stadz. skadan med 25 dalr 16: Kmt. åthergilla, sampt i Expenser effter Kgl. Maij:tt eller nådigs"
435,Kexholm,0908_0911,", som Ruotzalainen såldt till berörde Rysse, är fallen hoos Bonden Karpinen, sampt sedermehra genom kiöp wara kommen in manu tertio, till Ryssen, weta och Rådmannen, Florentz Ahlholm h Aug: Pirhonen, att "
436,Kexholm,0910_0913," Rådman så- dant, såsom ett depositum, in natura ehrsättia gh åtherlefwerera, effter det 5 Cap: §1. Kiöpm. B. St. warandes Rådmannen der hoos frij för all wijdare åtahl af dhe 11 tun:r reslart Rågh och de"
437,Kexholm,0911_0914," en Mun- effter det förestafwade finska formularet, det ber:de nu härwarande häst, som Ruotzalainen kiöpt från Pirhoses Enckia och sedan försåldt till Ryssen Andru¬ ska, som färdel. är den samma, som hoos"
438,Kexholm,0913_0916,"sedan han stulit, gådt till Corpral:s hustru, låtit der- sammastädes hempta åth sig twå kannor öhl- kiöpt bröd och frijst sig hafwa penning? hwilka hustrun räcknadt sampt kiöpt Spännet af henne, begärande"
439,Kexholm,0913_0916,"mpta åth sig twå kannor öhl- kiöpt bröd och frijst sig hafwa penning? hwilka hustrun räcknadt sampt kiöpt Spännet af henne, begärandes Constabt, at effter som han bekommit Spennet såsom wedermäle utaf hen"
440,Kexholm,0913_0916," som han bekommit Spennet såsom wedermäle utaf henne, hon må blifwa ansedder, för den, som wetandes kiöpt tiufwegodz, sampt hyst tiufwen uti sitt huus. Hustrun bejakade det hon fuller räcknat peng:r som w"
441,Kexholm,0913_0916,"trun bejakade det hon fuller räcknat peng:r som warit ongefehr 7 D:r Kopp:mt såldt henne bröd sampt kiöptSpennet, hwilket spänne hon sedermehra gifwit Constabeln igen, sedan han wiste at det warit ifrån h"
442,Kexholm,0914_0917,"ll, sig haf:a fådt af Ryssar. Soldaten Petter Saickonen som är inqvarterat hoos bem:te Corporal och kiöpt drickat åth konan bekände det Corporal håstuns Execulpation wore aldeles samfärdig Rätten gaf hust"
443,Kexholm,0914_0917,"hela Staaden klagel. måst samtyckia och bekänna, det ingen Spanmåhl här i Staden är till fång eller kiöps, och der icke Gud nådel. beweker öfwerheetens hierta till missundsamheet emoot Kongl. m:tz Underså"
