,parent,file,context
223,Kexholm,0384_0386,"he wore i aftons komne till- Possmästewaken at fråga efter braaf, och efter dhee funno der för sigh Kiöpmannen nembl:n Huuken derföre drögde dhes der något lijtet, men hade sagdt der hoos, wij willia full"
224,Kexholm,0386_0388,"e sigh öfwer Johan skonen, att han hade Caverat för sin farbrors Sohn Thomas och konan för et häste kiöp, hwar oppå resterade 46 D:r 19 öre Kopp:r M:t begia des nu at komma till sin betalning, efter denna"
225,Kexholm,0387_0389,"tterliget, at hoos D:r Jochim Gardling skall uti denne Sommar altijdh funns Compagnies Tobaak, till kiöps, så at det aldrig hafwer warit uthan, uthi funnitz der ofeelbart till kiöps: Inspectoren Swen Stil"
226,Kexholm,0387_0389,"Compagnies Tobaak, till kiöps, så at det aldrig hafwer warit uthan, uthi funnitz der ofeelbart till kiöps: Inspectoren Swen Stille framkom och berättadhe at han åthskillige reesor hafwer i denne Sommar gi"
227,Kexholm,0387_0389," han waar i qvarteer hoos D:r Jochim Bard- ling, och sade, at den gången hade warit Tobaak der till kiöps, men om det skulle warit Compagnies Stad? der om hade han icke någon weetskap, effter det honom ic"
228,Kexholm,0387_0389,"e der Eres, at Hecke Sutars Måg, hadhe warit till 2 D:r barn på Gardlingens wägnar, at hade williat kiöpa Tobek- Men då der intet bekommit, efter der då skulle intet warit Tobrak till kiöps. Säger och den"
229,Kexholm,0387_0389,"at hade williat kiöpa Tobek- Men då der intet bekommit, efter der då skulle intet warit Tobrak till kiöps. Säger och denne Elias, at han hade sändt samma gång någre halßdukar till sin Swåger, som der hoos"
230,Kexholm,0388_0390,"gången intet Toback warit till kiöp, men säger sigh der¬ på willia giöra sin Eedh at han intit, annat här wedh än det haar warit Compag"
231,Kexholm,0388_0390,"nen hwilcken uti Eedstadh bekiende, att han Något lijtet effter Påska war här i Staden, och söck at kiöpa Tobaak, då hon icke een pijpa kunde få till kiel i heela Staden war och in för Gärdlingenspart och"
232,Kexholm,0388_0390,"ch in för Gärdlingenspart och wå inga, Men folcke hade Mött honom och sagdt at intet book fans till kiöps, der oppå han wille giöra sin Eedh det behöfwes, emot denne exciperade Eskill intet allrat Dito fr"
233,Kexholm,0388_0390,"dh Noota, hwilcken be- kiände sigh Någre dagar efter Johannis tijdh warit hoos Härdlingen at willia kiöpt Tobaak, men då de gången intet kunnat något Tobrak fåå, och hade ho- lingen sagdt honom sielf, at "
234,Kexholm,0388_0390,"orgare Johan Olofßon Mttika, affta Bonde Johan Pärsises dreng ifrån Pyhäjerfwj hadhe sändt honom at kiöpa Toba och, hwilcket skedde i första höötijde då han intet Tokaake hadhe fådt till kiöpz, der oppå h"
235,Kexholm,0388_0390,"ndt honom at kiöpa Toba och, hwilcket skedde i första höötijde då han intet Tokaake hadhe fådt till kiöpz, der oppå hans wille afläggia sin Eedh. Emot denna hade intet eller Eskill at Excipera. Dito bekie"
236,Kexholm,0388_0390," Dito bekiende Borgaren Christer Matzson Pohikonen at han ho- warit i höö tijden hoos Gärdlingen at kiöpa Tobaak, då Gårdz honom skall swarat sigh intet Toback hafwa, der oppå 28m han giöra sin Eedh, emot"
237,Kexholm,0388_0390,"nadhe at han hade war hoos Bordlingen, då han skatte reesa på sine hööslagh, och begiärte at willig köpa Tobaak, då Gärdlingen skall swarat, sigh intet Tobaak hafft, der oppå han wille giöra sin Ebodh. e"
238,Kexholm,0388_0390,"eks ifrån Hapalax och be- kende sigh warit 2 gånger i denne Sommar här i Staden Kexholm och williat kiöpa Tobrak, men hadhe intet fådt, och detta hade warit mit utj höötijden; och när han hade för skickat"
239,Kexholm,0388_0390,"fwit honom uti Jeremias Michil sons Stu då H:r Pijkwell hade warit der till Måltijdz; och at det är kiöpt af Gardlingen Dito begierte Eskill Thomaßon, at Hendrich käydi skulle bewisa honom at Eskills hust"
240,Kexholm,0391_0393,"tten Capitein Peter Spång, och beswärade sig öfwer en Glaaßmä- Stare Peter Anderßon 5. Att han hade köpt af honom en häst å 30 Dr Km:tt och behållit hästen hoos sig i 12 dagar, och sådan uthan lag och Rä"
241,Kexholm,0391_0393,"befinnes, att Magßmästare Peter Anderßon, sade at sielf berådhe mod gångit till Capitein och giordt köp om häst å 30 Dr kmt och sädan afel. 12 dagars förlopp uthan lag och rätt skutit hästen ifrån sig oc"
242,Kexholm,0395_0397,"nnorledes öhl för såldt ähn af Staden är förelagt, dy felles han till sijda 3 aff ähr det 19 Cap: I Köpmål. B. Stl. D 4 Aprilis wed ord: Rådstugudag närwa- rande Borgmester och Rådh Sannergång fram kommo"
243,Kexholm,0400_0402,"och werderades b:te gamble Kopparbettel å 1 Dr m:r, och stunde 8 dagar, osåldt effter dett 10 Cap i Köpmål B Framkom för Rätten Advocaten Erich Rielmen och gaf tillkänna, huruledes för hoppman, Simon Ört"
244,Kexholm,0401_0403,"tt han der tillåtter köre Jeremias Michellßon wittnade med oppgifwin Eedh, att han hade hördt deras köpslugan; och sade der hafwa hördt ett Cnut Matzon hade förwisso ifwat honom 3 t:r Salt, men den fierd"
245,Kexholm,0401_0403,"finnes att Cnut Matzon Melikäin haf:r lagl:n giordt löp med Borgaren Hans Behan ty dömmes Cnut sitt köp att framhålla, nämbl hwar till hans 3 mk sökt, sampt betala 5 mk pgr förbo"
246,Kexholm,0402_0404,"s 22 tillbakas, som Hans till legotarlen hafwer gifwit som effter Cnut drog, erfr det 1 Cap i Köpmål B. Å 30 Maij wed Ordikådstugudare, närwarande Cronones Befallningzman Nilß Olufson Printz I Wäll"
247,Kexholm,0410_0412,"n, Leutzempten Johan Casson Palm och beswärade sig öfwer en borgare Son Ante Walkonen b:d som skall köpt en kettel af en Soldat Peter Heiskanen b: den han af Leut- nampten hafwer stulit; säger och, att h"
248,Kexholm,0410_0412,det. Men Leutnampten bekänner sig hafwa sendt effter hans Moder och frågat om hon hade någon kettel köpt af Bildaten Peter Heiskanen? der till hon swarat att hennes Son hafwa köpt en kettell denne Annte 
249,Kexholm,0410_0412,"om hon hade någon kettel köpt af Bildaten Peter Heiskanen? der till hon swarat att hennes Son hafwa köpt en kettell denne Annte begiärar förlåtelse, effter han intet har weetat, att dett war någon stulen"
250,Kexholm,0410_0412," denne saken stit till effterfölljande Sentens. Emäden såsom befinnes att denne Anna wällkonen hafr köpt om Koppar kettel om 4 Dr af en Soldat Peter Heiskanen den han hoos Leut nampen Johan Claßon talm, "
251,Kexholm,0410_0412,"t igen af Soldaten soldaten som bäst hon giter. Men såso han sig intet bättre hafwer försedt, uthan köpslagat med en tiuff; ty skall han derföre blifwa uthi  stadzens gömo, uthi twå dygn, lijkmätigt dett"
252,Kexholm,0414_0416,"l. Maij:tz wägnar, så wäll som H:s Excell: H Gen: Gouverneurens Ordre att Borgerskapet skulle ingen köpenskap drijke thom Staden uthan låta alt hwad fralt och till Sa- kommer, till ordinarium Collegem, s"
253,Kexholm,0417_0419,"Km:tt begiärte att kunna komma till sin betallning. Smeden tillstår gielden, men säger att han hade köpt af Ryssen tobak, och hwilket Tobak besökiareff till Thomaßon hafwer tagit 2 willar, säijandes wari"
254,Kexholm,0422_0424,"on sin broder Påwel Påwelson att han skall honom med åtskillige skul- ord öfrfallit förmedelst, för köp skull, som Påwel skall giordt hoos Amptman Oluff Pärson, Nämbl Nämbl. Skiälm och Tiuff i dett han s"
255,Kexholm,0423_0425,"örsåldh till Anders Rätty I Nyen, hwilken med tillbudin Eedh bekände, att Anders Rätten hafr giordt köp med Samuel 1 ℔ Smör à 4 Dr 4 öre Km:tt hwilket Samuel till betygh meddeeltes. Tilstodh och bonden, "
256,Kexholm,0423_0425,"h och bonden, och Soldaten Peter Simonson lef- noska hade och warit samma gång tillstädes, när etta köpet slötz. d. 2 Juni wedh ord: Rådstugudagh närwarande, på Wällb:ne Hr Landzhöfdingens wägnar Räntmäs"
257,Kexholm,0424_0426,"lstodh och att ha- muel hafr, hållit hans hustro med weed, och wärne Grelßes hustro sade, sig hafwa köpt åth sig sielf weed der till Samuel swarade: att när hon brygde och brände, så köpte hon åth sig we"
258,Kexholm,0424_0426," sade, sig hafwa köpt åth sig sielf weed der till Samuel swarade: att när hon brygde och brände, så köpte hon åth sig werd, men intet eller Dito producerade Samuel ett annatillatne, Nämbd Johan Matzon ju"
259,Kexholm,0426_0428,"n Johansson, för et han hade visiterat Constabelens Mårten Andersons Tyskick, sade och att dee hade köpt öhl opå krogen emot förbud. Postmästaren, så wäll som Anders Pärson Bagge kunde här till icke neka"
260,Kexholm,0428_0430, till Rättens förloff Resolutio Emädan som man intet hinder hafwa förspordte som kan förhindra dett köpet att Wäsgifrå ju tid sig handla Jacob Erichssons Tompt; altså effter låtes Wasili Lyki samma köp f
261,Kexholm,0428_0430,t köpet att Wäsgifrå ju tid sig handla Jacob Erichssons Tompt; altså effter låtes Wasili Lyki samma köp framhålla öth hans här med af Rätten lof gifwes der till; och stånde an den så länge osåldt som lag
262,Kexholm,0428_0430,"ag närwarande Borg- mäster och Rådh. Dhe lofwades Borgaren Wasil Lyki Stadzens fästa öfr dett gårdz köpet han giorde med Jacob N.o 47 Erichsson under fougden Wittnade Rådmannen, Erich Simonsson, Hans Hin"
263,Kexholm,0431_0433,"förmäles; Ty ehr tänner Rätt för skiäligt att Samuel samma gield betalar, lijka mätigt det 8 Cap: I Köpm: B. StL. och söke sitt igen af sin Swärfader, som bäst han giter. Men för dett Samuel badh att Rät"
264,Kexholm,0435_0437,"g, at hade han alle nast Soldt der af för 4 örehm:t och hållit derföre att han hade fådt undertijde köpt sig nu Cappa Spanmål, till oppehålle, och hade instå 45"
265,Kexholm,0440_0442,"mot hinrich Hinrichßon p. 9. N. 17. Publicerades wällborne H:r Landzhöfdingens befallningh om olaga köp, om olagligit krögerij, och om Borgerskap petz inflyttiande I Befästningen, och annat mehr. p. 2. N"
266,Kexholm,0451_0453," att Samuel hade warit tilstädes såsom witne, när som Eskill Pirhoin hade af denne Dawidz huußbonde köpt dhet Landh som Dawidh hade under sigh; och effter Samuels nampn wore i samma Contract, dherföre dr"
267,Kexholm,0451_0453,"dskap. Hätt opå Dawidh swarade sig wilia giöra sin Edh, att han aldrig wetat Så- muel warit i samma kööp, förr än Samuel nu sielf bekiänner; och hafwer altså ingen owän¬ skap wetat uthaf, och hafwer dhes "
268,Kexholm,0453_0455,"atens Jacob Kackarains hustro, Caisa Pedersdotter honom hade gifwit opå dhen koon, som han af henne köpt hafwer, war inneslutit uti dhet sam- ma kooköpet, neml. dhe 16. D:r Kmt:, effter Påfwel elin intet"
269,Kexholm,0453_0455,"n intet wille koon behålla för hennes odygd skull medh mindre denne Caisa skulle kettelen gifwa opå köpet; Och ehuruwäll Rätten tilbödh hustru att afläggia sin edh, att kettelen icke wore in räknadt i ki"
270,Kexholm,0453_0455,"öpet; Och ehuruwäll Rätten tilbödh hustru att afläggia sin edh, att kettelen icke wore in räknadt i kiöpet, så wille hon dhet doch intet giöra uthan skööt Edhen till Påfwel Påwelsson; hwarfö- re han och d"
271,Kexholm,0453_0455,dhet doch intet giöra uthan skööt Edhen till Påfwel Påwelsson; hwarfö- re han och dömdes fast wijdh köpet effter det 1 Cap- i Köpmåhla B: St. L: Den 16. Septembris wedh ordinarie Rådstugu dagh; Närwarand
272,Kexholm,0453_0455,n skööt Edhen till Påfwel Påwelsson; hwarfö- re han och dömdes fast wijdh köpet effter det 1 Cap- i Köpmåhla B: St. L: Den 16. Septembris wedh ordinarie Rådstugu dagh; Närwarande Borgmästare och Rådh. wä
273,Kexholm,0458_0460,"fradht 4 D:r Knt: Begierandes han wille för dee pgr: han för hudarne och dwilken kunde bekomma, och köpa derföre Salt; Ahnhållandes nu att kommit sin sin betallning, med des interesse och Expenser."
274,Kexholm,0467_0469,"k och stark dett i sin byxesäck, då hade hustrun frågat hwar till behöfr du dett Sölfröret? will du köpa ähl derfö- R. Neij, jag behöfer till något annat Sädan hafr Oluff begiärt af henne ett stoop öhl, "
275,Kexholm,0469_0471,å hade inlöst bresken som derstodh för ett Lepparmunstycke och togh en Capparoug uthur sin säck och köpte sig en kanna och derföre åth sig och b:te Borgare; sädan hafr Glaßmästaren Peter Anderson inkommi
276,Kexholm,0469_0471,"sädan hafr Glaßmästaren Peter Anderson inkommit och druckit med honom då han åther en kann öhl hafr köpt, och der effter hafr han begynt att willia reesa, då Gloßmästarens hust: tillijka med Glaßmästaren"
277,Kexholm,0471_0473,"kanna öhl och war effter inne wall nu god tymme, och när han kom till ka, hafr Glasmästarens hustro köptfisk och Rök, och gifwit Oluff mant och åthi sielf medh samma maat; och när der hade åthit inkom Co"
278,Kexholm,0482_0484,"Pirrhonen effter sine Sal. föräldrar, som M:r Hinrich Pirssonßes förwar hwar med han nu i månge åhr köpslagat, såsom förr mach befinnes; sampt lijkmätigt dett och skeedh som d 1 feb: emellan dem giordt, "
279,Kexholm,0487_0489,"de för ijsen, att blifwa fruser Säger sig hinrich Prichoinen ingen Profyt hafwa ett af dher Nyanske köpmans hudar hans n Erkia öfr förde, uthan der Johan will söka dem någon Profijt, så står honom frijdt"
280,Kexholm,0495_0497,"ntitet Skp, som ungefähr war i halftridie hundrade t: med hwilka pgr Salt- h Spec: Hinrich altsådan köpslagat och giordt sin rotijt, och icke wijst Johan hwad nytta han der af bekommit, hwilket gaf orsak"
281,Kexholm,0498_0500,"taren Jacit: Jönson, sampt Borgmester och Rådh. Publicerades, att ingen skulle understå sig nå- got köp att drijfwa opå hakelwärket, wedh 40 mk:r straff, sampt wahrans Confiscation Dito, förwijder som kö"
282,Kexholm,0498_0500,"öp att drijfwa opå hakelwärket, wedh 40 mk:r straff, sampt wahrans Confiscation Dito, förwijder som köpmän äro, effter Öfwer heetenas ordre sig in uthi Staden begyhra och här byggia"
283,Kexholm,0502_0504,icerat om Norßfysket i Pärnönström som så strijdes ährligen om p. 43. N. 23. Publicerades att intet köp skulle drij sees i förstaden p. 81. N. 39. Japhan Segherson emot Erich Perssonen p. 83. N. 42. Stap
284,Kexholm,0505_0507,"temestaren Zachris Jonson sampt Borgmestaren Gabriel Hinnel Rådmanen Hindrich Mickelsson, och desse Kiöpman i Råd¬ mennens ställe, hwilke och domare Eedh afdade. Nembl:n Wasili, och Elias Påhlsson Inkom R"
285,Kexholm,0505_0507,Polankenhagen tillsporde Eskill om han åke hade befalt honom upläggia samma hudar i Stockholm es en kiöpman Johan prot Johan bew:d dher han icke skulle dem fåförsan Rp: Att Blankenhagen det intet giort; m
286,Kexholm,0505_0507," dem fåförsan Rp: Att Blankenhagen det intet giort; men han Lijckwist af egit bewåg gådt till samma Kiöpman, effter Eskill och war känt medh honom, och begiärt at han wille samma hinder emottaga, Men samm"
287,Kexholm,0505_0507,"n, effter Eskill och war känt medh honom, och begiärt at han wille samma hinder emottaga, Men samma kiöpman dhet intet welat giöra, ker han Blankenhagens skrifwelse dher om intet hade sade Löskeräst dher "
288,Kexholm,0506_0508,"et ty hon läkte öfwermåttan i om Luckelain hade sedt, om nå¬ gra kiärmän wore i Stockholm som wille kiöpa hudarne? Rp. att nog sågh han att dher wore dhe som wille kiöpa, men intet wiste han något kiöp el"
289,Kexholm,0506_0508," kiärmän wore i Stockholm som wille kiöpa hudarne? Rp. att nog sågh han att dher wore dhe som wille kiöpa, men intet wiste han något kiöp eller wärde på hudarne; effter sådant intet war om om befalt, Sadh"
290,Kexholm,0506_0508,"le kiöpa hudarne? Rp. att nog sågh han att dher wore dhe som wille kiöpa, men intet wiste han något kiöp eller wärde på hudarne; effter sådant intet war om om befalt, Sadhe och att skill hade icke öfwer 3"
291,Kexholm,0508_0510,l skall Sönnan och Anders Pirhonen förnekat at reesa. Tillspordes Jöran Päßi om han hade sedt någre kiöpne i Stockholm som wille kiöpa af Eskill dhe starkade hustar? Re¬ han hade wäll sedt der gådt: men w
292,Kexholm,0508_0510,honen förnekat at reesa. Tillspordes Jöran Päßi om han hade sedt någre kiöpne i Stockholm som wille kiöpa af Eskill dhe starkade hustar? Re¬ han hade wäll sedt der gådt: men wiste intet huru dhe förlijka 
293,Kexholm,0509_0511,"så högdt som han hade kunnat effter henne intet för war föresatt ut ex Actis, eller dem oplagt hoos Kiöpmannen Johan Broot Johan, och intet emot ordre brackt dhen tillbaka 8:do Gifwer skill Pirhonen Styrm"
294,Kexholm,0509_0511," Pirhonen, medh hwilken han uthi ett brödh ähr, sampt och Eskill har warit sin faders fullmäcktig i kiöphandelen föruthan dhet af dhe dhe hafwa samma hande, och att fadren hafwer Lijkmätig Cämners Rättens"
295,Kexholm,0509_0511,"samma giäld bundit; effter den som går i Båggen, han går och i betallning, Lijkmätigt dett 8 Cap: i kiöpmåhla B: Stl. och 97 Cap: Rådstugu B. oach stånde Eskill Piiho¬ nen wijdare öpet at sökia af Styrman"
296,Kexholm,0511_0513,"n Erich Koonen Hindrichson, att han war honom skyldigh 3 lb norss å 10 m:r koppwi Lisspundet; såsom kiöpet hafwer warit i Stockholm, och såsom han honom nu i 2 åhr oppehållit hafwer, will han altså blifwa"
297,Kexholm,0513_0515,kulle dhet uphugga och då Leutnamptssen sielfgare stadd wedh Wijssöhl wille hon och dem sådant uppå kiöpet gifwa och icke låfwat dhen någon om math eller kåst under arbetz tijden; och mehra wijst henne in
298,Kexholm,0513_0515,"er deelen be¬ tahlningen, uppå handen annammat föruthan en h:r fäste penning; Altså dömes dhem sitt kiöp att framhålla och sam lägning effterlåfwen att fullborda effter 1 Cap: i Kiöpmåhl B. men willia dhe"
299,Kexholm,0513_0515,"Altså dömes dhem sitt kiöp att framhålla och sam lägning effterlåfwen att fullborda effter 1 Cap: i Kiöpmåhl B. men willia dhe sådant kiöp och Stadga icke hålla, så skola dhe först restituera till Leutnan"
300,Kexholm,0513_0515,"mhålla och sam lägning effterlåfwen att fullborda effter 1 Cap: i Kiöpmåhl B. men willia dhe sådant kiöp och Stadga icke hålla, så skola dhe först restituera till Leutnanten dhe penning:r som dhe op¬ buri"
301,Kexholm,0513_0515,"he penning:r som dhe op¬ burit hafwa, sampt gifwa Leutnampten halfwa Legona dher at effter dhe sitt kiöp icke hålla wille, effter dhet 10 Cap: i Bygnar ge Belken Stl. och sättia Borgen för sigh effter dhe"
302,Kexholm,0515_0517,"ig förstått något förbundh här till dag warit, att dhe icke skulle på den orten få Tiära obehindrat kiöpa af hwilken sin dhem tiära kunde tillföra, såsom dhe dhes föruthan ringa eller altringen handel haf"
303,Kexholm,0515_0517,"e förwära, hwarföre dhe och förmodade sigh i detta fallet; det hafwa något peccerat, men huadh andt kiöp som öffterklagas, Så tillstå Borgerskapet att dhet war otillbörligit att bönderne å landet, så wäll"
304,Kexholm,0515_0517,"örligit att bönderne å landet, så wäll som an¬ den privat Pärßoner och herrars betjänte skola sådan kiöp¬ Jöran såsom eij en Bonde i Kexholms Lähn och Willila Bem:te Kettola förnimmes idka och dröfwa, dhe"
305,Kexholm,0521_0523,"estituera men Smöret som twistas om, skall wågzedelen ifrån Nyen opwijsas opå, effter det 5. Cap: i Kiöpm: B. St. och Den 22 Novembris werord: Wå Skugu- 16 Cap: i Rådstugu B. dag, närwarande Borgmestare o"
306,Kexholm,0522_0524,p. 15. Gabriel Hinnas emot TobakzInspectoren Erich Hansson N:o 12 p. 15. Gabriel Hinnel opbödh till kiöp sin förbrände källare N:o 22 ö: 17. Gabriel Hinnel emot Hindrich Pirhonen. N.o 26. p. 19. N:o 32 p.
307,Kexholm,0526_0528,"lden till wachtmestaren, och sökia sitt igen af Ryssen det bästa han gitter Lijkmätigt det 8 Cap: i Köpmål. 3 st. Stl. Den 12 februarij och ord: Rådstugu dag när- warense på Wälb:ne h:r Landzhöfdingens w"
308,Kexholm,0527_0529,  Sen bonde ifrån Sackula Sochn Thomas Kopio bem:d gaf tillkänna huruledes han för 3 åhr sedan hade kiöpt en häst af en Borgare Eskill Haikonen och gifwit honom dherföre 55 D.r K.m:t hwilket 2 öre garen E
309,Kexholm,0527_0529," D.r K m:t och sökia sitt igen hoos Hindrich Perarinen, det bäste han förmå. Lijkmätig det 5 Cap: i Köpmål. 2 st. St. och 20 Cap Bygg: B. St:. Den 23 Aprilis wed ord: Rådstugudag närwarande Borgmester oc"
310,Kexholm,0528_0530,"d wittnen tillbiuder sigh bewijsa saken annorledes sammanhängia, så wäl som hwarest han sitt derfft köpt, Nembl. af en Ryss Jörgen Wässiligh som hafft sitt qvarter hoos en Soldat, hans Klockare be:d hwil"
311,Kexholm,0528_0530,"sitt vittne Hind: Hansson Klockare, som hade och att framwijsa if. samma slog berefft som Isak hade kiöpt af Ryssen torgen wasiliof, hwilket skulle wara af ett stycke, med dhet som war uthi nedandelarne a"
312,Kexholm,0529_0531,"68 det kom till att Confereras, befans dhet af Ryssen köpte Läre wara trij finger smalare och icke öfwerens komma med troden och fynheeten. Rätten badh att M"
313,Kexholm,0529_0531,"unsterskrifwaren skulle tillsee hur han kunde bewijs att dett war samma slagz therefft som han hade kiöpt af Ryssen.  Munsterskrifwaren swarade sigh samma Lärefft hade kaf af Ryssen, som befans i Nedz ede"
314,Kexholm,0529_0531,"arade sigh samma Lärefft hade kaf af Ryssen, som befans i Nedz edellarne, wiste intet Soldaten hade kiöpt af samma stycke, som han kiöpe Soldaten Hindrich Klockare, påstår sigh samma gång köpt af samma st"
315,Kexholm,0529_0531,"af af Ryssen, som befans i Nedz edellarne, wiste intet Soldaten hade kiöpt af samma stycke, som han kiöpe Soldaten Hindrich Klockare, påstår sigh samma gång köpt af samma stycke med munsterskrifwaren. och"
316,Kexholm,0529_0531,"ldaten hade kiöpt af samma stycke, som han kiöpe Soldaten Hindrich Klockare, påstår sigh samma gång köpt af samma stycke med munsterskrifwaren. och dhet han nu från wijste wore af samma lärfft; hwilket d"
317,Kexholm,0529_0531,"l des Ryßen Jugegen Waßiliof kunse komma tillstädes, af hwilken Mönsterskrifwaren samma därfft hade köpt, effter Mönsterskrifwaren säger att så wijsa Rästen cke kännes wed samma Lärefft, så är iag så där"
318,Kexholm,0536_0538,"gerskapetz wägen att Ante Kettolain ifrån willala och Refunders bonde, att han haf:r giort en stoor köpkegan med Tiära och Salt. hafwande beliggiandes i Mielis 100 t:r dher af 20 t.r allareda skall war b"
319,Kexholm,0539_0541,"s Påelßons hustru Maria Johansdotter, som skulle hon Maria öfwerfallit denne Zittman, widh dett hon kiöpslagade medh een bonde om Rofwor, medh olydelige skälßord, ibland annat medh deße formalier: du äst "
320,Kexholm,0542_0544,"n att hafwa för- brutit öhlet till Konungen och Stadhen, och böthe sina 3 mkr effter dett 25 Cap: i Köpmål. B.r St. Effter afsagd Sentens gaf Rätten öhlet åth beslagaren och hans Consorter som ditt opspa"
321,Kexholm,0544_0546,ijn i resterar altså 4½ mkr. Kmt hwilcka han nu strax skulle till krydi betala effter att H. Cap. i Kiöpmål. B: St 6. Dömbdes Johan Muhelo att betala till Sigfredh Mattzsons Enckia 4 ½ D:r Kmt: innan 14 d
322,Kexholm,0544_0546,nister wore Lars Kuha och Påel Tucke- lain. Dömbdes Johan Johanson att betala opå 2 t:r Tiä- ra han kiöpt uthaf een bonde Heike Johanßon i Ossalax 2 D:r Km:t som ännu resterade effter dett 16 Cap. i Rådst
323,Kexholm,0551_0553,"Sal. Capitein Mårten Erichsson aldrig hade innehafft dett stycket, som H. Capi- tein Spång med Sal. Köpmans änckia twistar om, uthan war Sal. Capitein Mårten Erichßons gårdz gårdh widh den gamble stugu k"
324,Kexholm,0557_0559,"andes förwisso hwem den samma borttagit hafwer; berättandes Jeremias, att han förledne wintras hade kiöpt af Victor Gröön een Tåpp Såcker, märckt medh krijta medh F:e F. meena- des den samme wara af samma"
325,Kexholm,0557_0559," meena- des den samme wara af samma slagz Såcker, som han af handelsmannen i Nyen Anthoni Timmerman kiöpt och uthi der förkombne Eek fierdingen inlagt hafwer; Samma såcker Tap seger Jeremias sigh ännu haf"
326,Kexholm,0563_0565,"Hendrich Michelßon Simon Lefwoska  Emedan borgaren Clemet Radika sielf bekän- ner sigh hafwa slutit kiöp medh borgaren Johan Eskilßon, och försäkrat att föreskaffa honom 30. Ståckar, sampt 20 balkar och s"
327,Kexholm,0563_0565,"t hafwer, som han och alt sådant sielf tillstår; Altså dömes han Ra¬ dika att fullgiöra sitt slutne kiöp med Johan Eskilßon och skaffa honom anten så många Ståckar, balckar och bräder som han honom emot 1"
328,Kexholm,0563_0565,"t åsämber och skall böta sina 3 mkr för dett han samme Ståckar twem försåldt, effter deth 14 Cap. i kiöpmål:n Bn St – Men att han med hand- Rågh be:de Ståckar StyckJunckaren Olof Bengtz son Updragit, för "
329,Kexholm,0563_0565,"nd- Rågh be:de Ståckar StyckJunckaren Olof Bengtz son Updragit, för än han dem sidst till den 3:die Kiöpmannen ofwan be:te Behm försåldt, som han dett och sielf tillstår, doch samma kiöp ey welat eller ku"
330,Kexholm,0563_0565,"st till den 3:die Kiöpmannen ofwan be:te Behm försåldt, som han dett och sielf tillstår, doch samma kiöp ey welat eller kunnat hemula, hwar öfwer StyckJunckaren sig nu beswärar, att och han af honom såled"
331,Kexholm,0566_0568,"warade sigh fuller blifwit så myckit till Gabriel, men förmeente sådant wara decour- terat uthi ett kiöp af een koo, om hwilckes wärde der warit eensse à 16 D.r Men Gabriel påstoodh inständigt att dhe eij"
332,Kexholm,0566_0568,"llfredz der medh och cedera desse 4 D:r af koowärdet, effter dhe eij hafft någre wittnen widh samma kiöp i dett och Gabriel medh uthsträckte fingrar å lagbook præsterade; hwar före Uphäfwes Mattz Jäskelä "
