,parent,file,context
0,s1,0024_0024,"arit Men 21 Men Ryttken bewiste det han intet Poutia Legdt, uthan hans Camrat Johan Mutka som hafwa Skutan medh honom äger, ty må och Mutka betahla löhnen säger Ryttken, det och Poutia till- ståår att Mutk"
1,s1,0025_0025,"ttken att betahla till Mårten Poutia halfwa Båtzmans löhnen, effter han förleden sommars oppå deras skuuta tient bewijsandes Mutka medh Oloff Afwin och Matz Juain som medh på skuutan warit, att Poutia uthi "
2,s1,0025_0025,"leden sommars oppå deras skuuta tient bewijsandes Mutka medh Oloff Afwin och Matz Juain som medh på skuutan warit, att Poutia uthi all tingh som bäg- ges drängh warit och så wähl Ryttkens som Mutkas saaker "
3,s1,0284_0285,"för samma lådia Men dhe öfrige 42 D:r som dispu- terlige äro opskiutes till nestkom- mande wåhr, då skutan på nyo lastas kan; På hwilket kiöp Hendirch och Lars Wares tillstå sig bekommit 24 D:r 24 / KMt, b"
4,s1,0423_0423,"idstledne Julij opdragit honom Nembl. Brun, för hans giorda 60 D:r för alt prætension uthi pant sin skutas Segell och Anckar, innom 8 dagar at inlösa, så at Brun allenast uthaf deße ifrån Wählb:ne H.r Slåt"
5,s1,0423_0423,cka begge medh een Mun bekände 1:o att Brun icke med sin egen hand tagit Seglen af Skepparen Pullis Skuta uthan dhe 51. uthan dhe blifwit honom gifne af dhe ifrån Slåttet uthsändne executions karlarne. 2:o
6,s1,0423_0423,"ahls Comissarien Nigrӕlium uti honom här uthinnan angifwande, kun- nandes han sökia sin Man den han Skutan under Skieppare och Styrmans nampn förtrodt hwilc- ken Pulli jembwähl han obligerar sigh at wara s"
