,parent,file,context
0,Brahea,0259_0260,"r sedan – „ 20 dal:r Kop- M:t, och eij kan bekomma sitt igen, Såsom och förplichtat sigh – „ 5 D:rs Interesse. Kärki swa- rade, föregaff, att hafwa dher på betalt – „ 16 d:r 8 öre, Medh Partzeler, Nembl:n 2 ℔ "
1,Brahea,0259_0260,"o. Rester allenast – D:r 3 „ 24 hade och månge andra Inwendningar. Sastamoin protesterade på 5 Åhrs Interesse. Altså war Rät- tens Omdöme, Nu emedan Kärki ähr een fatti Carl, och rester allenast på Capitalet –"
2,Brahea,0259_0260,"allenast på Capitalet – „ 3 D:r 8 öre Så ehrkänner Rätten, att han den betalar medh - 1 D:r 16 öres interesse, Och dett öfrige interess aff intet wärde. p. A:o 1675. d: 2 Augusti, höltes Ord: Rådh- Stugu dagh."
3,Brahea,0294_0296,"nampten swaradhe, att han hafwer lent honom 100 D:r Kop:r Mynt och Lofwat honom 1 tunna Rågh, uthom interesse, för det han finge behålla penningarna i Tu Åhrss tijdh, uthan afkårtadhe 1 RD:r in Spe: för Rågh t"
4,Brahea,0294_0296,"g till fälla sådana Ordh, Sandman tillsporde Leutenampten om icke bem:te 100 dahl. wore betalt medh interesse Eller och Han wille framtee Hanß Obligation, Hwar till Leutenanten swaradhe, att han leet Fixera si"
