,parent,file,context
0,Brahea,0166_0167,"h E Gäldz fordran ej ahngår Consistorium att omdöma, Såsom och högel protesterade för sin afresande skuldh, sijne uthtagde på ningar, att winna ett utslagh: Derföre och saken företogz, och effter noga betän"
1,Brahea,0191_0192,"e som –3 st. små - bållar p. 3. Kuifwalatar tillspordes, hwadan hon sådana saker fådt, och för hwar skuldh hon sådant hoos sigh hadhe, att ropadhe sigh på een afleden gammell Hustro ifrån Eri- Sicilia Ander"
2,Brahea,0206_0207,"till Wiljakain – 1 tio Smör- eller hwadh dedh kåstar. Och sedankastamoin söker bör- den om sin egen skuld dedh bäst han gitter Framkor, Ifwar Sabbathin och föredrogh Rätten att Oloff Remes hafwer för - 2 å"
3,Brahea,0231_0232,"wen bonde ifrån Hapajärwi by och Pielis Pogåst, Elias Kouckare benembd, denne Rätten. att han honom skyldigh ähr – 10 D.r 3 öre Kåpp:s myndt, och eij kan mechtigh blifwa Kouckare inlade een Rekning, Och de"
4,Brahea,0231_0232," me- ra bekommit, ähr - 1to 11 mk. Smör och för - 1 D.r 11 pre- fåårskin, Blifwer så Elias Kouckare skyldigh – „ 4 D 27 öre, som Rätten dömmer honom adt betahla. Anno 1674 d: 30 Maij höltes Ordin: Rådh stu"
5,Brahea,0259_0260," ingalunda draga sigh Undan, uthan ju förr, ju heller. Ladhe in een Rächning här emoth, att han war skyldigh till Åthskillige Personer – „ 36 D:r 28 öre Kopp:r M:t. Item Kyrckioheerdens Wäll:de H:r Lars, i"
6,Brahea,0290_0292,"sina hender, ty han Spelar bårt dem; Erich Alholm sadhe Endoch engångh till H Erich föreffter- taal skuldh, att han ingalundha tager koon till att föda uthan för Penningar. Anders Alholm föregaf Poiken Flo-"
7,Brahea,0291_0293,"tillstädes warit hafwer, Stadzskrifwa- ren Carll Lukasson och Hans Hortananj, der han gör Pu- hacka skyldigh 72 D 28 öre K: M:t Puhacka företrädde och opwijste en Specification hwarcken af dato eller [?] u"
8,Brahea,0291_0293,"ch H: Mar- co. Altså resolverade Borgmestare och Rådh, Emedan h. Erich i Nurmis för den Långa wegen skuldh Nembl. - ,, 10 mijhl icke kan så stadigt wara wedh"
