,parent,file,context
0,RO_1684-1687,0011_0011,"en fram- stuhlen; Reus sadhe sig hafwa hittat knijfwen i höstas under Luhrskans huus, då han fördhe balkar up från Stran- dhen, och dhen såldt åth foreraren för en kanna öhl, bekiännandhes der jämpte sig ha"
1,RO_1697,0096_0097,"moot lögerdagen ifrån Possola stulit een Handelssmannens Balck Plåta om 10 st: Sex fambnars bijlade Balkar eller så kallade Sparrar, som skola kosta honom 2 D:r 6 ö: Km:t st:n begiärandes straff opå dem, ef"
2,RO_1697,0096_0097,"llade Sparrar, som skola kosta honom 2 D:r 6 ö: Km:t st:n begiärandes straff opå dem, effter om han Balkarna igen bekommit, enär dhe warit i wärcket begrepne dem till andra att försällia. Swaranderne tillst"
3,RO_1697,0145_0146,"annen Claes Berg bedian- des, där hoos att den arrest som Bergen låtit läggia opå någre dess bylade balkar kunde emoot Sufficient Caution relaxeras Bergen inwänder, att denne Saak utj skiem- ner Rättens Pro"
4,RO_1697,0145_0146,"lssmannen Dobin repeterar priora, förmenandes lagen medgifwa, det han emoot Caution kunde få lyffta Balkarne effter som han warit Possessor H rå. dessuthan och som Ciembnen Rätten opå hans andökiande skall "
5,RO_1697,0145_0146,"Advocat till denne saak uthförande, som skall angå ähra och redligheet; men så wijda desse twi tige Balkar icke ännu befinnes wara be- sichtigade, dij resolverades här öfwer således: att 283. 283. Carl dobb"
6,RO_1697,0145_0146," sichtigade, dij resolverades här öfwer således: att 283. 283. Carl dobbin Claes Berg eng: twistige balkar. + Ciembner Rätt:n blif:t anhölt giör d: det han och medh"
7,RO_1697,0146_0147,"t alldenstundh den arrest, som opå dhe emel- lan Handelssmannen Carl Dobbin och Claes Berg twistige Balkar blifwit lagder, intet kan relaxeras, så wijda berde Balkar icke än nu äre besichtigade, warandes de"
8,RO_1697,0146_0147,"nnen Carl Dobbin och Claes Berg twistige Balkar blifwit lagder, intet kan relaxeras, så wijda berde Balkar icke än nu äre besichtigade, warandes denne saak allareda utj Ciembnär Rätten anhengigh giord. Förd"
