,parent,file,context
0,RO_1697,0079_0080," hwarföre han sielf till Slachtaren betalt 3 D. 24 /: Tijo tappar Råg miöhl a 6 D: 8 ö�:, een Cap:a korn gryn à 1 D: 8 öf:r een Cap:a ärter 1 D:, 16 ö: ½ Ltt humbla för 3 D:, een borkad huud å 3 D: 8 ö�, "
1,RO_1697,0091_0092,"ndan och inrådande stulit utur lijnwäf- warens Boda 2 L℔ 12 mkr kiött, 10 Capp:r Råg- miöhl, 1 Cap: Korn Gryn, 1 tpr Erter ½ L℔ ham- bla, 1 barkad huud, een wallmars Wijta 3 all:r Walmar och något Salt St"
2,RO_1697,0152_0153,"nen Påhl Hindrichson, och alldenstund effter oprättadt Specification Styrmannens underhåld uti Råg, korn, kött, Smör, Salt och Humbla Humbla, som han åthnutit dhe 3, Mågoder han in- gen Tienst giordt, sig"
3,RO_1697,0235_0236,":r Råg, jembwäl om Bö¬ sten 696, 3: gångor een wacka i sänder sampt hans Broder Jören een gång, och korn hade dhe stulit 4 resor; Nu i höstas hade dhe äfwenwähl affördt if:n håfwet een killing och 3. giäs"
4,RO_1697,0235_0236," Amptman påstod att ifrån Håffz¬ åkren wore af 25. skylar, Råg igen af skurne och emoot en half Rya korn bortstulen; Rätten lät anstå detta ährendet till dess den på beropade Jören Kiskoin kan ehrtappas o"
